113-6754681-0914617	15-Dec-2023	10-Jan-2024	Approved	DBJS4ys9RRMA	 	AmazonPrePaidLabel	6.03	USD	UPS	1ZC1G2149015987707	Seller	N	N	B09LFY2ZMZ	DSSCCXYBNP-HoHoHoPants-XL	Mickey Goofy Donald Duck as Santa Ho Ho Ho Christmas Lounge Pants	1	CR-DEFECTIVE	Y	C-Returns	StandardRefund	 	 	35.64	2	 	 	 	 	 	21.37
114-0979814-6012226	17-Dec-2023	10-Jan-2024	Approved	Dkx64WsZRRMA	 	AmazonPrePaidLabel	5.93	USD	USPS	9302010949890022785422	Seller	N	N	B0BGV7FJ8Q	103018-CousinEddieOrangeHose	Vacation Movie Cousin Eddie Halloween Costume Accessory Orange Hose	1	CR-UNWANTED_ITEM	Y	C-Returns	RefundAtFirstScan	 	 	21.42	1	ORDER_IN_RE_SELLABLE_CONDITION	40060-63080-4420153	NOGRANT	02-Feb-2024	 	21.42
114-3351921-8733864	29-Dec-2023	10-Jan-2024	Approved	Dtxq4YsgRRMA	 	AmazonPrePaidLabel	5.17	USD	USPS	9302010949890022763901	Seller	N	N	B075FWWL9R	1147-BeastWigandBeard	Beast Adult Costume Wig and Beard	1	AMZ-PG-BAD-DESC	Y	C-Returns	RefundAtFirstScan	 	 	28.90	1	BUYER_USED_WRONG_RETURN_REASON_CODE	84030-12021-8249849	GRANT	07-Feb-2024	5.17	28.90
112-8732536-0749836	09-Dec-2023	10-Jan-2024	Approved	DsxL4ZsCRRMA	 	AmazonPrePaidLabel	6.03	USD	UPS	1ZC1G2149015979065	Seller	N	N	B01LXJD1LR	starwars168-2X	Disney Funny Ugly Christmas Sweater for Women and Men | Easy Pull On Closure | Perfect for Ugly Sweater Parties, Festive Gatherings, Halloween Events and Movie Marathons	1	AMZ-PG-APP-TOO-SMALL	Y	C-Returns	RefundAtFirstScan	 	 	50.59	1	ORDER_IN_RE_SELLABLE_CONDITION	77983-65403-4634568	NOGRANT	15-Feb-2024	 	50.59
113-6532167-6111452	06-Jan-2024	10-Jan-2024	Approved	Dtxh4Ms1RRMA	 	AmazonPrePaidLabel	4.74	USD	USPS	9302010949890022777700	Customer	N	N	B0145Q36OQ	waldocostumeDELUXE-XL	Where's Waldo DELUXE Costume Set (Adult X-Large)	1	CR-ORDERED_WRONG_ITEM	Y	C-Returns	AutomatedRefund	 	 	54.59	1	 	 	 	 	 	22.02
112-3441334-1959422	08-Dec-2023	10-Jan-2024	Approved	DKRP4jsMRRMA	 	AmazonPrePaidLabel	5.80	USD	USPS	9302010949890022756903	Seller	N	N	B0BGV7FJ8Q	103018-CousinEddieOrangeHose	Vacation Movie Cousin Eddie Halloween Costume Accessory Orange Hose	1	CR-UNWANTED_ITEM	Y	C-Returns	RefundAtFirstScan	 	 	21.15	1	ORDER_IN_RE_SELLABLE_CONDITION	25479-05530-3237766	NOGRANT	08-Feb-2024	 	21.15
112-6925244-4457036	01-Jan-2024	10-Jan-2024	Approved	DtR14GsQRRMA	 	AmazonPrePaidLabel	5.43	USD	UPS	1ZC1G2149015935736	Seller	N	N	B001PKZMR0	napoleonaccesssory-M	Napoleon Dynamite Adult Vote For Pedro T-Shirt and Accessory Kit (Medium)	1	CR-SWITCHEROO	Y	Amazon CS	Replacement	 	 	42.49	1	 	 	 	 	 	42.49
112-3034402-1281815	07-Dec-2023	10-Jan-2024	Approved	DkRK4DsFRRMA	 	AmazonPrePaidLabel	6.03	USD	UPS	1ZC1G2149015934326	Seller	N	N	B0CFYPMSHX	62RBL-MerryKrampusUCS-5XL	Mad Engine Merry Krampus Head All Over Festive Pattern Ugly Christmas Sweater Red	1	AMZ-PG-APP-TOO-SMALL	Y	C-Returns	RefundAtFirstScan	 	 	51.49	1	ORDER_IN_RE_SELLABLE_CONDITION	92265-49352-7312858	NOGRANT	02-Feb-2024	 	51.49
111-7179767-8112236	06-Jan-2024	10-Jan-2024	Approved	DFRV4tsyRRMA	 	AmazonPrePaidLabel	3.97	USD	USPS	9302010949890022755760	Seller	N	N	B09DXLSDJ1	PRangersShirtYouth-Blue-XS	Power Rangers Mighty Morphin Blue Boys Youth Armor Costume T-Shirt(XS, Blue)	1	AMZ-PG-APP-TOO-SMALL	Y	C-Returns	RefundAtFirstScan	 	 	50.80	1	INVALID_SELLER_REFUND_OR_DEBIT	52525-86725-5433960	GRANT	08-Feb-2024	27.95	50.80
114-5423920-3870667	17-Dec-2023	10-Jan-2024	Approved	D8px4XsCRRMA	 	AmazonPrePaidLabel	7.39	USD	UPS	1ZC1G2149015919441	Seller	N	N	B0CQ3YVLQ2	custom-bigpackage-S	Funny TV and Movie Pop Culture Adult Unisex Ugly Sweaters (12 Different Designs)	1	AMZ-PG-APP-TOO-SMALL	Y	C-Returns	StandardRefund	 	 	46.75	1	 	 	 	 	 	 
113-5991019-0239445	19-Dec-2023	10-Jan-2024	Approved	Dtpn4DslRRMA	 	AmazonPrePaidLabel	6.80	USD	UPS	1ZC1G2149015918639	Seller	N	N	B076HG8GGL	CY034-ChristmasStoryUnionSuit-M	Briefly Stated A Christmas Story Bunny Union Suit Pajama Costume (Adult Medium) Pink	1	CR-MISSED_ESTIMATED_DELIVERY	Y	C-Returns	StandardRefund	 	 	143.89	2	INVALID_EVIDENCE	99215-50428-1106112	NOGRANT	31-Jan-2024	 	71.95
112-8769355-2506661	18-Dec-2023	10-Jan-2024	Approved	DYpZ4nsGRRMA	 	AmazonPrePaidLabel	5.93	USD	USPS	9302010949890022747598	Seller	N	N	B0CLHC81BY	DRS0012-GrinchWreathSwtr-L	Grinch Head Santa Hat Wreath Snowflakes Ugly Christmas Sweater Red	1	CR-DEFECTIVE	Y	C-Returns	RefundAtFirstScan	 	 	51.90	1	 	 	 	 	 	51.90
113-6274785-8885068	17-Dec-2023	10-Jan-2024	Approved	DWp14qsJRRMA	 	AmazonPrePaidLabel	4.15	USD	USPS	9302010949890022725381	Seller	N	N	B07HHKLSRN	WuTangLoungePants-LN0010-52-XXL	Wu Tang Clan Logo Yellow and Black Lounge Pants (Adult XX-Large)	1	AMZ-PG-APP-TOO-LARGE	Y	C-Returns	AutomatedRefund	 	 	22.74	1	INVALID_SELLER_REFUND_OR_DEBIT	48052-48150-7125514	GRANT	02-Feb-2024	4.15	22.74
113-3792596-0625810	15-Dec-2023	10-Jan-2024	Approved	DkpQ4rszRRMA	 	AmazonPrePaidLabel	6.03	USD	UPS	1ZC1G2149015894674	Seller	N	N	B0CKKN5N57	NSSM-NarutoShipSweater-5XL	Naruto Shippuden Sasuke Chibi Ramen Holiday Snowflakes Ugly Christmas Sweater Multicolor	1	AMZ-PG-APP-TOO-LARGE	Y	C-Returns	StandardRefund	 	 	60.63	1	 	 	 	 	 	 
114-5271078-3729057	04-Dec-2023	10-Jan-2024	Approved	DLny43sQRRMA	 	AmazonPrePaidLabel	6.80	USD	UPS	1ZC1G2149015878567	Seller	N	N	B01LBRLC0W	100576BROWN-M	Caribbean Pirate Boots Halloween Costume Cosplay Accessory Brown	1	AMZ-PG-APP-TOO-SMALL	Y	C-Returns	AutomatedRefund	 	 	81.23	1	ORDER_IN_RE_SELLABLE_CONDITION	45570-16350-0232851	NOGRANT	20-Feb-2024	 	81.23
113-4249524-2441005	03-Jan-2024	09-Jan-2024	Approved	DsqT4wscRRMA	 	AmazonPrePaidLabel	4.31	USD	USPS	9302010949890022708476	Seller	N	N	B08LQQL3JS	PowerRangers-White-SLShirt-2XL	Power Rangers White Costume T-Shirt(White,XXL)	1	CR-QUALITY_UNACCEPTABLE	Y	C-Returns	StandardRefund	 	 	21.69	1	 	 	 	 	 	 
111-6311368-5760250	02-Jan-2024	09-Jan-2024	Approved	DHqs4fsRRRMA	 	AmazonPrePaidLabel	4.24	USD	USPS	9302010949890022722946	Seller	N	N	B0055DRMIU	astroboy001-L	Astro Boy Scott Pilgrim vs. The World Heather Red Adult T-Shirt Tee (Adult Large)	1	AMZ-PG-APP-TOO-SMALL	Y	C-Returns	RefundAtFirstScan	 	 	20.43	1	ORDER_IN_RE_SELLABLE_CONDITION	84839-87859-8722460	NOGRANT	06-Feb-2024	 	20.43
111-5935639-1483454	01-Jan-2024	09-Jan-2024	Approved	DFPr4ZspRRMA	 	AmazonPrePaidLabel	6.03	USD	UPS	1ZC1G2149015839251	Seller	N	N	B0BBJGXWGV	66634105-YellowStoneJacket-XL	Changes Yellowstone Dutton Ranch Zip Up Vest Jacket	1	CR-SWITCHEROO	Y	C-Returns	RefundAtFirstScan	 	 	37.66	1	 	 	 	 	 	37.66
113-1046306-9193028	01-Dec-2023	09-Jan-2024	Approved	DxPR4ZsLRRMA	 	AmazonPrePaidLabel	6.44	USD	UPS	1ZC1G2149015831660	Seller	N	N	B0147ARIWQ	sharkcostume-teen	Left Shark Dancing Mascot Blue Zip Jumpsuit Halloween Costume Cosplay	1	CR-DEFECTIVE	Y	C-Returns	StandardRefund	 	 	 	1	 	 	 	 	 	 
114-1663899-6433827	28-Nov-2023	09-Jan-2024	Approved	DsPv4zssRRMA	 	AmazonPrePaidLabel	7.39	USD	UPS	1ZC1G2149015817588	Seller	N	N	B0147ARM18	sharkcostume-M-L	Left Shark Dancing Mascot Blue Zip Jumpsuit Halloween Costume Cosplay	1	CR-DEFECTIVE	Y	C-Returns	StandardRefund	 	 	127.10	2	 	 	 	 	 	63.55
114-3894404-1261032	02-Jan-2024	09-Jan-2024	Approved	DqP34NscRRMA	 	AmazonPrePaidLabel	5.43	USD	UPS	1ZC1G2149015824301	Seller	N	N	B000LNE67O	Joes001-M	Dodgeball Adult Unisex Movie Average Joe's Team Halloween Cosplay T-Shirt Yellow	1	AMZ-PG-APP-TOO-SMALL	Y	C-Returns	AutomatedRefund	 	 	39.90	2	INVALID_SELLER_REFUND_OR_DEBIT	62070-54981-2354444	GRANT	02-Feb-2024	5.43	19.95
112-2290409-9086669	11-Dec-2023	09-Jan-2024	Approved	DfKLHWsCRRMA	 	AmazonPrePaidLabel	6.44	USD	UPS	1ZC1G2149015809864	Seller	N	N	B07KWHSHC3	FilthyAnimalSweaterUCS-M	Merry Christmas Filthy Animal Kevin Festive Holiday Ugly Chritmas Sweater Red	1	AMZ-PG-APP-TOO-SMALL	Y	C-Returns	StandardRefund	 	 	78.12	2	 	 	 	 	 	29.08
112-2290409-9086669	11-Dec-2023	09-Jan-2024	Approved	DfKLHWsCRRMA	 	AmazonPrePaidLabel	6.44	USD	UPS	1ZC1G2149015809864	Seller	N	N	B00U0HHBI2	CVSM2258-MooseHead-M	Ripple Junction Family Christmas Sweaters - Red and Black Vacation Fun Old Fashioned Family Xmas Ugly Christmas Sweater for Women or Men | Crew Neck Knitted Eggnog Moose Mug Winter Holiday Sweater	1	CR-QUALITY_UNACCEPTABLE	Y	C-Returns	StandardRefund	 	 	78.12	2	 	 	 	 	 	42.10
114-5855416-7734639	04-Dec-2023	09-Jan-2024	Approved	DjKHHMsdRRMA	 	AmazonPrePaidLabel	6.78	USD	USPS	9302010949890022679080	Seller	N	N	B00U0I6EO8	KRSM2011-KrampusSweater-S	Ripple Junction Krampus Knit Ugly Christmas Sweater Black	1	AMZ-PG-APP-TOO-SMALL	Y	C-Returns	RefundAtFirstScan	 	 	61.97	1	INVALID_SELLER_REFUND_OR_DEBIT	37369-33242-2360744	GRANT	08-Feb-2024	9.5	61.97
113-7928062-1768210	05-Dec-2023	09-Jan-2024	Approved	DvKVHDs7RRMA	 	AmazonPrePaidLabel	6.03	USD	UPS	1ZC1G2149015797869	Seller	N	N	B07JVNH4WD	CY034-ChristmasStoryUnionSuit-3XL	Briefly Stated A Christmas Story Bunny Union Suit Pajama Costume (Adult 3X-Large) Pink	1	AMZ-PG-APP-TOO-SMALL	Y	C-Returns	StandardRefund	 	 	64.90	1	 	 	 	 	 	 
112-8388959-1521831	18-Dec-2023	09-Jan-2024	Approved	DrKZHHs7RRMA	 	AmazonPrePaidLabel	5.93	USD	USPS	9302010949890022668176	Seller	N	N	B0BGT1K2YQ	GuyFieryCompleteSet-M	Famous Guy Feir Chef Shirt Glasses Wig Beard Halloween Costume Set Complete Cosplay	1	CR-DEFECTIVE	Y	C-Returns	StandardRefund	 	 	52.95	1	 	 	 	 	 	 
111-0252117-3929035	19-Dec-2023	09-Jan-2024	Approved	DYK6Hts4RRMA	 	AmazonPrePaidLabel	6.80	USD	UPS	1ZC1G2149015788191	Seller	N	N	B082948ZQW	CarpetWetTodd-RedBlack-3XL	Ugly Christmas Sweater Why is The Carpet All Wet, Todd? (Adult, 3X-Large, Red and Black)	1	AMZ-PG-APP-TOO-LARGE	Y	C-Returns	StandardRefund	 	 	85.24	2	 	 	 	 	 	 
111-0252117-3929035	19-Dec-2023	09-Jan-2024	Approved	DYK6Hts4RRMA	 	AmazonPrePaidLabel	6.80	USD	UPS	1ZC1G2149015788191	Seller	N	N	B0829633JS	DontKnowMargoUCS-GreenRed-3XL	Ugly Christmas Sweater I Don't Know Margo (Adult, 3X-Large, Green and Red)	1	AMZ-PG-APP-TOO-LARGE	Y	C-Returns	StandardRefund	 	 	85.24	2	 	 	 	 	 	 
111-1704011-5821820	10-Dec-2023	09-Jan-2024	Approved	DrXRH8shRRMA	 	AmazonPrePaidLabel	7.19	USD	UPS	1ZC1G2149015793390	Seller	N	N	B07KTD5G41	NL029-ChristmasVacationPajamaSet-XXL	Briefly Stated National Lampoon's Dinosaur Christmas Vacation Pajamas Set | Perfect for Ugly Sweater Parties, Matching Xmas Pajamas for Family	1	AMZ-PG-APP-STYLE	Y	C-Returns	AutomatedRefund	 	 	210.74	4	 	 	 	 	 	52.95
112-0608807-8804203	23-Dec-2023	09-Jan-2024	Approved	DTXHHms5RRMA	 	AmazonPrePaidLabel	6.44	USD	UPS	1ZC1G2149015781714	Seller	N	N	B09M911CBV	20341-ReindeerTrophyHeadLED-XL	Reindeer Trophy Head 3D LED Lights Ugly Christmas Sweater Red	1	CR-MISSED_ESTIMATED_DELIVERY	Y	C-Returns	RefundAtFirstScan	 	 	57.53	1	BUYER_USED_WRONG_RETURN_REASON_CODE	50432-51712-3185121	GRANT	12-Feb-2024	2.95	57.53
112-3585439-2641860	31-Dec-2023	09-Jan-2024	Approved	DxXxHmsCRRMA	 	AmazonPrePaidLabel	4.24	USD	USPS	9302010949890022674443	Seller	N	N	B075MK482T	JLSN219-TuneSquadLOLA-M	Space Jam Tune Squad Logo Lola Bunny #10 White Basketball Jersey (Adult Medium)	1	AMZ-PG-APP-TOO-LARGE	Y	C-Returns	AutomatedRefund	 	 	52.33	2	 	 	 	 	 	37.40
114-9057622-0592255	15-Dec-2023	09-Jan-2024	Approved	DQX5HzsLRRMA	 	AmazonPrePaidLabel	6.03	USD	UPS	1ZC1G2149015774213	Seller	N	N	B015JT8MU6	uglysweater44-XXXL	National Lampoon Vacation Shitter's Full Ugly Christmas Sweater (Adult XXX-Large) Red, White	1	CR-ORDERED_WRONG_ITEM	Y	C-Returns	RefundAtFirstScan	 	 	47.95	1	ORDER_IN_RE_SELLABLE_CONDITION	23346-22945-4366823	NOGRANT	31-Jan-2024	 	47.95
114-9438675-8669022	19-Oct-2023	09-Jan-2024	PendingApproval	 	 	 	 	 	 	 	Seller	Y	N	B0B4PK7BNN	220850-ChuckieCostume-12M	Chuckie Good Guy Doll Kids Costume Set Long Sleeve Shirt and Overalls Childrens Halloween Cosplay	1	CR-DEFECTIVE	N	Amazon CS	StandardRefund	 	 	99.54	2	 	 	 	 	 	 
114-9438675-8669022	19-Oct-2023	09-Jan-2024	PendingApproval	 	 	 	 	 	 	 	Seller	Y	N	B0BG98W625	103011-ChuckyKidsShoes-9-10	Unisex Halloween Chuckie Good Guy Child Doll Horror Movie Cosplay Costume Shoes	1	CR-DEFECTIVE	N	Amazon CS	StandardRefund	 	 	99.54	2	 	 	 	 	 	 
114-6689759-5400230	16-Oct-2023	09-Jan-2024	PendingApproval	 	 	 	 	 	 	 	Seller	Y	N	B09H7NKLG7	220850-ChuckieCostume-3-4T	Chuckie Good Guy Doll Kids Costume Set Long Sleeve Shirt and Overalls Childrens Halloween Cosplay	1	CR-DEFECTIVE	N	Amazon CS	StandardRefund	 	 	99.58	2	 	 	 	 	 	 
114-6689759-5400230	16-Oct-2023	09-Jan-2024	PendingApproval	 	 	 	 	 	 	 	Seller	Y	N	B0BG9LLYDF	103011-ChuckyKidsShoes-7-8	Unisex Halloween Chuckie Good Guy Child Doll Horror Movie Cosplay Costume Shoes	1	CR-DEFECTIVE	N	Amazon CS	StandardRefund	 	 	99.58	2	 	 	 	 	 	 
114-6152696-5141854	18-Dec-2023	09-Jan-2024	Approved	D4XpHkswRRMA	 	AmazonPrePaidLabel	4.09	USD	USPS	9302010949890022683148	Seller	N	N	B0CK4CDW85	RWTM0I2-YodaSweatshirtSet-5T	Star Wars Yoda Grogu The Cuteness is Strong in This One Green Sweatshirt and Pants Set (5T)	1	AMZ-PG-APP-TOO-SMALL	Y	C-Returns	StandardRefund	 	 	17.55	1	 	 	 	 	 	 
114-4299769-9201001	18-Dec-2023	09-Jan-2024	Approved	DsXZHLsBRRMA	 	AmazonPrePaidLabel	4.09	USD	USPS	9302010949890022672258	Seller	N	N	B0CK4CDW85	RWTM0I2-YodaSweatshirtSet-5T	Star Wars Yoda Grogu The Cuteness is Strong in This One Green Sweatshirt and Pants Set (5T)	1	AMZ-PG-APP-TOO-SMALL	Y	C-Returns	StandardRefund	 	 	16.31	1	 	 	 	 	 	 
113-9517908-8294605	25-Nov-2023	09-Jan-2024	Approved	D8XFHlsHRRMA	 	AmazonPrePaidLabel	6.03	USD	UPS	1ZC1G2149015759776	Seller	N	N	B00U0I6OG6	KRSM2011-KrampusSweater-XXL	Ripple Junction Krampus Knit Ugly Christmas Sweater Black	1	AMZ-PG-APP-TOO-LARGE	Y	C-Returns	RefundAtFirstScan	 	 	60.21	1	INVALID_SELLER_REFUND_OR_DEBIT	65522-79335-0158564	GRANT	22-Feb-2024	6.03	60.21
111-5556897-5673806	18-Dec-2023	09-Jan-2024	Approved	D7v2HcsCRRMA	 	AmazonPrePaidLabel	9.97	USD	UPS	1ZC1G2149015756322	Seller	N	N	B01LBRLC0W	100576BROWN-M	Caribbean Pirate Boots Halloween Costume Cosplay Accessory Brown	1	AMZ-PG-APP-TOO-SMALL	Y	C-Returns	AutomatedRefund	 	 	119.60	1	INVALID_SELLER_REFUND_OR_DEBIT	37720-80328-5099864	GRANT	05-Feb-2024	9.97	81.65
113-0290359-5108215	19-Dec-2023	09-Jan-2024	Approved	D4vsHws1RRMA	 	AmazonPrePaidLabel	10.67	USD	UPS	1ZC1G2149015749143	Seller	N	N	B00U0HHGZ0	CVSM2258-MooseHead-XL	Ripple Junction Family Christmas Sweaters - Red and Black Vacation Fun Old Fashioned Family Xmas Ugly Christmas Sweater for Women or Men | Crew Neck Knitted Eggnog Moose Mug Winter Holiday Sweater	1	CR-MISSED_ESTIMATED_DELIVERY	Y	C-Returns	StandardRefund	 	 	60.44	1	 	 	 	 	 	 
111-6341128-1162602	21-Nov-2023	09-Jan-2024	Approved	D85tHssWRRMA	 	AmazonPrePaidLabel	5.33	USD	USPS	9302010949890022624424	Seller	N	N	B09LFXZP83	SWSRHASBNP-SWHolidayFun-L	Star Wars Holiday Fun The Mandalorian Christmas Lounge Pants	1	AMZ-PG-APP-STYLE	Y	C-Returns	StandardRefund	 	 	17.58	1	 	 	 	 	 	 
111-1623092-3553865	10-Dec-2023	09-Jan-2024	Approved	DL5hHfs0RRMA	 	AmazonPrePaidLabel	6.03	USD	UPS	1ZC1G2149015698985	Seller	N	N	B082BJ69VW	EpsteinSweater-WhiteBlack-M	Epstein Didn't Kill Himself Ugly Christmas Sweater	1	AMZ-PG-APP-TOO-LARGE	Y	C-Returns	StandardRefund	 	 	44.70	1	 	 	 	 	 	44.70
113-9605577-7519409	18-Dec-2023	09-Jan-2024	Approved	DT57HPsMRRMA	 	AmazonPrePaidLabel	6.03	USD	UPS	1ZC1G2149015683740	Seller	N	N	B082963SKK	DontKnowMargoUCS-GreenRed-XL	Ugly Christmas Sweater I Don't Know Margo (Adult, X-Large, Green and Red)	1	CR-MISSED_ESTIMATED_DELIVERY	Y	C-Returns	StandardRefund	 	 	99.01	2	 	 	 	 	 	46.23
113-9605577-7519409	18-Dec-2023	09-Jan-2024	Approved	Ds5sH9sLRRMA	 	AmazonPrePaidLabel	6.03	USD	UPS	1ZC1G2149015672565	Seller	N	N	B082952ZPV	CarpetWetTodd-RedBlack-XL	Ugly Christmas Sweater Why is The Carpet All Wet, Todd? (Adult, X-Large, Red and Black)	1	CR-MISSED_ESTIMATED_DELIVERY	Y	C-Returns	AutomatedRefund	 	 	99.01	2	 	 	 	 	 	49.51
113-8031913-7819430	15-Dec-2023	09-Jan-2024	Approved	D25tHPsLRRMA	 	AmazonPrePaidLabel	5.80	USD	USPS	9302010949890022636380	Seller	N	N	B0CLHGL614	DRS0012-GrinchWreathSwtr-XL	Grinch Head Santa Hat Wreath Snowflakes Ugly Christmas Sweater Red	1	AMZ-PG-APP-TOO-SMALL	Y	C-Returns	StandardRefund	 	 	56.92	1	 	 	 	 	 	 
113-2238052-6633846	30-Nov-2023	09-Jan-2024	Approved	Dk5XHGscRRMA	 	AmazonPrePaidLabel	6.03	USD	UPS	1ZC1G2149015685711	Seller	N	N	B076HG5JMT	NL029-ChristmasVacationPajamaSet-L	Briefly Stated National Lampoon's Dinosaur Christmas Vacation Pajamas Set | Perfect for Ugly Sweater Parties, Matching Xmas Pajamas for Family	1	AMZ-PG-APP-TOO-SMALL	Y	C-Returns	RefundAtFirstScan	 	 	55.07	1	ORDER_IN_RE_SELLABLE_CONDITION	53277-32857-2193115	NOGRANT	12-Feb-2024	 	55.07
111-8872282-0921812	15-Dec-2023	09-Jan-2024	Approved	D4NQHRs6RRMA	 	AmazonPrePaidLabel	6.03	USD	UPS	1ZC1G2149015666554	Seller	N	N	B0CKC24XB8	CCX21-CokeHeartSweater-M	Coca Cola Heart Polar Bear Drinking Womens Ugly Christmas Sweater Multicolor	1	AMZ-PG-APP-TOO-LARGE	Y	C-Returns	RefundAtFirstScan	 	 	27.01	1	ORDER_IN_RE_SELLABLE_CONDITION	76880-16760-2195225	NOGRANT	12-Feb-2024	 	27.01
113-0931199-7336236	08-Jan-2024	09-Jan-2024	Approved	DpNnHxsPRRMA	 	AmazonPrePaidLabel	6.03	USD	UPS	1ZC1G2149015663673	Seller	N	N	B00195ZPVO	PolkHighJersey-XL	Married with Children Al Bundy Polk High 33 Blue Football Jersey Costume (X-Large)	1	AMZ-PG-BAD-DESC	Y	C-Returns	AutomatedRefund	 	 	88.65	2	BUYER_USED_WRONG_RETURN_REASON_CODE	37677-93147-7226869	GRANT	22-Feb-2024	8.0	44.32
114-5986510-3679400	21-Nov-2023	09-Jan-2024	Approved	D2N8HGsLRRMA	 	AmazonPrePaidLabel	4.13	USD	USPS	9302010949890022621003	Seller	N	N	B002QSTHP8	topgun002-M	Top Gun Logo and Maverick Name Adult Heather Navy T-Shirt (Adult Medium)	1	AMZ-PG-APP-TOO-SMALL	Y	C-Returns	AutomatedRefund	 	 	21.95	1	ORDER_IN_RE_SELLABLE_CONDITION	67218-57190-7580107	NOGRANT	19-Feb-2024	 	21.95
111-1818675-3686669	12-Dec-2023	09-Jan-2024	Approved	DtNWHzsYRRMA	 	AmazonPrePaidLabel	6.44	USD	UPS	1ZC1G2149015641106	Seller	N	N	B09HL8VSP3	100581-CousinEddieShoe-12	Cousin Eddie Christmas White Shoes Halloween Costume Footwear (Numeric_12)	1	AMZ-PG-APP-TOO-LARGE	Y	C-Returns	RefundAtFirstScan	 	 	69.95	1	INVALID_SELLER_REFUND_OR_DEBIT	71110-05181-6870231	GRANT	31-Jan-2024	6.44	69.95
111-3632161-7867444	14-Dec-2023	09-Jan-2024	Approved	DHNZHdsbRRMA	 	AmazonPrePaidLabel	4.74	USD	USPS	9302010949890022616979	Seller	N	N	B09LRGMKBJ	GDSA2851TV-GratDeadPants-XL	Ripple Junction Grateful Dead Steal Your Face Adult Sleep Lounge Pants	1	AMZ-PG-APP-TOO-SMALL	Y	C-Returns	RefundAtFirstScan	 	 	21.99	1	INVALID_SELLER_REFUND_OR_DEBIT	50311-69341-8323029	GRANT	19-Feb-2024	4.74	21.99
112-7425604-6836249	11-Dec-2023	09-Jan-2024	Approved	D7NvHPsRRRMA	 	AmazonPrePaidLabel	5.04	USD	USPS	9302010949890022614111	Seller	N	N	B0BKR4JGLP	NDLA0FGMBJ-AvatarPanelPants-S	Adult Unisex Avatar The Last Airbender Animated TV Series Jogger Lounge Pants	1	AMZ-PG-APP-TOO-LARGE	Y	C-Returns	RefundAtFirstScan	 	 	9.69	1	ORDER_IN_RE_SELLABLE_CONDITION	96119-10160-9850614	NOGRANT	08-Feb-2024	 	10.69
114-0273135-0061831	17-Dec-2023	09-Jan-2024	Approved	DW4NH7sgRRMA	 	AmazonPrePaidLabel	6.03	USD	UPS	1ZC1G2149015629540	Seller	N	N	B00U0HHGZ0	CVSM2258-MooseHead-XL	Ripple Junction Family Christmas Sweaters - Red and Black Vacation Fun Old Fashioned Family Xmas Ugly Christmas Sweater for Women or Men | Crew Neck Knitted Eggnog Moose Mug Winter Holiday Sweater	1	CR-SWITCHEROO	Y	C-Returns	Replacement	 	 	47.65	1	 	 	 	 	 	47.65
113-3655803-8446658	16-Dec-2023	09-Jan-2024	Approved	Dk4NHPsMRRMA	 	AmazonPrePaidLabel	5.93	USD	USPS	9302010949890022584377	Seller	N	N	B0BHM7R45Y	PABR029-PabstSweater-L	Mad Engine Pabst Fair Isle Beer Adult Unisex Holiday Ugly Christmas Sweater Multicolored	1	AMZ-PG-APP-TOO-SMALL	Y	C-Returns	RefundAtFirstScan	 	 	47.95	1	ORDER_IN_RE_SELLABLE_CONDITION	41286-50544-0714705	NOGRANT	01-Feb-2024	 	47.95
111-7311350-0289037	03-Jan-2024	09-Jan-2024	Approved	DK4GHmsLRRMA	 	AmazonPrePaidLabel	6.03	USD	UPS	1ZC1G2149015623564	Seller	N	N	B0CJ5PCDSR	103037-HighHellBoot-7	Harley Girl High Heels Boots Villain Squad Halloween Costume Cosplay White	1	CR-QUALITY_UNACCEPTABLE	Y	C-Returns	RefundAtFirstScan	 	 	59.95	1	ORDER_IN_RE_SELLABLE_CONDITION	38133-80540-0566211	NOGRANT	02-Feb-2024	 	59.95
112-3291870-6354660	30-Nov-2023	09-Jan-2024	Approved	DK4RH5sFRRMA	 	AmazonPrePaidLabel	3.90	USD	USPS	9302010949890022607236	Customer	N	N	B01MEGC2W9	RedBandanaYellowGlasses	Hulk Hogan Hulkamania Bandana Sunglasses Costume -Red-Yellow	1	CR-ORDERED_WRONG_ITEM	Y	C-Returns	StandardRefund	 	 	21.44	1	 	 	 	 	 	 
111-4979443-6109864	05-Jan-2024	09-Jan-2024	Approved	DHydHgsTRRMA	 	AmazonPrePaidLabel	6.80	USD	UPS	1ZC1G2149015601659	Seller	N	N	B01LBRLGPS	100576BLACK-M	Caribbean Pirate Boots Halloween Costume Cosplay Accessory	1	AMZ-PG-APP-TOO-SMALL	Y	C-Returns	RefundAtFirstScan	 	 	75.95	1	ORDER_IN_RE_SELLABLE_CONDITION	41217-02621-7831829	NOGRANT	02-Feb-2024	 	75.95
114-8174807-6841001	20-Dec-2023	09-Jan-2024	Approved	D2y1HvsvRRMA	 	AmazonPrePaidLabel	3.59	USD	USPS	9302010949890022568315	Seller	N	N	B07FXWKDXG	DSTS26MGS-WoodyJuniorsTshirt-L	Toy Story Woody Costume Juniors T-Shirt (Large)	1	AMZ-PG-APP-TOO-SMALL	Y	C-Returns	RefundAtFirstScan	 	 	26.92	1	INVALID_SELLER_REFUND_OR_DEBIT	95991-97054-1444416	GRANT	06-Feb-2024	8.95	26.92
112-4933588-6491400	11-Nov-2023	09-Jan-2024	Approved	DhynHXsbRRMA	 	AmazonPrePaidLabel	10.24	USD	UPS	1ZC1G2149015580315	Seller	N	N	B0147ARIWQ	sharkcostume-teen	Left Shark Dancing Mascot Blue Zip Jumpsuit Halloween Costume Cosplay	1	DID_NOT_LIKE_FABRIC	Y	C-Returns	RefundAtFirstScan	 	 	83.83	1	INVALID_SELLER_REFUND_OR_DEBIT	83225-69076-3315255	GRANT	31-Jan-2024	16.95	83.83
113-5194731-9881815	16-Dec-2023	09-Jan-2024	Approved	DLFHHQsGRRMA	 	AmazonPrePaidLabel	6.44	USD	UPS	1ZC1G2149015575072	Seller	N	N	B09CV8MWR9	204292-DeerRingSweater-3XL	Reindeer Ring Toss 3D Ugly Christmas Sweater Multicolored	1	AMZ-PG-APP-TOO-LARGE	Y	C-Returns	StandardRefund	 	 	59.16	1	 	 	 	 	 	 
111-4494801-0546627	27-Nov-2023	09-Jan-2024	Approved	DFF7H9scRRMA	 	AmazonPrePaidLabel	7.58	USD	UPS	1ZC1G2149015560739	Seller	N	N	B0B69XFWP9	102027-InfOrnament-15-White	Inflatable Oversized Ornaments Jumbo Christmas Balls 15" 18" 25" or 30" inches Holiday Decorations Indoor Outdoor	1	CR-MISSED_ESTIMATED_DELIVERY	Y	C-Returns	StandardRefund	 	 	106.44	3	 	 	 	 	 	22.98
111-4494801-0546627	27-Nov-2023	09-Jan-2024	Approved	DxFZHKsVRRMA	 	AmazonPrePaidLabel	7.58	USD	UPS	1ZC1G2149015561961	Seller	N	N	B09LJL5NDF	102026-InfOrnament-25-White	Inflatable Oversized Ornaments Jumbo Christmas Balls 15" 18" 25" or 30" inches Holiday Decorations Indoor Outdoor	2	CR-MISSED_ESTIMATED_DELIVERY	Y	C-Returns	StandardRefund	 	 	106.44	3	 	 	 	 	 	79.96
113-3009479-8008216	17-Dec-2023	09-Jan-2024	Approved	D2F8HtsHRRMA	 	AmazonPrePaidLabel	6.03	USD	UPS	1ZC1G2149015543874	Seller	N	N	B0BK21WJFH	267345-GrinchPJPants-L	MJC Adult Unisex Smiling Grinch All Over Santa Hat Christmas Pajama Lounge Pants	1	AMZ-PG-APP-TOO-LARGE	Y	C-Returns	AutomatedRefund	 	 	42.10	2	ORDER_IN_RE_SELLABLE_CONDITION	69914-38175-5689458	NOGRANT	19-Feb-2024	 	21.05
113-3009479-8008216	17-Dec-2023	09-Jan-2024	Approved	DvFWHFskRRMA	 	AmazonPrePaidLabel	6.03	USD	UPS	1ZC1G2149015555450	Seller	N	N	B0BK1X2KVS	267345-GrinchPJPants-M	MJC Grinch All Over Santa Hat Christmas Pajamas Lounge Pants	1	AMZ-PG-APP-TOO-LARGE	Y	C-Returns	AutomatedRefund	 	 	42.10	2	ORDER_IN_RE_SELLABLE_CONDITION	69914-38175-5689458	NOGRANT	19-Feb-2024	 	21.05
114-7994935-4028229	02-Dec-2023	09-Jan-2024	Approved	DH3CHxsKRRMA	 	AmazonUnPaidLabel	0.00	 	 	 	Seller	N	N	B0B69MJLSS	102028-InfOrnament-30-Green	Inflatable Oversized Ornaments Jumbo Christmas Balls 15" 18" 25" or 30" inches Holiday Decorations Indoor Outdoor	4	CR-MISSED_ESTIMATED_DELIVERY	Y	C-Returns	StandardRefund	 	 	566.65	14	 	 	 	 	 	 
114-7994935-4028229	02-Dec-2023	09-Jan-2024	Approved	DH3CHxsKRRMA	 	AmazonUnPaidLabel	0.00	 	 	 	Seller	N	N	B09LJRJTBL	102025-InfOrnament-18-Silver	Inflatable Oversized Ornaments Jumbo Christmas Balls 15" 18" 25" or 30" inches Holiday Decorations Indoor Outdoor	4	CR-MISSED_ESTIMATED_DELIVERY	Y	C-Returns	StandardRefund	 	 	566.65	14	 	 	 	 	 	 
114-7994935-4028229	02-Dec-2023	09-Jan-2024	Approved	DH3CHxsKRRMA	 	AmazonUnPaidLabel	0.00	 	 	 	Seller	N	N	B09LJ3CHLC	102026-InfOrnament-25-Red	Inflatable Oversized Ornaments Jumbo Christmas Balls 15" 18" 25" or 30" inches Holiday Decorations Indoor Outdoor	2	CR-MISSED_ESTIMATED_DELIVERY	Y	C-Returns	StandardRefund	 	 	566.65	14	 	 	 	 	 	 
114-7994935-4028229	02-Dec-2023	09-Jan-2024	Approved	DH3CHxsKRRMA	 	AmazonUnPaidLabel	0.00	 	 	 	Seller	N	N	B0B69MCX15	102028-InfOrnament-30-Blue	Inflatable Oversized Ornaments Jumbo Christmas Balls 15" 18" 25" or 30" inches Holiday Decorations Indoor Outdoor	4	CR-MISSED_ESTIMATED_DELIVERY	Y	C-Returns	StandardRefund	 	 	566.65	14	 	 	 	 	 	 
114-7389478-8213800	01-Jan-2024	09-Jan-2024	Approved	 	 	AmazonUnPaidLabel	0.00	 	 	 	Seller	N	N	B0BM54DWDB	NDSS0K5M-PineappleHousePants-L	Spongebob Squarepants Pineapple House Lounge Pants	1	AMZ-PG-APP-TOO-LARGE	Y	C-Returns	ReturnlessRefund	 	 	10.70	1	 	 	 	 	 	10.70
113-6022305-3198640	01-Nov-2023	09-Jan-2024	Approved	DQ38HDsvRRMA	 	AmazonPrePaidLabel	6.03	USD	UPS	1ZC1G2149015527945	Seller	N	N	B076HFQHF7	CY034-ChristmasStoryUnionSuit-XL	Briefly Stated A Christmas Story Bunny Union Suit Pajama Costume (Adult X-Large)	1	AMZ-PG-APP-TOO-SMALL	Y	C-Returns	RefundAtFirstScan	 	 	63.55	1	INVALID_SELLER_REFUND_OR_DEBIT	44305-17064-3655415	GRANT	01-Feb-2024	6.03	63.55
114-2575481-0809041	11-Dec-2023	09-Jan-2024	Approved	D83CHfsVRRMA	 	AmazonPrePaidLabel	5.93	USD	USPS	9302010949890022566953	Seller	N	N	B0BK1X2DJ3	267345-GrinchPJPants-XL	MJC Grinch All Over Santa Hat Christmas Pajamas Lounge Pants	1	AMZ-PG-APP-TOO-LARGE	Y	C-Returns	StandardRefund	 	 	23.60	1	 	 	 	 	 	 
114-7884234-4169814	02-Jan-2024	09-Jan-2024	Approved	DskpHcsCRRMA	 	AmazonPrePaidLabel	6.78	USD	USPS	9302010949890022552994	Seller	N	N	B0CJ5L3NQJ	221000-GreenMonsterRedShoe-6-7	Green Monster Christmas Movie Red Shoes with Bells Santa Claus Elf Costume	1	AMZ-PG-APP-TOO-SMALL	Y	C-Returns	RefundAtFirstScan	 	 	60.17	1	ORDER_IN_RE_SELLABLE_CONDITION	10360-75122-2028325	NOGRANT	08-Feb-2024	 	60.17
