113-3438479-1733867	18-Dec-2023	05-Jan-2024	Approved	DfqGbVsnRRMA	 	AmazonPrePaidLabel	6.80	USD	UPS	1ZC1G2149012897784	Seller	N	N	B015JT8NQY	uglysweater44-XL	National Lampoon Vacation Shitter's Full Ugly Christmas Sweater (Adult X-Large) Red, White	1	AMZ-PG-BAD-DESC	Y	C-Returns	StandardRefund	 	 	93.67	2	 	 	 	 	 	43.74
111-4233093-0737050	18-Dec-2023	05-Jan-2024	Approved	DWqVbms3RRMA	 	AmazonPrePaidLabel	9.63	USD	UPS	1ZC1G2149012897631	Seller	N	N	B00U0HHJ1Q	CVSM2258-MooseHead-2X	Ripple Junction Family Christmas Sweaters - Red and Black Vacation Fun Old Fashioned Family Xmas Ugly Christmas Sweater for Women or Men | Crew Neck Knitted Eggnog Moose Mug Winter Holiday Sweater	1	AMZ-PG-APP-TOO-LARGE	Y	C-Returns	RefundAtFirstScan	 	 	51.65	1	REIMBURSE	30277-54289-0829534	GRANT	26-Feb-2024	 	53.90
113-1017218-9416266	06-Dec-2023	05-Jan-2024	Approved	DkqQb1sMRRMA	 	AmazonPrePaidLabel	6.03	USD	UPS	1ZC1G2149012900028	Seller	N	N	B076HFQHF7	CY034-ChristmasStoryUnionSuit-XL	Briefly Stated A Christmas Story Bunny Union Suit Pajama Costume (Adult X-Large)	1	AMZ-PG-APP-TOO-SMALL	Y	C-Returns	RefundAtFirstScan	 	 	64.90	1	ORDER_IN_RE_SELLABLE_CONDITION	30119-29523-9866163	NOGRANT	19-Feb-2024	 	64.90
112-5122712-1045047	05-Dec-2023	05-Jan-2024	Approved	D4qJb7svRRMA	 	AmazonPrePaidLabel	4.88	USD	USPS	9302010949890021272947	Customer	N	N	B0BC2C8BWK	220936-LegLampSkirt-L-XL	Xmas Movie Women's Christmas Leg Lamp Skirt Halloween Costume Cosplay	1	CR-UNWANTED_ITEM	Y	C-Returns	RefundAtFirstScan	 	 	52.33	1	 	 	 	 	 	47.45
111-5838829-0673042	26-Nov-2023	05-Jan-2024	Approved	D5qPb3sFRRMA	 	AmazonPrePaidLabel	5.52	USD	USPS	9302010949890021272534	Seller	N	N	B0BGV7FJ8Q	103018-CousinEddieOrangeHose	Vacation Movie Cousin Eddie Halloween Costume Accessory Orange Hose	1	AMZ-PG-APP-STYLE	Y	C-Returns	AutomatedRefund	 	 	42.30	2	INVALID_SELLER_REFUND_OR_DEBIT	49899-17322-5339834	GRANT	27-Feb-2024	5.52	21.15
112-1992229-5878609	21-Dec-2023	05-Jan-2024	Approved	DWqKbVs9RRMA	 	AmazonPrePaidLabel	6.03	USD	UPS	1ZC1G2149012893797	Seller	N	N	B015WWTIVW	waynesworldcostumeset002-M	Wayne's World Costume Set - Waynes Hat and Aerosmith Aero Force T-shirt 90s Retro for Halloween	1	CR-UNAUTHORIZED_PURCHASE	Y	C-Returns	RefundAtFirstScan	 	 	74.52	2	INVALID_EVIDENCE	89935-60360-6222850	NOGRANT	04-Feb-2024	 	37.26
111-1419586-3385042	19-Dec-2023	05-Jan-2024	Approved	DjqjbfsHRRMA	 	AmazonPrePaidLabel	4.24	USD	USPS	9302010949890021247808	Seller	N	N	B07BS2437X	hulk001N-L	Costume Agent Yellow Hulk Hogan T-Shirt for Men & Women	1	DID_NOT_LIKE_FABRIC	Y	C-Returns	RefundAtFirstScan	 	 	23.95	1	 	 	 	 	 	23.95
113-7233412-3337069	17-Dec-2023	05-Jan-2024	Approved	DTq4byskRRMA	 	AmazonPrePaidLabel	5.33	USD	USPS	9302010949890021264980	Seller	N	N	B00U0HNNJ8	OESM2387TV-DwightBeetsSweater-S	Ripple Junction The Office Dwight Schrute Christmas Beets Ugly Christmas Sweater (Small) Green	1	CR-MISSED_ESTIMATED_DELIVERY	Y	C-Returns	RefundAtFirstScan	 	 	54.32	1	 	 	 	 	 	54.32
112-9946324-2543419	21-Dec-2023	05-Jan-2024	Approved	D8PZbmslRRMA	 	AmazonPrePaidLabel	6.44	USD	USPS	9302010949890021259986	Customer	N	N	B0B8K2JV5T	220898-EllenGirswold-M	Adult Vacation Movie Ellen Griswold Character Top Skirt Halloween Costume	1	CR-QUALITY_UNACCEPTABLE	Y	C-Returns	RefundAtFirstScan	 	 	61.97	1	 	 	 	 	 	58.53
112-4649960-1581814	19-Dec-2023	05-Jan-2024	Approved	DrPHbXs6RRMA	 	AmazonPrePaidLabel	4.74	USD	USPS	9302010949890021259696	Seller	N	N	B09LRHCZ1X	GDSA2851TV-GratDeadPants-L	Ripple Junction Grateful Dead Steal Your Face Adult Sleep Lounge Pants	1	AMZ-PG-APP-TOO-SMALL	Y	C-Returns	RefundAtFirstScan	 	 	21.35	1	INVALID_SELLER_REFUND_OR_DEBIT	74089-24282-1040269	GRANT	06-Feb-2024	4.74	21.35
113-1830026-7338624	18-Dec-2023	05-Jan-2024	Approved	DsPrbDsPRRMA	 	AmazonPrePaidLabel	5.43	USD	UPS	1ZC1G2149012875477	Seller	N	N	B09L9SSG37	220838-FilthyAnimalSlipper-10	Costume Agent Merry Christmas Ya Animal Home Movie Slippers	1	AMZ-PG-APP-TOO-LARGE	Y	C-Returns	StandardRefund	 	 	24.90	1	 	 	 	 	 	 
113-9875116-8673026	05-Dec-2023	05-Jan-2024	Approved	DkPqbJsvRRMA	 	AmazonPrePaidLabel	6.80	USD	UPS	1ZC1G2149012863060	Seller	N	N	B0B94FQTHS	220899-MarvCostume-XL	Marv from Alone Movie Cardigan and Jacket Halloween Costume Cosplay	1	CR-DEFECTIVE	Y	C-Returns	RefundAtFirstScan	 	 	82.41	1	BUYER_USED_WRONG_RETURN_REASON_CODE	83450-38876-7899816	GRANT	05-Feb-2024	6.8	86.41
111-9117321-9489831	03-Dec-2023	05-Jan-2024	Approved	DtPZbks9RRMA	 	AmazonPrePaidLabel	6.78	USD	USPS	9302010949890021243473	Seller	N	N	B0BHM7R45Y	PABR029-PabstSweater-L	Mad Engine Pabst Fair Isle Beer Adult Unisex Holiday Ugly Christmas Sweater Multicolored	1	AMZ-PG-APP-TOO-SMALL	Y	C-Returns	RefundAtFirstScan	 	 	53.82	1	INVALID_SELLER_REFUND_OR_DEBIT	31315-94606-0122257	GRANT	28-Feb-2024	6.78	53.82
114-9191899-0541820	16-Dec-2023	05-Jan-2024	Approved	D8Pbb4skRRMA	 	AmazonPrePaidLabel	6.80	USD	UPS	1ZC1G2149012854918	Seller	N	N	B08F2Q8N54	bigl032-4XL	Lebowski Jeffrey The Dude Zip Up Costume Cardigan Sweater Halloween Cosplay Beige	1	AMZ-PG-APP-TOO-LARGE	Y	C-Returns	StandardRefund	 	 	98.88	2	 	 	 	 	 	 
112-3556333-3385856	14-Dec-2023	05-Jan-2024	Approved	DpKlkNsjRRMA	 	AmazonPrePaidLabel	6.09	USD	USPS	9302010949890021238905	Seller	N	N	B0BKQV54WF	SJTS0VMMLO-HPOHexCityHoodie-M	Mad Engine The Simpsons Bart and Maggie Skeleton Hex and the City Pull Over Hoodie Blue	1	AMZ-PG-APP-TOO-LARGE	Y	C-Returns	StandardRefund	 	 	45.55	1	 	 	 	 	 	 
111-4499471-6567464	17-Dec-2023	05-Jan-2024	Approved	DLKMkKsPRRMA	 	AmazonPrePaidLabel	6.03	USD	UPS	1ZC1G2149012840110	Seller	N	N	B0CKC24XB8	CCX21-CokeHeartSweater-M	Coca Cola Heart Polar Bear Drinking Womens Ugly Christmas Sweater Multicolor	1	AMZ-PG-APP-TOO-LARGE	Y	C-Returns	RefundAtFirstScan	 	 	24.95	1	INVALID_SELLER_REFUND_OR_DEBIT	62541-11365-3353414	GRANT	30-Jan-2024	6.03	24.95
112-1167191-6683463	14-Dec-2023	05-Jan-2024	Approved	DWKBkwsLRRMA	 	AmazonPrePaidLabel	7.03	USD	UPS	1ZC1G2149012835920	Seller	N	N	B0BNLN9CTG	DSSCA5KMN2-MickeyMousePJSet-M	Mickey Mouse Since 1928 Christmas 2 Piece Pajama Set Multicolor	2	AMZ-PG-APP-TOO-SMALL	Y	C-Returns	AutomatedRefund	 	 	55.80	4	INVALID_SELLER_REFUND_OR_DEBIT	36515-15037-5357516	GRANT	04-Feb-2024	7.03	27.90
113-2680431-7168226	14-Dec-2023	05-Jan-2024	Approved	DQXykPspRRMA	 	AmazonPrePaidLabel	5.43	USD	UPS	1ZC1G2149012813015	Seller	N	N	B002W8S4NI	bigl020-XL	The Big Lebowski The Dude Abides Ugly Christmas Sweater (X-Large) Red	1	CR-MISSED_ESTIMATED_DELIVERY	Y	C-Returns	StandardRefund	 	 	61.46	1	 	 	 	 	 	 
114-7509172-7264221	11-Dec-2023	05-Jan-2024	Approved	D8XskhsKRRMA	 	AmazonPrePaidLabel	5.43	USD	UPS	1ZC1G2149012819055	Seller	N	N	B00Q7HHKIK	christmaslights001	Light-Up LED Ugly Christmas Sweater Ornaments Multi Color	1	AMZ-PG-APP-STYLE	Y	C-Returns	RefundAtFirstScan	 	 	16.28	1	ORDER_IN_RE_SELLABLE_CONDITION	44234-03941-5103369	NOGRANT	07-Feb-2024	 	16.28
113-3108785-2877860	19-Dec-2023	05-Jan-2024	Approved	DKXfkjsKRRMA	 	AmazonPrePaidLabel	7.39	USD	UPS	1ZC1G2149012818645	Seller	N	N	B0CM9S5QT9	221033-SantaRidingTRex-L	Santa Claus Riding T-Rex on Moon Pixelated Funny Ugly Christmas Sweater Multicolor	1	AMZ-PG-APP-TOO-LARGE	Y	C-Returns	RefundAtFirstScan	 	 	45.41	1	ORDER_IN_RE_SELLABLE_CONDITION	28333-44660-7915222	NOGRANT	28-Jan-2024	 	45.41
113-6618973-2648259	17-Dec-2023	05-Jan-2024	Approved	D4XrkZs6RRMA	 	AmazonPrePaidLabel	3.90	USD	USPS	9302010949890021224168	Seller	N	N	B015EICWUI	mm001Nblu-XS	M&M M&M's Candy Blue Silly Character Face Adult T-Shirt (X-Small)	1	AMZ-PG-APP-TOO-SMALL	Y	C-Returns	StandardRefund	 	 	21.60	1	 	 	 	 	 	 
111-5888009-0540253	15-Dec-2023	05-Jan-2024	Approved	D2XtkrstRRMA	 	AmazonPrePaidLabel	6.03	USD	UPS	1ZC1G2149012814050	Seller	N	N	B00U0HHL64	CVSM2258-MooseHead-3X	Ripple Junction Family Christmas Sweaters - Red and Black Vacation Fun Old Fashioned Family Xmas Ugly Christmas Sweater for Women or Men | Crew Neck Knitted Eggnog Moose Mug Winter Holiday Sweater	1	AMZ-PG-APP-TOO-SMALL	Y	C-Returns	AutomatedRefund	 	 	64.58	1	 	 	 	 	 	52.63
114-0883301-9964221	12-Dec-2023	05-Jan-2024	Approved	DFXJk1snRRMA	 	AmazonPrePaidLabel	6.80	USD	UPS	1ZC1G2149012808450	Seller	N	N	B07NSDZZ6V	ILoveXmasUCS-L	Costume Agent Light Up Christmas Sweater with Bells on Sleeves - I Love Xmas HOHOHO Ugly Christmas Sweater for Women & Men | Red and White Stripes, Green Xmas Tree Holiday Sweater with LED Lights	1	AMZ-PG-APP-TOO-SMALL	Y	C-Returns	StandardRefund	 	 	112.00	2	 	 	 	 	 	69.95
112-6592385-2460235	15-Dec-2023	05-Jan-2024	Approved	DQXGkRsxRRMA	 	AmazonPrePaidLabel	6.03	USD	UPS	1ZC1G2149012803599	Seller	N	N	B01LX7MHKZ	starwars168-4X	Disney Funny Ugly Christmas Sweater for Women and Men | Easy Pull On Closure | Perfect for Ugly Sweater Parties, Festive Gatherings, Halloween Events and Movie Marathons	1	AMZ-PG-APP-TOO-SMALL	Y	C-Returns	RefundAtFirstScan	 	 	52.63	1	ORDER_IN_RE_SELLABLE_CONDITION	84141-68440-3109231	NOGRANT	30-Jan-2024	 	52.63
112-2370705-2513037	15-Dec-2023	05-Jan-2024	Approved	D5XckHszRRMA	 	AmazonPrePaidLabel	4.74	USD	USPS	9302010949890021226872	Seller	N	N	B00U0HYCMU	BQSM3410TV-BobsBurgersLouise-S	Bobs Burgers Louise Appreciate Your Lack of Sarcasm Christmas Sweater (Adult Small)	1	CR-DAMAGED_BY_CARRIER	Y	C-Returns	RefundAtFirstScan	 	 	48.14	1	 	 	 	 	 	48.14
111-9485601-7765859	19-Dec-2023	05-Jan-2024	Approved	DWXHkssRRRMA	 	AmazonPrePaidLabel	6.44	USD	UPS	1ZC1G2149012790746	Seller	N	N	B0094KM16S	soaleathervest-XL	TV Store SOA Sons of Anarchy Black Leather Highway Biker Vest (Adult X-Large)	1	DID_NOT_LIKE_FABRIC	Y	C-Returns	StandardRefund	 	 	79.90	2	 	 	 	 	 	 
111-9485601-7765859	19-Dec-2023	05-Jan-2024	Approved	DvvSkRsfRRMA	 	AmazonPrePaidLabel	6.44	USD	UPS	1ZC1G2149012789329	Seller	N	N	B0099U0LZ6	soahat005-L/XL	Sons of Anarchy SOA Reaper Crew Fitted Baseball Cap Hat (Adult Large/X-Large) Black	1	DID_NOT_LIKE_FABRIC	Y	C-Returns	StandardRefund	 	 	79.90	2	 	 	 	 	 	 
114-9008747-8369027	25-Nov-2023	05-Jan-2024	Approved	DKvLkZsCRRMA	 	AmazonPrePaidLabel	6.03	USD	UPS	1ZC1G2149012783709	Seller	N	N	B07KTGXXSP	NL029-ChristmasVacationPajamaSet-3XL	Briefly Stated National Lampoon's Dinosaur Christmas Vacation Pajamas Set | Perfect for Ugly Sweater Parties, Matching Xmas Pajamas for Family	1	AMZ-PG-APP-TOO-LARGE	Y	C-Returns	RefundAtFirstScan	 	 	49.95	1	ORDER_IN_RE_SELLABLE_CONDITION	51373-77002-3163353	NOGRANT	05-Feb-2024	 	49.95
113-3667011-6805843	09-Dec-2023	05-Jan-2024	Approved	DZvXkjsxRRMA	 	AmazonPrePaidLabel	6.03	USD	UPS	1ZC1G2149012780720	Seller	N	N	B076HFSX43	CY034-ChristmasStoryUnionSuit-L	Briefly Stated A Christmas Story Bunny Union Suit Pajama Costume (Adult Large) Pink	1	CR-UNWANTED_ITEM	Y	C-Returns	RefundAtFirstScan	 	 	63.85	1	INVALID_SELLER_REFUND_OR_DEBIT	19374-72933-7304369	GRANT	02-Feb-2024	6.03	63.85
111-8884949-5662651	19-Dec-2023	05-Jan-2024	Approved	Dtvmk6sMRRMA	 	AmazonPrePaidLabel	6.03	USD	UPS	1ZC1G2149012778199	Seller	N	N	B08PM9KZXR	RWTM09-BabyYodaUCS-XL	Star Wars Baby Yoda The Child Forces Trees Ugly Christmas Sweater (X-Large) Black	1	AMZ-PG-APP-TOO-SMALL	Y	C-Returns	AutomatedRefund	 	 	49.95	1	ORDER_IN_RE_SELLABLE_CONDITION	97073-16982-4215652	NOGRANT	02-Feb-2024	 	49.95
111-6896851-3502637	07-Dec-2023	05-Jan-2024	Approved	DtvLkBs1RRMA	 	AmazonPrePaidLabel	6.03	USD	UPS	1ZC1G2149012771632	Seller	N	N	B0BHZS7V1W	103008-ElfShoes-10-11	Buddy The Elf Christmas Costume Shoes	1	CR-DEFECTIVE	Y	C-Returns	AutomatedRefund	 	 	46.95	1	BUYER_USED_WRONG_RETURN_REASON_CODE	64243-88291-4909260	GRANT	30-Jan-2024	6.03	46.95
114-0267279-7274635	08-Dec-2023	05-Jan-2024	Approved	DhvCkmszRRMA	 	AmazonPrePaidLabel	6.80	USD	UPS	1ZC1G2149012765407	Seller	N	N	B07L5W8L22	Thing1-6-UnionSuit-ADULT-L	Dr Seuss Thing 1 & 2 Interchangeable Patches Adult or Kids Pajama Costume	1	CR-UNWANTED_ITEM	Y	C-Returns	RefundAtFirstScan	 	 	120.29	2	 	 	 	 	 	60.15
114-7323371-1465843	19-Dec-2023	05-Jan-2024	Approved	DFvxk0s4RRMA	 	AmazonPrePaidLabel	4.44	USD	USPS	9302010949890021220412	Seller	N	N	B07FWC787M	BoxingRobe-Black	Halloween Costume Boxing Robe with Hood Custom Personalized Cosplay	1	CR-MISSING_PARTS	Y	C-Returns	RefundAtFirstScan	 	 	29.31	1	 	 	 	 	 	29.31
114-3118840-6637037	28-Nov-2023	05-Jan-2024	Approved	D8vNktsHRRMA	 	AmazonPrePaidLabel	6.03	USD	UPS	1ZC1G2149012765818	Seller	N	N	B0BBJ5JWZS	66634105-YellowStoneJacket-2XL	Changes Yellowstone Dutton Ranch Zip Up Vest Jacket	1	AMZ-PG-APP-TOO-SMALL	Y	C-Returns	RefundAtFirstScan	 	 	34.95	1	 	 	 	 	 	104.85
112-2271353-5331437	13-Dec-2023	05-Jan-2024	Approved	D4STk9s8RRMA	 	AmazonPrePaidLabel	5.43	USD	UPS	1ZC1G2149012745349	Seller	N	N	B0CKC2CJ3D	CCX21-CokeHeartSweater-S	Coca Cola Heart Polar Bear Drinking Womens Ugly Christmas Sweater Multicolor	1	CR-MISSED_ESTIMATED_DELIVERY	Y	C-Returns	AutomatedRefund	 	 	63.33	2	 	 	 	 	 	32.89
114-4578498-8305851	14-Dec-2023	05-Jan-2024	Approved	DHSMkXsCRRMA	 	AmazonPrePaidLabel	6.03	USD	UPS	1ZC1G2149012752966	Seller	N	N	B07JD2L3M6	CY034-ChristmasStoryUnionSuit-XXL	Briefly Stated A Christmas Story Bunny Union Suit Pajama Costume (Adult XX-Large) Pink	1	AMZ-PG-APP-TOO-SMALL	Y	C-Returns	RefundAtFirstScan	 	 	64.15	1	VALID_DIFFERENT_CONDITION_ITEM_RECEIVED	24337-37801-2282320	GRANT	15-Feb-2024	11.99	64.15
111-2466101-1722636	16-Dec-2023	04-Jan-2024	Approved	D2SmkdsVRRMA	 	AmazonPrePaidLabel	5.93	USD	USPS	9302010949890021198452	Seller	N	N	B08KWMZVH4	F1BW2368-FriendsCentralPerkUCS-L	Ripple Junction Friends Central Perk Wreath Ugly Christmas Sweater Red	1	CR-MISSED_ESTIMATED_DELIVERY	Y	C-Returns	StandardRefund	 	 	39.95	1	 	 	 	 	 	39.95
113-1323773-8410623	13-Dec-2023	04-Jan-2024	Approved	DtSWkwsDRRMA	 	AmazonPrePaidLabel	5.33	USD	USPS	9302010949890021173503	Seller	N	N	B01JGYNJ94	biglpants001-XXL	The Dude Lebowski Pajama Pants Halloween Costume Cosplay	1	CR-QUALITY_UNACCEPTABLE	Y	Amazon CS	AutomatedRefund	 	 	36.92	1	ORDER_IN_RE_SELLABLE_CONDITION	79356-21897-9289112	NOGRANT	26-Jan-2024	 	36.92
111-3203015-1685018	17-Dec-2023	04-Jan-2024	Approved	DQ50kWsyRRMA	 	AmazonPrePaidLabel	5.43	USD	UPS	1ZC1G2149012717521	Seller	N	N	B00U0HHBI2	CVSM2258-MooseHead-M	Ripple Junction Family Christmas Sweaters - Red and Black Vacation Fun Old Fashioned Family Xmas Ugly Christmas Sweater for Women or Men | Crew Neck Knitted Eggnog Moose Mug Winter Holiday Sweater	1	CR-MISSED_ESTIMATED_DELIVERY	Y	C-Returns	RefundAtFirstScan	 	 	56.90	1	BUYER_USED_WRONG_RETURN_REASON_CODE	10773-69554-7579738	GRANT	26-Feb-2024	11.95	56.90
113-5966116-0469817	20-Dec-2023	04-Jan-2024	Approved	D2NnkvsJRRMA	 	AmazonPrePaidLabel	5.43	USD	UPS	1ZC1G2149012695000	Seller	N	N	B0CLHC81BY	DRS0012-GrinchWreathSwtr-L	Grinch Head Santa Hat Wreath Snowflakes Ugly Christmas Sweater Red	1	AMZ-PG-APP-TOO-LARGE	Y	C-Returns	StandardRefund	 	 	42.75	1	 	 	 	 	 	 
111-1419586-3385042	19-Dec-2023	04-Jan-2024	Approved	DxNHkgs1RRMA	 	AmazonPrePaidLabel	3.75	USD	USPS	9302010949890021149553	Seller	N	N	B07BS2437X	hulk001N-L	Costume Agent Yellow Hulk Hogan T-Shirt for Men & Women	1	CR-DEFECTIVE	Y	C-Returns	Replacement	 	 	23.95	1	 	 	 	 	 	 
111-1940614-4457819	23-Dec-2023	04-Jan-2024	Approved	D4NBknskRRMA	 	AmazonPrePaidLabel	5.33	USD	USPS	9302010949890021162378	Seller	N	N	B00U0HYEKK	BQSM3410TV-BobsBurgersLouise-M	Bobs Burgers Louise Appreciate Your Lack of Sarcasm Christmas Sweater (Adult Medium)	1	AMZ-PG-APP-TOO-SMALL	Y	C-Returns	RefundAtFirstScan	 	 	48.81	1	ORDER_IN_RE_SELLABLE_CONDITION	91294-94980-4514863	NOGRANT	23-Jan-2024	 	48.81
112-5826274-3455410	15-Dec-2023	04-Jan-2024	Approved	DW46kgsWRRMA	 	AmazonPrePaidLabel	3.66	USD	USPS	9302010949890021162002	Seller	N	N	B01L2EGINK	rockyshorts-S	Rocky Black Italian Stallion Boxer Shorts (Adult Small)	1	AMZ-PG-APP-STYLE	Y	C-Returns	RefundAtFirstScan	 	 	23.05	1	ORDER_IN_RE_SELLABLE_CONDITION	19895-65147-6185100	NOGRANT	23-Jan-2024	 	23.05
111-3122066-5536227	31-Dec-2023	04-Jan-2024	Approved	DZ4jkbsKRRMA	 	AmazonPrePaidLabel	6.80	USD	UPS	1ZC1G2149012678707	Seller	N	N	B01LBRLGPS	100576BLACK-M	Caribbean Pirate Boots Halloween Costume Cosplay Accessory	1	AMZ-PG-APP-TOO-SMALL	Y	C-Returns	RefundAtFirstScan	 	 	81.46	1	INVALID_SELLER_REFUND_OR_DEBIT	97106-87289-0833203	GRANT	30-Jan-2024	6.8	81.46
111-7655007-2248248	31-Dec-2023	04-Jan-2024	Approved	DW4skzsGRRMA	 	AmazonPrePaidLabel	4.74	USD	USPS	9302010949890021161531	Seller	N	N	B09LRHCZ1X	GDSA2851TV-GratDeadPants-L	Ripple Junction Grateful Dead Steal Your Face Adult Sleep Lounge Pants	1	AMZ-PG-APP-TOO-SMALL	Y	C-Returns	RefundAtFirstScan	 	 	21.15	1	ORDER_IN_RE_SELLABLE_CONDITION	46089-28077-3517147	NOGRANT	05-Feb-2024	 	21.15
112-9558723-0687464	14-Dec-2023	04-Jan-2024	Approved	Df4TkwsnRRMA	 	AmazonPrePaidLabel	6.03	USD	UPS	1ZC1G2149012671624	Seller	N	N	B08KWMJZT7	F1BW2368-FriendsCentralPerkUCS-3XL	Ripple Junction Friends Central Perk Wreath Ugly Christmas Sweater Red	1	AMZ-PG-APP-TOO-SMALL	Y	C-Returns	RefundAtFirstScan	 	 	39.95	1	 	 	 	 	 	39.95
111-6123517-8437810	02-Jan-2024	04-Jan-2024	Approved	DW4kkKsxRRMA	 	AmazonPrePaidLabel	3.99	USD	USPS	9302010949890021161272	Seller	N	N	B007W58NMI	arrested011-XL	Arrested Development Distressed Bluth's Original Frozen Banana Royal Blue Heather Mens T-shirt (Adult X-Large)	1	CR-DEFECTIVE	Y	C-Returns	Replacement	 	 	24.33	1	 	 	 	 	 	 
111-7951141-7461855	01-Dec-2023	04-Jan-2024	Approved	DK4nkNs3RRMA	 	AmazonPrePaidLabel	6.03	USD	UPS	1ZC1G2149012664758	Seller	N	N	B07KQL8K8R	GrinchTrumpUCS-4XL	You're a Mean One Mr. Trump Grinch Adult Ugly Christmas Sweater (4X-Large) Multicolored	1	AMZ-PG-APP-TOO-SMALL	Y	C-Returns	RefundAtFirstScan	 	 	26.88	1	ORDER_IN_RE_SELLABLE_CONDITION	60054-07432-1936401	NOGRANT	19-Feb-2024	 	26.88
111-1843365-5053057	23-Nov-2023	04-Jan-2024	Approved	DF4rk1sLRRMA	 	AmazonPrePaidLabel	6.03	USD	UPS	1ZC1G2149012665720	Seller	N	N	B076HFKLDY	NL029-ChristmasVacationPajamaSet-XL	Briefly Stated National Lampoon's Dinosaur Christmas Vacation Pajamas Set | Perfect for Ugly Sweater Parties, Matching Xmas Pajamas for Family	1	AMZ-PG-APP-TOO-SMALL	Y	C-Returns	RefundAtFirstScan	 	 	53.95	1	ORDER_IN_RE_SELLABLE_CONDITION	76742-98642-6370160	NOGRANT	28-Jan-2024	 	53.95
113-6532705-5713814	18-Dec-2023	04-Jan-2024	Approved	DW4ckRsbRRMA	 	AmazonPrePaidLabel	6.03	USD	UPS	1ZC1G2149012656749	Seller	N	N	B0CKC24XB8	CCX21-CokeHeartSweater-M	Coca Cola Heart Polar Bear Drinking Womens Ugly Christmas Sweater Multicolor	1	AMZ-PG-APP-TOO-LARGE	Y	C-Returns	RefundAtFirstScan	 	 	27.51	1	 	 	 	 	 	27.51
114-1118594-5864228	25-Dec-2023	04-Jan-2024	Approved	D74gkjskRRMA	 	AmazonPrePaidLabel	5.80	USD	USPS	9302010949890021138533	Seller	N	N	B0BKR131SV	SJTS0VNMLO-BartSquisheeHoodie-S	Mad Engine The Simpsons Bart Squishee Drink Pull Over Hoodie Sweatshirt Multicolor	1	AMZ-PG-APP-TOO-LARGE	Y	C-Returns	StandardRefund	 	 	30.22	1	 	 	 	 	 	23.93
112-3478532-2865831	14-Dec-2023	04-Jan-2024	Approved	DsyPkDs8RRMA	 	AmazonPrePaidLabel	5.04	USD	USPS	9302010949890021147146	Seller	N	N	B0CLHC81BY	DRS0012-GrinchWreathSwtr-L	Grinch Head Santa Hat Wreath Snowflakes Ugly Christmas Sweater Red	1	CR-ORDERED_WRONG_ITEM	Y	C-Returns	StandardRefund	 	 	57.80	1	 	 	 	 	 	 
113-9127565-3058663	21-Dec-2023	04-Jan-2024	Approved	DhyzkVsXRRMA	 	AmazonPrePaidLabel	5.43	USD	UPS	1ZC1G2149012646572	Seller	N	N	B07JFY6QQV	WuTangUnionSuit-LN0011-XXL	Wu Tang Clan Logo Toss Pajama Union Suit (Adult XX-Large) Black	1	CR-SWITCHEROO	Y	C-Returns	RefundAtFirstScan	 	 	44.61	1	 	 	 	 	 	44.61
112-2942420-8824213	24-Nov-2023	04-Jan-2024	Approved	DsytkbsTRRMA	 	AmazonPrePaidLabel	6.03	USD	UPS	1ZC1G2149012628645	Customer	N	N	B00U0HVT1W	uglysweater60-L	Seinfeld Festivus For The Rest Of Us Pole Cream Ugly Christmas Sweater, Long Sleeve (Adult Large)	1	AMZ-PG-APP-TOO-SMALL	Y	C-Returns	RefundAtFirstScan	 	 	45.67	1	 	 	 	 	 	41.94
112-9685229-7185808	07-Dec-2023	04-Jan-2024	Approved	DFyWk4sVRRMA	 	AmazonPrePaidLabel	6.44	USD	UPS	1ZC1G2149012617157	Seller	N	N	B018RHDDZG	ucs3d002-XL	Navy 3D Reindeer Moose Ugly Christmas Sweater (Adult X-Large)	1	DID_NOT_LIKE_FABRIC	Y	C-Returns	AutomatedRefund	 	 	72.03	1	INVALID_SELLER_REFUND_OR_DEBIT	83972-44633-7093527	GRANT	02-Feb-2024	6.44	72.03
114-2327732-6249842	07-Dec-2023	04-Jan-2024	Approved	DxyWkZsyRRMA	 	AmazonPrePaidLabel	5.43	USD	UPS	1ZC1G2149012633139	Seller	N	N	B00Q7HHKIK	christmaslights001	Light-Up LED Ugly Christmas Sweater Ornaments Multi Color	3	CR-UNWANTED_ITEM	Y	C-Returns	StandardRefund	 	 	48.33	3	 	 	 	 	 	 
112-6184000-4347459	08-Dec-2023	04-Jan-2024	Approved	DpyhkLskRRMA	 	AmazonPrePaidLabel	5.33	USD	USPS	9302010949890021116036	Seller	N	N	B0BM556HXB	NDSS0K5M-PineappleHousePants-XL	Spongebob Squarepants Pineapple House Lounge Pants	1	CR-UNWANTED_ITEM	Y	C-Returns	StandardRefund	 	 	10.77	1	 	 	 	 	 	 
111-8641170-7105862	09-Dec-2023	04-Jan-2024	Approved	DpF1kdsfRRMA	 	AmazonPrePaidLabel	6.44	USD	UPS	1ZC1G2149012612803	Seller	N	N	B09LG187G4	SWSRHASBNP-SWHolidayFun-S	Star Wars Holiday Fun The Mandalorian Christmas Lounge Pants	1	AMZ-PG-APP-TOO-LARGE	Y	C-Returns	AutomatedRefund	 	 	32.46	3	 	 	 	 	 	10.82
114-0883080-6966654	11-Nov-2023	04-Jan-2024	Approved	D5FVkksjRRMA	 	AmazonPrePaidLabel	3.64	USD	USPS	9302010949890021150092	Seller	N	N	B002STMH70	acwig	Saved by the Bell AC Slater Costume Wig	1	CR-UNWANTED_ITEM	Y	C-Returns	RefundAtFirstScan	 	 	13.99	1	ORDER_IN_RE_SELLABLE_CONDITION	65582-37485-5838221	NOGRANT	01-Feb-2024	 	13.99
112-8584201-9151441	02-Jan-2024	04-Jan-2024	Approved	DqFckDs8RRMA	 	AmazonPrePaidLabel	6.09	USD	USPS	9302010949890021145531	Seller	N	N	B07FDL126R	RetroWigHeadband-1191	Retro 80s Aerobics Instructor Deluxe Wig and Headband Costume Set	1	CR-MISSED_ESTIMATED_DELIVERY	Y	C-Returns	StandardRefund	 	 	49.26	1	 	 	 	 	 	 
113-9769379-8806618	23-Dec-2023	04-Jan-2024	Approved	D5F1kSslRRMA	 	AmazonPrePaidLabel	6.03	USD	UPS	1ZC1G2149012616050	Seller	N	N	B09GTM2BM7	BigLCostume-Kids-4/5	Lebowski Cardigan and Pants Youth Halloween Costume Set	1	CR-MISSING_PARTS	Y	C-Returns	RefundAtFirstScan	 	 	59.49	1	 	 	 	 	 	59.49
114-3893799-4415467	15-Dec-2023	04-Jan-2024	Approved	DQFhkBsnRRMA	 	AmazonPrePaidLabel	4.15	USD	USPS	9302010949890021112762	Seller	N	N	B07HHJ5Y1Z	WuTangLoungePants-LN0010-52-XL	Wu Tang Clan Logo Yellow and Black Lounge Pants (Adult X-Large)	1	AMZ-PG-APP-TOO-LARGE	Y	C-Returns	StandardRefund	 	 	21.95	1	 	 	 	 	 	 
114-2707549-9097832	26-Nov-2023	04-Jan-2024	Approved	DkFYkmsLRRMA	 	AmazonPrePaidLabel	6.03	USD	UPS	1ZC1G2149012606909	Seller	N	N	B0BHZWFS49	103008-ElfShoes-12-13	Buddy The Elf Christmas Costume Shoes	1	AMZ-PG-BAD-DESC	Y	C-Returns	StandardRefund	 	 	51.05	1	 	 	 	 	 	 
113-8301580-0447434	01-Jan-2024	04-Jan-2024	Approved	D7FHkGsFRRMA	 	AmazonPrePaidLabel	6.03	USD	UPS	1ZC1G2149012583256	Seller	N	N	B00U0HHL64	CVSM2258-MooseHead-3X	Ripple Junction Family Christmas Sweaters - Red and Black Vacation Fun Old Fashioned Family Xmas Ugly Christmas Sweater for Women or Men | Crew Neck Knitted Eggnog Moose Mug Winter Holiday Sweater	1	AMZ-PG-APP-TOO-LARGE	Y	C-Returns	RefundAtFirstScan	 	 	47.65	1	ORDER_IN_RE_SELLABLE_CONDITION	82476-62174-5412365	NOGRANT	31-Jan-2024	 	47.65
112-8500579-3598655	17-Dec-2023	04-Jan-2024	Approved	Dq3fkBsdRRMA	 	AmazonPrePaidLabel	5.80	USD	USPS	9302010949890021130643	Seller	N	N	B0BKTKDGDK	WREL02AMSC-OMGSantaShirt-L	Buddy The Elf OMG Santa I Know Him Green T-Shirt for Mens and Womens	1	CR-UNWANTED_ITEM	Y	C-Returns	StandardRefund	 	 	32.00	2	 	 	 	 	 	 
112-8500579-3598655	17-Dec-2023	04-Jan-2024	Approved	DB3Mk3stRRMA	 	AmazonPrePaidLabel	5.80	USD	USPS	9302010949890021118047	Seller	N	N	B0BKTRKBJB	WREL02AMSC-OMGSantaShirt-XL	Buddy The Elf OMG Santa I Know Him Green T-Shirt for Mens and Womens	1	CR-UNWANTED_ITEM	Y	C-Returns	StandardRefund	 	 	32.00	2	 	 	 	 	 	 
114-1638951-7149868	22-Dec-2023	04-Jan-2024	Approved	DB3skksVRRMA	 	AmazonPrePaidLabel	5.43	USD	UPS	1ZC1G2149012562788	Seller	N	N	B0CKC2CJ3D	CCX21-CokeHeartSweater-S	Coca Cola Heart Polar Bear Drinking Womens Ugly Christmas Sweater Multicolor	1	AMZ-PG-APP-TOO-SMALL	Y	C-Returns	RefundAtFirstScan	 	 	29.13	1	ORDER_IN_RE_SELLABLE_CONDITION	91109-43521-6456826	NOGRANT	08-Feb-2024	 	29.13
113-6368785-6221020	28-Dec-2023	04-Jan-2024	Approved	DW3fkHs2RRMA	 	AmazonPrePaidLabel	3.75	USD	USPS	9302010949890021093702	Seller	N	N	B00DNICTRS	tmnt046jMike-S	TMNT Teenage Mutant Ninja Turtles Michelangelo Costume Juniors Green T-shirt with Orange Eye Mask (Juniors Small)	1	AMZ-PG-BAD-DESC	Y	C-Returns	RefundAtFirstScan	 	 	25.39	1	 	 	 	 	 	25.39
113-4212930-1945805	18-Dec-2023	04-Jan-2024	Approved	DWkwkvsqRRMA	 	AmazonPrePaidLabel	6.09	USD	USPS	9302010949890021092804	Seller	N	N	B07KWH2ZN3	TheSandlotUCS-Navy-S	The Sandlot You are Killing Me Small Navy Ugly Christmas Sweater (Adult Small)	1	CR-ORDERED_WRONG_ITEM	Y	C-Returns	RefundAtFirstScan	 	 	49.40	1	INVALID_SELLER_REFUND_OR_DEBIT	91601-63051-5610464	GRANT	09-Feb-2024	8.95	49.40
112-2896121-4780262	31-Dec-2023	04-Jan-2024	Approved	DvkqkDsqRRMA	 	AmazonPrePaidLabel	6.80	USD	UPS	1ZC1G2149012553083	Seller	N	N	B01LBRL97I	100576BROWN-S	Caribbean Pirate Boots Halloween Costume Cosplay Accessory	1	CR-SWITCHEROO	Y	Amazon CS	AutomatedRefund	 	 	74.67	1	 	 	 	 	 	74.67
113-9639054-1439469	05-Nov-2023	04-Jan-2024	Approved	DskpkgsCRRMA	 	AmazonPrePaidLabel	6.44	USD	UPS	1ZC1G2149012554733	Seller	N	N	B0BK1X2DJ3	267345-GrinchPJPants-XL	MJC Grinch All Over Santa Hat Christmas Pajamas Lounge Pants	1	AMZ-PG-APP-TOO-LARGE	Y	C-Returns	AutomatedRefund	 	 	63.45	3	 	 	 	 	 	21.15
113-9639054-1439469	05-Nov-2023	04-Jan-2024	Approved	DskpkgsCRRMA	 	AmazonPrePaidLabel	6.44	USD	UPS	1ZC1G2149012554733	Seller	N	N	B0BK21WJFH	267345-GrinchPJPants-L	MJC Adult Unisex Smiling Grinch All Over Santa Hat Christmas Pajama Lounge Pants	1	AMZ-PG-APP-TOO-LARGE	Y	C-Returns	AutomatedRefund	 	 	63.45	3	 	 	 	 	 	21.15
114-9116160-0391417	18-Dec-2023	04-Jan-2024	Approved	D5k7khsPRRMA	 	AmazonPrePaidLabel	6.03	USD	UPS	1ZC1G2149012538420	Customer	N	N	B0011457CA	officedundie	Interchangeable Placard The Office TV Show Dundie Award Gag Gift Accessory	1	CR-ORDERED_WRONG_ITEM	Y	C-Returns	RefundAtFirstScan	 	 	24.33	1	VALID_DIFFERENT_CONDITION_ITEM_RECEIVED	23156-39994-9599765	GRANT	01-Apr-2024	11.47	18.30
