Order ID	Order date	Return request date	Return request status	Amazon RMA ID	Merchant RMA ID	Label type	Label cost	Currency code	Return carrier	Tracking ID	Label to be paid by	A-to-Z Claim	Is prime	ASIN	Merchant SKU	Item Name	Return quantity	Return Reason	In policy	Return type	Resolution	Invoice number	Return delivery date	Order Amount	Order quantity	SafeT Action reason	SafeT claim id	SafeT claim state	SafeT claim creation time	SafeT claim reimbursement amount	Refunded Amount
111-2297478-3762609	25-Sep-2024	30-Sep-2024	Approved	DFWMjWGLRRMA	 	AmazonPrePaidLabel	6.84	USD	UPS	1ZF2C2469068307595	Seller	N	N	B0CHWK1M8W	220550-LeftShark-PINK-XXL	Costume Agent Left Shark Suit Halloween Costume Dancing Mascot for Cosplay, XX-Large - Pink	1	CR-SWITCHEROO	Y	C-Returns	Replacement	 	 	46.99	1	 	 	 	 	 	 
114-2894298-2972235	25-Sep-2024	30-Sep-2024	Approved	D8WQjLGcRRMA	 	AmazonPrePaidLabel	5.62	USD	USPS	9302010949890091765929	Seller	N	N	B08GV3LDCT	4U9ML-ERNIE-CostumeShirt-L	Mad Engine Halloween and Cosplay Costume - Bert and Ernie Sesame Street T-Shirt (US, Alpha, Large, Regular, Ernie)	1	AMZ-PG-APP-TOO-SMALL	Y	C-Returns	StandardRefund	 	 	32.72	1	 	 	 	 	 	 
112-3073556-5445010	20-Sep-2024	30-Sep-2024	Approved	DrWVjwGVRRMA	 	AmazonPrePaidLabel	6.06	USD	UPS	1ZF2C2469068290335	Seller	N	N	B076634BPK	juno004-S	Costume Agent Juno Orange and White Pregnant Impersonation T-Shirt (Adult Small)	1	CR-UNWANTED_ITEM	Y	C-Returns	StandardRefund	 	 	73.36	2	 	 	 	 	 	27.00
113-7383910-6301813	19-Sep-2024	30-Sep-2024	Approved	DYWxjxGVRRMA	 	AmazonPrePaidLabel	4.68	USD	USPS	9302010949890091768319	Seller	N	N	B0CDN68583	221030-CampWalden-Shirt-L	Camp Walden Summer Camp Parent Movie Unisex Adult Halloween Costume Cosplay White	1	AMZ-PG-APP-TOO-LARGE	Y	C-Returns	RefundAtFirstScan	 	 	21.40	1	 	 	 	 	 	21.40
112-3073556-5445010	20-Sep-2024	30-Sep-2024	Approved	D7WyjQG2RRMA	 	AmazonPrePaidLabel	6.06	USD	UPS	1ZF2C2469068301868	Seller	N	N	B002P4L9GS	junocostume-MTee	Juno Dancing Elk Condors Complete Paulie Bleeker Costume (Medium, T-Shirt)	1	CR-FOUND_BETTER_PRICE	Y	C-Returns	StandardRefund	 	 	73.36	2	 	 	 	 	 	47.61
113-2365449-0569851	20-Sep-2024	30-Sep-2024	Approved	 	 	AmazonUnPaidLabel	0.00	 	 	 	Seller	N	N	B07FDJPYN3	RastaWig-1207	Costume Agent Rasta Dreadlocks Jamaican Deluxe Costume Accessory Black Wig and Hat	1	CR-UNWANTED_ITEM	Y	C-Returns	ReturnlessRefund	 	 	18.31	1	 	 	 	 	 	18.31
111-6688743-5944224	09-Sep-2024	30-Sep-2024	Approved	DT9sj1GhRRMA	 	AmazonPrePaidLabel	7.43	USD	UPS	1ZF2C2469068287465	Seller	N	N	B0147ARM18	sharkcostume-M-L	Costume Agent Perry TV Concert Left Shark Dancing Mascot Blue Zip Jumpsuit Halloween Costume Cosplay	1	AMZ-PG-APP-TOO-LARGE	Y	C-Returns	RefundAtFirstScan	 	 	127.12	2	SUBMIT	53441-63191-4959652	PENDING_ACTION	13-Nov-2024	 	65.06
113-9433411-7144225	15-Sep-2024	30-Sep-2024	Approved	 	 	AmazonUnPaidLabel	0.00	 	 	 	Seller	N	N	B07JG92XS1	jokersocks-7-9	Costume Agent Adult Halloween Costume Accessory Joke Socks (Size 7/9)	1	AMZ-PG-APP-TOO-SMALL	Y	C-Returns	ReturnlessRefund	 	 	12.97	1	 	 	 	 	 	12.97
112-7301777-1135442	29-Aug-2024	30-Sep-2024	Approved	D490jVGSRRMA	 	AmazonPrePaidLabel	4.36	USD	USPS	9302010949890091729419	Seller	N	N	B0CKJ7GX9P	220994-SheriffKidsShirt-3-4T	Costume Agent Sheriff Woody Cowboy Shirt Kids Children Halloween Costume Cosplay Yellow	1	CR-SWITCHEROO	Y	C-Returns	AutomatedRefund	 	 	27.13	1	SUBMIT	66866-14698-6734322	PENDING_ACTION	13-Nov-2024	 	27.13
113-2630469-1177832	21-Sep-2024	30-Sep-2024	Approved	Dh95jsG7RRMA	 	AmazonPrePaidLabel	5.62	USD	USPS	9302010949890091757061	Seller	N	N	B07BDQJVJH	mm001Ngrn-3XL	M&M's Candy Silly Character Face T-Shirt Green	1	AMZ-PG-APP-TOO-LARGE	Y	C-Returns	RefundAtFirstScan	 	 	24.96	1	 	 	 	 	 	24.96
112-4789859-7629041	23-Sep-2024	30-Sep-2024	Approved	Dt96j3GsRRMA	 	AmazonPrePaidLabel	4.36	USD	USPS	9302010949890091738244	Customer	N	N	B0CKJZZY7D	SSXX4U-BertShirtKids-S	Mad Engine Bert and Ernie Sesame Street Kids Children Long Sleeve T-Shirt Halloween Costume Cosplay	1	CR-UNWANTED_ITEM	Y	C-Returns	RefundAtFirstScan	 	 	27.32	1	 	 	 	 	 	22.96
113-5663703-7252223	27-Sep-2024	30-Sep-2024	Approved	Dj9FjyGvRRMA	 	AmazonPrePaidLabel	5.45	USD	USPS	9302010949890091737889	Seller	N	N	B0145Q38M6	waldocostumeDELUXE-L	Where's Waldo DELUXE Costume Set (Adult Large)	1	CR-UNWANTED_ITEM	Y	C-Returns	RefundAtFirstScan	 	 	26.76	1	ORDER_IN_RE_SELLABLE_CONDITION	63771-52298-6288810	NOGRANT	01-Nov-2024	 	26.76
112-9017508-8724217	19-Sep-2024	30-Sep-2024	Approved	Df9fjXG2RRMA	 	AmazonPrePaidLabel	6.40	USD	USPS	9302010949890091754428	Customer	N	N	B07GYXPWWX	RiverdaleTankSkirtSet-WR0345-69-XL	Underboss Riverdale Cheerleader V-Neck Tank & Skirt Costume Set (Adult X-Large) Blue	1	CR-UNWANTED_ITEM	Y	C-Returns	RefundAtFirstScan	 	 	36.87	1	 	 	 	 	 	30.47
112-6131603-3853000	24-Sep-2024	30-Sep-2024	Approved	D292jvGwRRMA	 	AmazonPrePaidLabel	4.38	USD	USPS	9302010949890091751489	Seller	N	N	B07662MFGQ	juno004-L	Costume Agent Juno Orange and White Pregnant Impersonation T-Shirt (Adult Large)	1	AMZ-PG-APP-TOO-LARGE	Y	C-Returns	StandardRefund	 	 	34.90	1	 	 	 	 	 	 
112-0264047-6813023	27-Sep-2024	30-Sep-2024	Approved	D49SjwG9RRMA	 	AmazonPrePaidLabel	6.84	USD	UPS	1ZF2C2469068274371	Seller	N	N	B0CDDNN483	221004-CheerleaderWomens-M	Costume Agent Cheerleader Halloween Costume for Mens and Womens Adult Unisex Varsity High School Cosplay, Medium	1	AMZ-PG-APP-TOO-SMALL	Y	C-Returns	StandardRefund	 	 	105.90	2	 	 	 	 	 	52.95
114-7238915-2661806	06-Sep-2024	30-Sep-2024	Approved	DQ9hjmGHRRMA	 	AmazonPrePaidLabel	6.06	USD	UPS	1ZF2C2469068272408	Seller	N	N	B07YBB54W1	oktoberfestlederhosenPANTS1-36	Costume Agent Oktoberfest German Bavarian Lederhosen Costume (Adult 36, Brown Pants)	1	AMZ-PG-APP-TOO-SMALL	Y	C-Returns	RefundAtFirstScan	 	 	53.12	1	ORDER_IN_RE_SELLABLE_CONDITION	42480-33112-0268050	NOGRANT	29-Oct-2024	 	53.12
111-9403615-8301804	21-Sep-2024	30-Sep-2024	Approved	DK9WjVGkRRMA	 	AmazonPrePaidLabel	6.06	USD	UPS	1ZF2C2469068263178	Seller	N	N	B001GMV4TM	furiespants-XL	The Warriors Furies Pinstriped Baseball Jersey Pants White	1	AMZ-PG-APP-TOO-LARGE	Y	C-Returns	RefundAtFirstScan	 	 	29.99	1	ORDER_IN_RE_SELLABLE_CONDITION	31796-12977-4116046	NOGRANT	26-Oct-2024	 	29.99
113-7080833-9932230	14-Sep-2024	30-Sep-2024	Approved	DqQkjMGfRRMA	 	AmazonUnPaidLabel	0.00	 	 	 	Seller	N	N	B0085NX632	suitpajamas001black-XL	TV Store How I Met Your Mother Black Silk Pajama Suit with White Shirt (Black) (Mens X-Large)	1	CR-DEFECTIVE	Y	C-Returns	StandardRefund	 	 	66.95	1	 	 	 	 	 	59.95
113-0694919-6116262	26-Sep-2024	30-Sep-2024	Approved	DjQfjjG0RRMA	 	AmazonPrePaidLabel	3.86	USD	USPS	9302010949890091748847	Seller	N	N	B01JSFMX7U	suicidesquad003-XS	DC Comics Suicide Squad Harley Quinn Daddy Little Monster Movie Costume for Women White Short Sleeve T-Shirt for Cosplay	1	AMZ-PG-APP-TOO-SMALL	Y	C-Returns	RefundAtFirstScan	 	 	29.63	1	 	 	 	 	 	29.63
114-1369294-9137832	03-Sep-2024	30-Sep-2024	Approved	DrQ2jQG3RRMA	 	AmazonPrePaidLabel	5.07	USD	USPS	9302010949890091722427	Seller	N	N	B01JSFN8CY	suicidesquad004-L	DC Comics Suicide Squad Harley Quinn Shorts Panties Costume for Women Halloween Cosplay Red/Blue	1	AMZ-PG-APP-TOO-SMALL	Y	C-Returns	RefundAtFirstScan	 	 	29.44	1	 	 	 	 	 	29.44
112-6852980-1753005	26-Sep-2024	30-Sep-2024	Approved	DTQxjXGLRRMA	 	AmazonPrePaidLabel	11.12	USD	UPS	1ZF2C2469068258817	Seller	N	N	B01LX25FNH	220654-MST	Costume Agent Deluxe Muscle Suit Costume (MST)	1	AMZ-PG-BAD-DESC	Y	C-Returns	AutomatedRefund	 	 	113.44	1	 	 	 	 	 	113.44
114-4194281-0173856	25-Sep-2024	30-Sep-2024	Approved	DZQsjjGVRRMA	 	AmazonPrePaidLabel	4.68	USD	USPS	9302010949890091738947	Customer	N	N	B0BHKKJ3GP	1252-ChuckieKidsWig	Costume Agent Chuckie Good Guys Doll Halloween Costume Accessory Wig Red Hair Cosplay	1	AMZ-PG-APP-TOO-SMALL	Y	C-Returns	RefundAtFirstScan	 	 	18.56	1	 	 	 	 	 	13.88
112-5262379-1014666	25-Sep-2024	30-Sep-2024	Approved	DvQSjSGyRRMA	 	AmazonPrePaidLabel	6.06	USD	UPS	1ZF2C2469068239481	Seller	N	N	B0CJKVWK1R	wrestlingbootsCH-1/2W	Pro Wrestling Boots Kids Wrestler Halloween Costume Cosplay White	1	AMZ-PG-BAD-DESC	Y	C-Returns	RefundAtFirstScan	 	 	46.46	1	 	 	 	 	 	46.46
113-0190368-6887442	27-Sep-2024	30-Sep-2024	Approved	DW6SjVGZRRMA	 	AmazonPrePaidLabel	5.07	USD	USPS	9302010949890091704720	Customer	N	N	B0CGB2BJH4	220832-OrangeDogCostume-7-8	Playful Colorful Dog Halloween Costume Cosplay Zip Up Suit with Hood for Boys and Girls	1	CR-UNWANTED_ITEM	Y	C-Returns	StandardRefund	 	 	34.95	1	 	 	 	 	 	 
114-6913549-9884203	24-Sep-2024	30-Sep-2024	Approved	D26XjjGqRRMA	 	AmazonPrePaidLabel	4.43	USD	USPS	9302010949890091732587	Seller	N	N	B07GJYV3CG	tmnt016-Don-Mens-S	Teenage Mutant Ninja Turtles TMNT Mens Costume T-Shirt(Donatello,Small)	1	AMZ-PG-APP-TOO-SMALL	Y	C-Returns	RefundAtFirstScan	 	 	27.31	1	ORDER_IN_RE_SELLABLE_CONDITION	64551-73748-9768316	NOGRANT	16-Oct-2024	 	27.31
111-0429359-9425821	26-Sep-2024	30-Sep-2024	Approved	Dq6PjpGqRRMA	 	AmazonPrePaidLabel	6.06	USD	UPS	1ZF2C2469068230257	Seller	N	N	B07YGRHXYT	220744-AhoySailorCostume-MENS-XS	Costume Agent Adult Unisex Men's ST Show Scoops Ahoy Sailor Halloween Costume Cosplay Set - Blue (X-Small)	1	AMZ-PG-APP-TOO-LARGE	Y	C-Returns	RefundAtFirstScan	 	 	43.25	1	ORDER_IN_RE_SELLABLE_CONDITION	33288-47645-2382541	NOGRANT	18-Oct-2024	 	43.25
111-0429359-9425821	26-Sep-2024	30-Sep-2024	Approved	Dh6jjVGgRRMA	 	AmazonPrePaidLabel	6.06	USD	UPS	1ZF2C2469068238820	Seller	N	N	B07YGRHXYT	220744-AhoySailorCostume-MENS-XS	Costume Agent Adult Unisex Men's ST Show Scoops Ahoy Sailor Halloween Costume Cosplay Set - Blue (X-Small)	1	AMZ-PG-APP-STYLE	Y	C-Returns	StandardRefund	 	 	43.25	1	ORDER_IN_RE_SELLABLE_CONDITION	33288-47645-2382541	NOGRANT	18-Oct-2024	 	 
113-8029043-4125052	16-Sep-2024	30-Sep-2024	Approved	DZ6XjnGpRRMA	 	AmazonPrePaidLabel	6.48	USD	UPS	1ZF2C2469068230604	Seller	N	N	B08KSLLX5P	M&M-Blue-JUNIORS-Shirt-M	Mad Engine M&M's Candy Cartoon Character Women's Juniors Halloween Costume T-Shirt Blue	1	AMZ-PG-APP-TOO-SMALL	Y	C-Returns	StandardRefund	 	 	194.05	8	 	 	 	 	 	24.84
113-8029043-4125052	16-Sep-2024	30-Sep-2024	Approved	DH6djKGKRRMA	 	AmazonPrePaidLabel	6.48	USD	UPS	1ZF2C2469068229885	Seller	N	N	B08KSKNGG5	M&M-Red-JUNIORS-Shirt-L	Mad Engine M&M's Candy Cartoon Character Women's Juniors Halloween Costume T-Shirt,Red	2	AMZ-PG-APP-TOO-SMALL	Y	C-Returns	StandardRefund	 	 	194.05	8	 	 	 	 	 	24.84
113-3264754-6657060	18-Sep-2024	30-Sep-2024	Approved	DF60j4GmRRMA	 	AmazonPrePaidLabel	5.32	USD	USPS	9302010949890091731016	Seller	N	N	B01JSFN2Y8	suicidesquad004-S	DC Comics Suicide Squad Harley Quinn Shorts Panties Costume for Women Halloween Cosplay Red/Blue	1	AMZ-PG-APP-TOO-SMALL	Y	C-Returns	RefundAtFirstScan	 	 	28.84	1	ORDER_IN_RE_SELLABLE_CONDITION	12746-15283-6540631	NOGRANT	11-Nov-2024	 	28.84
113-8029043-4125052	16-Sep-2024	30-Sep-2024	Approved	DK6fjNGdRRMA	 	AmazonPrePaidLabel	6.48	USD	UPS	1ZF2C2469068230284	Seller	N	N	B08KSKT24N	M&M-Yellow-JUNIORS-Shirt-S	Mad Engine M&M's Candy Cartoon Character Women's Juniors Halloween Costume T-Shirt,Yellow	1	AMZ-PG-APP-TOO-SMALL	Y	C-Returns	StandardRefund	 	 	194.05	8	 	 	 	 	 	24.84
112-0213095-6296261	24-Sep-2024	30-Sep-2024	Approved	DL6fjKG1RRMA	 	AmazonPrePaidLabel	4.38	USD	USPS	9302010949890091728283	Customer	N	N	B015TM9GTE	insideoutjoywig	INsideOUT Joy Blue Costume Wig	1	CR-QUALITY_UNACCEPTABLE	Y	C-Returns	RefundAtFirstScan	 	 	21.15	1	 	 	 	 	 	16.77
114-2385565-3707401	26-Sep-2024	30-Sep-2024	Approved	D46GjcG7RRMA	 	AmazonPrePaidLabel	6.06	USD	UPS	1ZF2C2469068220740	Seller	N	N	B075LYKC2X	220680-LadyBatCostume-XS	Women's Cozy Lady Bat Woman Costume with Wings and Hood for Halloween and Cosplay - Stylish Bat Girl Dress for Adults - X-Small Black	1	AMZ-PG-APP-TOO-SMALL	Y	C-Returns	RefundAtFirstScan	 	 	29.51	1	 	 	 	 	 	29.51
114-1706763-5975465	12-Sep-2024	30-Sep-2024	Approved	Dx6bjgGsRRMA	 	AmazonPrePaidLabel	5.32	USD	USPS	9302010949890091711797	Seller	N	N	B0CHN6KGCW	SRST02-StarTrekLS-Blue-4XL	Mad Engine Adult Star Trek Long Sleeve Halloween Costume T-shirt - Spock Captain Kirk Engineering Cosplay	1	AMZ-PG-APP-TOO-LARGE	Y	C-Returns	RefundAtFirstScan	 	 	32.42	1	ORDER_IN_RE_SELLABLE_CONDITION	64757-24221-6349251	NOGRANT	09-Oct-2024	 	32.42
114-4619427-8248234	18-Sep-2024	30-Sep-2024	Approved	DW6bj0GzRRMA	 	AmazonPrePaidLabel	6.06	USD	UPS	1ZF2C2469068220268	Seller	N	N	B005MYCCJQ	leagueoftheirowncostume-Small/Medium	Costume Agent Rockford Peaches AAGPBL Baseball Halloween Dress Costume Cosplay	1	AMZ-PG-APP-TOO-SMALL	Y	C-Returns	RefundAtFirstScan	 	 	48.10	1	INVALID_SELLER_REFUND_OR_DEBIT	52069-54531-9916012	GRANT	09-Oct-2024	6.06	48.10
114-4284818-6125021	26-Sep-2024	30-Sep-2024	Approved	Dt62jlGYRRMA	 	AmazonPrePaidLabel	4.38	USD	USPS	9302010949890091718888	Seller	N	N	B08KSJTHL4	M&M-Red-JUNIORS-Shirt-2XL	Mad Engine - M&M's Candy Cartoon Character - Women's Juniors Halloween Costume T-Shirt Red	1	AMZ-PG-APP-TOO-SMALL	Y	C-Returns	StandardRefund	 	 	44.94	2	 	 	 	 	 	22.99
113-3769062-5141819	26-Sep-2024	30-Sep-2024	Approved	Dthrj2G5RRMA	 	AmazonPrePaidLabel	6.84	USD	UPS	1ZF2C2469068212893	Seller	N	N	B07G8J4QW9	JediBoots-100582-M	Costume Agent Brown Jedi Pirate Gotham Engineer Costume Boots (Adult Medium Size 10-11)	1	CR-SWITCHEROO	Y	C-Returns	Replacement	 	 	42.35	1	 	 	 	 	 	 
114-7013267-2362608	21-Sep-2024	30-Sep-2024	Approved	Dxh6j2G5RRMA	 	AmazonPrePaidLabel	5.07	USD	USPS	9302010949890091690825	Seller	N	N	B003D10IO6	alsunny012-XXL	Always Sunny In Philadelphia It's Charlie Wildcard Black T-Shirt Tee, XX-Large	1	AMZ-PG-APP-TOO-LARGE	Y	C-Returns	StandardRefund	 	 	23.87	1	 	 	 	 	 	 
111-2184589-1949860	08-Sep-2024	30-Sep-2024	Approved	Dqh6jhGKRRMA	 	AmazonPrePaidLabel	6.48	USD	UPS	1ZF2C2469068211401	Seller	N	N	B07GX6P92S	GhostbustersDress-25KHA-L	Mad Engine Ghostbusters Womens Romper Costume with 4 Interchangeable Name Patches - Large	1	AMZ-PG-APP-STYLE	Y	C-Returns	StandardRefund	 	 	128.10	2	 	 	 	 	 	55.55
114-8009577-5891469	22-Sep-2024	30-Sep-2024	Approved	DthcjFGSRRMA	 	AmazonPrePaidLabel	5.62	USD	USPS	9302010949890091709121	Seller	N	N	B07FL19PCT	hulkpantsN001-M	Costume Agent Red and Yellow Tie-Dye Wrestling Legging Tights Pants (Adult Medium)	1	AMZ-PG-APP-TOO-LARGE	Y	C-Returns	AutomatedRefund	 	 	32.27	1	 	 	 	 	 	32.27
112-0552907-3774632	27-Sep-2024	30-Sep-2024	Approved	DjhDjLGLRRMA	 	AmazonPrePaidLabel	5.93	USD	USPS	9302010949890091707530	Seller	N	N	B0DC77CGCG	PolkHighJerseyDistressed-33-YXL	Al Bundy Polk High School Football Jersey #33 Distressed Halloween Costume Cosplay	1	CR-SWITCHEROO	Y	C-Returns	Replacement	 	 	39.95	1	 	 	 	 	 	 
112-4396874-1620209	26-Sep-2024	30-Sep-2024	Approved	DjhkjLGvRRMA	 	AmazonPrePaidLabel	4.28	USD	USPS	9302010949890091707387	Seller	N	N	B00C1NZ5HW	wwe059purple-M	WWE World Wrestling Entertainment Old School Macho Man Glasses Adult Heather Purple T-Shirt (Adult Medium)	1	AMZ-PG-APP-TOO-LARGE	Y	C-Returns	RefundAtFirstScan	 	 	24.50	1	 	 	 	 	 	24.50
111-5762960-2918651	25-Sep-2024	30-Sep-2024	Approved	 	 	AmazonUnPaidLabel	0.00	 	 	 	Seller	N	N	B000MC3X6Y	25396-shortlightpinkwig	Glamour Babe Short Light Pink Costume Wig	1	AMZ-PG-BAD-DESC	Y	C-Returns	ReturnlessRefund	 	 	10.82	1	 	 	 	 	 	10.82
112-3989222-9283455	18-Sep-2024	30-Sep-2024	Approved	D5hpjcGwRRMA	 	AmazonPrePaidLabel	5.93	USD	USPS	9302010949890091690306	Seller	N	N	B07FTQR2N2	CowgirlShirt-204051-XS	Costume Agent - Jessie Cowgirl Halloween Costume Long Sleeve Shirt Cosplay White.	1	CR-UNAUTHORIZED_PURCHASE	Y	C-Returns	StandardRefund	 	 	51.65	2	 	 	 	 	 	27.95
112-1948919-0001846	27-Sep-2024	30-Sep-2024	Approved	DfzljQG8RRMA	 	AmazonPrePaidLabel	6.09	USD	USPS	9302010949890091689690	Seller	N	N	B07FDL126R	RetroWigHeadband-1191	Costume Agent Retro 80s Aerobics Instructor Deluxe Wig and Headband Costume Set	1	AMZ-PG-BAD-DESC	Y	C-Returns	RefundAtFirstScan	 	 	23.82	1	INVALID_EVIDENCE	65325-44654-7272227	NOGRANT	02-Nov-2024	 	23.82
111-6993664-6773821	24-Sep-2024	30-Sep-2024	Approved	DKztjdGCRRMA	 	AmazonPrePaidLabel	4.68	USD	USPS	9302010949890091660217	Seller	N	N	B01JSFMZF0	suicidesquad003-XL	DC Comics Suicide Squad Harley Quinn Daddy Little Monster Movie Costume for Women White Short Sleeve T-Shirt for Cosplay	1	AMZ-PG-APP-TOO-LARGE	Y	C-Returns	RefundAtFirstScan	 	 	35.45	1	INVALID_SELLER_REFUND_OR_DEBIT	18137-15156-4498444	GRANT	09-Oct-2024	7.63	35.45
111-9619547-4707414	26-Sep-2024	30-Sep-2024	Approved	 	 	AmazonUnPaidLabel	0.00	 	 	 	Seller	N	N	B01IIQZG74	BV46JZSSQ-HQSpikedCuffs1	Suicide Squad Harley Quinn metal Spike Cuffs - Set of 2	1	AMZ-PG-WJ-TOO-LARGE	Y	C-Returns	ReturnlessRefund	 	 	48.48	2	 	 	 	 	 	16.14
113-9927409-8658666	27-Sep-2024	30-Sep-2024	Approved	D7zfj5GGRRMA	 	AmazonPrePaidLabel	5.07	USD	USPS	9302010949890091695738	Seller	N	N	B09RQ6THT3	thewarrior001-S-M	Costume Agent Warriors Vest and Bandana Set Halloween Movie Gang Cosplay (S/M)	1	CR-MISSED_ESTIMATED_DELIVERY	Y	C-Returns	StandardRefund	 	 	42.41	1	 	 	 	 	 	 
114-2640797-3396228	24-Sep-2024	30-Sep-2024	Approved	Dtz3jSG3RRMA	 	AmazonPrePaidLabel	5.15	USD	USPS	9302010949890091675730	Seller	N	N	B012H8AL92	leagueoftheirownGIRLS-5/6	Costume Agent Rockford Peaches Costume A League of Their Own AAGPBL with Red Hat & Belt for Toddler Girls	1	AMZ-PG-APP-TOO-LARGE	Y	C-Returns	RefundAtFirstScan	 	 	38.39	1	ORDER_IN_RE_SELLABLE_CONDITION	24823-34630-6291711	NOGRANT	17-Oct-2024	 	38.39
111-4653088-2307418	27-Sep-2024	30-Sep-2024	Approved	DqzhjMGJRRMA	 	AmazonPrePaidLabel	4.31	USD	USPS	9302010949890091695158	Seller	N	N	B00CP8M3D2	mm001Nblu-L	Adult M&M’S Character Big Face T-Shirt	1	CR-DEFECTIVE	Y	C-Returns	RefundAtFirstScan	 	 	24.04	1	 	 	 	 	 	24.04
112-6073393-0685015	06-Sep-2024	30-Sep-2024	Approved	DfzvjYGrRRMA	 	AmazonPrePaidLabel	4.31	USD	USPS	9302010949890091686781	Seller	N	N	B0CFB7MZKG	220969-JunoShirtStripes-S	Costume Agent Dancing Elk Condors Halloween Costume T-Shirt Tee with Striped Sleeves Cosplay for Mens and Womens Multicolor, Small	1	AMZ-PG-APP-TOO-SMALL	Y	C-Returns	StandardRefund	 	 	50.90	2	 	 	 	 	 	28.17
114-5883417-4125823	27-Sep-2024	30-Sep-2024	Approved	D4zyjXG7RRMA	 	AmazonPrePaidLabel	7.07	USD	UPS	1ZF2C2469068173159	Seller	N	N	B01LBRLEX2	100576BLACK-XL	Costume Agent Pirate Boots Adventure Footwear Halloween Costume Cosplay Accessory - Black - X-Large - Pirate Carribean Pirate Boot Men - Men's Tall Boots - Mens Cosplay Boots	1	AMZ-PG-APP-TOO-LARGE	Y	C-Returns	RefundAtFirstScan	 	 	80.13	1	ORDER_IN_RE_SELLABLE_CONDITION	12409-00358-0172301	NOGRANT	09-Oct-2024	 	80.13
114-1328922-5567414	28-Sep-2024	30-Sep-2024	Approved	DpzPj2GQRRMA	 	AmazonPrePaidLabel	6.06	USD	UPS	1ZF2C2469068172990	Seller	N	N	B008VVECOA	powerrangerssweatshirtPink-S	Power Rangers Pink Hooded Costume Sweatshirt (Adult Small)	1	CR-SWITCHEROO	Y	C-Returns	Replacement	 	 	65.62	1	 	 	 	 	 	 
114-2190109-8669829	23-Sep-2024	30-Sep-2024	Approved	DxzSjVGcRRMA	 	AmazonPrePaidLabel	6.06	USD	UPS	1ZF2C2469068159951	Seller	N	N	B012H8AL92	leagueoftheirownGIRLS-5/6	Costume Agent Rockford Peaches Costume A League of Their Own AAGPBL with Red Hat & Belt for Toddler Girls	1	CR-QUALITY_UNACCEPTABLE	Y	C-Returns	StandardRefund	 	 	74.11	2	 	 	 	 	 	37.93
114-2190109-8669829	23-Sep-2024	30-Sep-2024	Approved	D4zGjLGvRRMA	 	AmazonPrePaidLabel	6.06	USD	UPS	1ZF2C2469068173999	Seller	N	N	B0C4Q7HZSV	leagueoftheirownGIRLS-18-24M	Rockford Peaches Costume A League of their Own AAGPBL with Red Hat & Belt for Toddler Girls	1	AMZ-PG-BAD-DESC	Y	C-Returns	StandardRefund	 	 	74.11	2	 	 	 	 	 	37.93
112-7631832-8462601	13-Sep-2024	30-Sep-2024	Approved	DTzbjLGVRRMA	 	AmazonPrePaidLabel	6.06	USD	UPS	1ZF2C2469068173793	Seller	N	N	B0BHZWFS49	103008-ElfShoes-12-13	Costume Agent Buddy The Elf Christmas Costume Shoes - Size 12-13 - Women & Mens Jester Shoes - Elf Boots - Buddy the Elf Christmas Decorations - Buddy Shoes for Men & Women	1	AMZ-PG-APP-TOO-LARGE	Y	C-Returns	RefundAtFirstScan	 	 	49.53	1	ORDER_IN_RE_SELLABLE_CONDITION	84612-37485-8741514	NOGRANT	24-Oct-2024	 	49.53
114-1580798-2414613	25-Sep-2024	30-Sep-2024	Approved	Dtzpj0GyRRMA	 	AmazonPrePaidLabel	6.48	USD	UPS	1ZF2C2469068162563	Seller	N	N	B0C427YDBM	204292-DeerRingSweater-6XL	Reindeer Ring Toss 3D Ugly Christmas Sweater (as1, Alpha, 6X_l, Regular, Regular) Multicolored	1	AMZ-PG-APP-TOO-LARGE	Y	C-Returns	StandardRefund	 	 	54.45	1	 	 	 	 	 	 
113-1403746-6670625	27-Sep-2024	30-Sep-2024	Approved	 	 	AmazonUnPaidLabel	0.00	 	 	 	Seller	N	N	B08KLYJ789	220621-youth1	Costume Agent Lift Me Walking Carrying Animal Halloween Costume Cosplay - Lion (Youth)	1	AMZ-PG-APP-TOO-SMALL	Y	C-Returns	ReturnlessRefund	 	 	11.95	1	 	 	 	 	 	11.95
111-5164672-2485801	27-Sep-2024	30-Sep-2024	Approved	DqzMjRGkRRMA	 	AmazonPrePaidLabel	4.31	USD	USPS	9302010949890091674740	Customer	N	N	B0DBRP7DGZ	WB1157-HQLilMonster-Shirt-S	COCO BRANDS Suicide Squad Harley Quinn Daddy Little Monster Halloween Costume Cosplay for Women White Raglan T-Shirt	1	CR-UNWANTED_ITEM	Y	C-Returns	RefundAtFirstScan	 	 	31.75	1	 	 	 	 	 	27.44
112-0179599-4185813	17-Sep-2024	30-Sep-2024	Approved	DKzYj1GNRRMA	 	AmazonPrePaidLabel	6.48	USD	UPS	1ZF2C2469068164267	Seller	N	N	B008XJ88FE	karatekiddanielcostumetdlxXL-Deluxe-XL	Karate Kid The DELUXE Daniel Mens Replica Gi Costume (X-Large)	1	AMZ-PG-APP-TOO-SMALL	Y	C-Returns	RefundAtFirstScan	 	 	42.75	1	ORDER_IN_RE_SELLABLE_CONDITION	47691-02079-2164830	NOGRANT	10-Oct-2024	 	42.75
112-8503648-0161815	27-Sep-2024	30-Sep-2024	Approved	DBTWjSGjRRMA	 	AmazonPrePaidLabel	5.32	USD	USPS	9302010949890091661450	Seller	N	N	B0B7BVZR9Z	peanuts044N-2XL	Charlie B Halloween Costume Polo Shirt Yellow Zig Zag T-Shirt Cosplay	1	AMZ-PG-APP-TOO-SMALL	Y	C-Returns	RefundAtFirstScan	 	 	30.26	1	 	 	 	 	 	30.26
113-4408543-6616209	26-Sep-2024	30-Sep-2024	Approved	DQTGjTGZRRMA	 	AmazonPrePaidLabel	5.07	USD	USPS	9302010949890091673781	Seller	N	N	B014LRDGCG	incredhulk013-L	Marvel Incredible Hulk Sublimated Adult Long Sleeve Costume T-Shirt - Large Multi	1	AMZ-PG-APP-TOO-LARGE	Y	C-Returns	RefundAtFirstScan	 	 	27.95	1	 	 	 	 	 	27.95
114-0323915-2615440	24-Sep-2024	30-Sep-2024	Approved	DKT9j4GmRRMA	 	AmazonPrePaidLabel	7.43	USD	UPS	1ZF2C2469068139615	Seller	N	N	B0C5459FH9	arrested003N-XXL	Bluth's Original Frozen Banana Blue Adult Unisex Short Sleeve T-Shirt Tee (as1, Alpha, xx_l, Regular, Regular)	1	CR-DEFECTIVE	Y	C-Returns	Replacement	 	 	21.44	1	 	 	 	 	 	 
112-5728834-4246647	27-Sep-2024	30-Sep-2024	Approved	DLTZjYGSRRMA	 	AmazonPrePaidLabel	4.02	USD	USPS	9302010949890091679820	Seller	N	N	B09DXN7G6T	PRangersShirtYouth-Black-XS	Power Rangers Mighty Morphin Black Boys Youth Armor Costume T-Shirt(XS, Black)	1	AMZ-PG-APP-TOO-SMALL	Y	C-Returns	RefundAtFirstScan	 	 	21.90	1	ORDER_IN_RE_SELLABLE_CONDITION	95954-06628-6358035	NOGRANT	09-Oct-2024	 	21.90
113-0600850-2458623	23-Sep-2024	30-Sep-2024	Approved	DZTpjvGMRRMA	 	AmazonPrePaidLabel	4.43	USD	USPS	9302010949890091658870	Seller	N	N	B00DNIC89C	tmnt047tankdressLeo-L	Teenage Mutant Ninja Turtles TMNT Leonardo Juniors Costume Green Tank Dress with Blue Eye Mask (Juniors Large)	1	AMZ-PG-APP-TOO-SMALL	Y	C-Returns	AutomatedRefund	 	 	24.84	1	 	 	 	 	 	24.84
114-8865748-1573033	24-Sep-2024	30-Sep-2024	Approved	DkTJjvGLRRMA	 	AmazonPrePaidLabel	5.15	USD	USPS	9302010949890091645757	Seller	N	N	B08GY2NR8F	220757-AverageJoesWomensSet-2XL	Costume Agent Dodgeball Average Joe's Halloween Costume For Women	1	AMZ-PG-APP-TOO-SMALL	Y	C-Returns	RefundAtFirstScan	 	 	54.07	1	ORDER_IN_RE_SELLABLE_CONDITION	95284-46870-7643566	NOGRANT	29-Oct-2024	 	54.07
113-3019262-2553802	21-Sep-2024	30-Sep-2024	Approved	DTTGjgGvRRMA	 	AmazonPrePaidLabel	5.46	USD	UPS	1ZF2C2469068138643	Seller	N	N	B09CRRKNL1	220811-SkeletonPajamaGLOW-M	Costume Agent Halloween Skeleton Costume for Women - Glow in the Dark Front and Back Print Zip Up Jumpsuit Cosplay	1	AMZ-PG-APP-TOO-SMALL	Y	C-Returns	RefundAtFirstScan	 	 	42.75	1	ORDER_IN_RE_SELLABLE_CONDITION	28239-72377-5195561	NOGRANT	21-Oct-2024	 	42.75
112-5677947-1958657	25-Sep-2024	30-Sep-2024	Approved	DvT8jwGBRRMA	 	AmazonPrePaidLabel	5.07	USD	USPS	9302010949890091665076	Seller	N	N	B07JCJL3Y8	IncredibleSuperheroWig-1240	Incredible Superhero Buddy Pine Adult Deluxe Costume Wig and Mask	1	CR-SWITCHEROO	Y	C-Returns	Replacement	 	 	26.45	1	 	 	 	 	 	 
111-6533747-9165827	27-Sep-2024	30-Sep-2024	Approved	DZcKj7GgRRMA	 	AmazonPrePaidLabel	6.06	USD	UPS	1ZF2C2469068131686	Seller	N	N	B09V964G5D	nwo002N-XL	Costume Agent New World Wrestling Adult T-shirt - X-Large - NWO Shirts for Men & Women - NWO Tee Shirt for Men - WWE Shirts for Men - Wrestling Shirts - WWE T Shirts	1	AMZ-PG-APP-TOO-LARGE	Y	C-Returns	AutomatedRefund	 	 	97.76	4	 	 	 	 	 	24.44
114-2015540-7565851	23-Sep-2024	30-Sep-2024	Approved	Dqc0jhGGRRMA	 	AmazonPrePaidLabel	4.47	USD	USPS	9302010949890091657743	Seller	N	N	B00DNICBBW	tmnt047tankdressRaph-M	Teenage Mutant Ninja Turtles TMNT Raphael Costume Juniors Green Tank Dress with Red Eye Mask (Juniors Medium)	1	AMZ-PG-APP-TOO-SMALL	Y	C-Returns	RefundAtFirstScan	 	 	29.91	1	ORDER_IN_RE_SELLABLE_CONDITION	90159-70601-0161555	NOGRANT	14-Oct-2024	 	29.91
112-4953315-8017000	27-Sep-2024	30-Sep-2024	Approved	 	 	AmazonUnPaidLabel	0.00	 	 	 	Seller	N	N	B0046BEKLE	tmntmasks-Purple	Costume Agent 1980s Turtle Cartoon Characters Superhero Costume Felt Eye Masks Assorted Colors (Purple)	1	CR-FOUND_BETTER_PRICE	Y	C-Returns	ReturnlessRefund	 	 	4.87	1	 	 	 	 	 	4.87
113-2711871-3233848	26-Sep-2024	30-Sep-2024	Approved	Drclj8GMRRMA	 	AmazonPrePaidLabel	5.15	USD	USPS	9302010949890091653875	Seller	N	N	B0BG99C7LZ	103011-ChuckyKidsShoes-11-12	Unisex Halloween Chuckie Good Guy Child Doll Horror Movie Cosplay Costume Shoes	1	AMZ-PG-APP-TOO-SMALL	Y	C-Returns	StandardRefund	 	 	36.67	1	 	 	 	 	 	 
111-6533747-9165827	27-Sep-2024	30-Sep-2024	Approved	DZcbjvG1RRMA	 	AmazonPrePaidLabel	6.06	USD	UPS	1ZF2C2469068117568	Seller	N	N	B0081JAOBW	nwo001-XL	TV Store-New World Wrestling Black Mens Sleeveless T-Shirt	1	AMZ-PG-APP-STYLE	Y	C-Returns	AutomatedRefund	 	 	97.76	4	 	 	 	 	 	24.44
