111-8226523-5844260	22-Aug-2024	20-Sep-2024	Approved	 	 	AmazonUnPaidLabel	0.00	 	 	 	Customer	N	N	B0CGVRY6PJ	1272-HulkamaniaBanWigMustache	Costume Agent Red Mania Wrestler Bandana with Attached Wig and Mustache Halloween Costume Cosplay	1	CR-UNWANTED_ITEM	Y	C-Returns	ReturnlessRefund	 	 	39.03	2	 	 	 	 	 	15.83
112-2470703-9798656	12-Sep-2024	20-Sep-2024	Approved	DtkPgjGvRRMA	 	AmazonPrePaidLabel	5.32	USD	USPS	9302010949890088993236	Seller	N	N	B0CGB21GTG	220831-BlueDogCostume-7-8	Playful Colorful Dog Halloween Costume Cosplay Zip Up Suit with Hood for Boys and Girls	1	CR-MISSED_ESTIMATED_DELIVERY	Y	C-Returns	StandardRefund	 	 	37.90	1	 	 	 	 	 	 
111-3588594-4738625	09-Sep-2024	20-Sep-2024	Approved	DLkXgYGkRRMA	 	AmazonPrePaidLabel	6.06	USD	UPS	1ZF2C2469062992150	Seller	N	N	B07JD2L3M6	CY034-ChristmasStoryUnionSuit-XXL	Briefly Stated A Christmas Story Bunny Union Suit Pajama Costume (Adult XX-Large)	1	CR-UNWANTED_ITEM	Y	C-Returns	RefundAtFirstScan	 	 	65.65	1	 	 	 	 	 	65.65
112-2530253-1352201	10-Sep-2024	20-Sep-2024	Approved	DtmLg6GTRRMA	 	AmazonPrePaidLabel	6.06	USD	UPS	1ZF2C2469062983982	Customer	N	N	B07WC4T7GY	220079-SharkChubSuitBlue-Adult	Costume Agent Shark Chub Suit Inflatable Adult Halloween Costume (Adult, Blue)	1	CR-UNWANTED_ITEM	Y	C-Returns	RefundAtFirstScan	 	 	48.75	1	 	 	 	 	 	42.69
114-9515107-6936232	30-Aug-2024	20-Sep-2024	Approved	DsmrgJGVRRMA	 	AmazonPrePaidLabel	6.48	USD	UPS	1ZF2C2469062967115	Customer	N	N	B07GVM64BW	Ghostbusters-GBXX1A-L	Mad Engine Ghostbusters Adult Costume Zip up Jumpsuit with 4 Interchangeable Patches (L) Beige	1	CR-ORDERED_WRONG_ITEM	Y	C-Returns	StandardRefund	 	 	103.24	2	 	 	 	 	 	 
111-6864542-0281829	16-Sep-2024	20-Sep-2024	Approved	DtjGgjGGRRMA	 	AmazonPrePaidLabel	6.06	USD	UPS	1ZF2C2469062953442	Customer	N	N	B0CHN5W6HZ	SRST02-StarTrekLS-Gold-4XL	Mad Engine - Adult, Star Trek, Long Sleeve Halloween Costume T-shirt Spock Captain Kirk Engineering Cosplay	1	CR-UNWANTED_ITEM	Y	C-Returns	StandardRefund	 	 	59.45	2	 	 	 	 	 	27.95
111-0245623-9828207	15-Sep-2024	20-Sep-2024	Approved	Dkj2gmGvRRMA	 	AmazonPrePaidLabel	4.38	USD	USPS	9302010949890088949165	Seller	N	N	B07YBDVF2D	204088-HopperHawaiianShirt-L	Costume Agent Adult Halloween Tropical Hopper Costume Hawaiian Button Down Shirt (Large) Multicoloured	1	AMZ-PG-APP-STYLE	Y	C-Returns	StandardRefund	 	 	27.77	1	 	 	 	 	 	27.77
112-5879547-0833867	20-Sep-2024	20-Sep-2024	Approved	D711gzGhRRMA	 	AmazonPrePaidLabel	6.06	USD	UPS	1ZF2C2469062924812	Seller	N	N	B00DNGYVJY	tmnt045Raph-XL	Teenage Mutant Ninja Turtles TMNT Raphael Costume Green T-Shirt with Red Eye Mask (Adult X-Large)	1	AMZ-PG-APP-STYLE	Y	C-Returns	StandardRefund	 	 	55.51	2	 	 	 	 	 	 
112-5879547-0833867	20-Sep-2024	20-Sep-2024	Approved	D711gzGhRRMA	 	AmazonPrePaidLabel	6.06	USD	UPS	1ZF2C2469062924812	Seller	N	N	B00FY6IK1G	tmnt056Raph-XL	Teenage Mutant Ninja Turtles Long Sleeve Costume T-Shirt & Eye Mask - Green Raphael - X-Large - Ninja Turtle Costume - Ninja Turtle Shirt & Eye Mask Costume	1	AMZ-PG-APP-STYLE	Y	C-Returns	StandardRefund	 	 	55.51	2	 	 	 	 	 	 
111-4016011-0641035	05-Sep-2024	20-Sep-2024	Approved	Dp1dg5GdRRMA	 	AmazonPrePaidLabel	5.07	USD	USPS	9302010949890088948076	Customer	N	N	B0BG99C7LZ	103011-ChuckyKidsShoes-11-12	Unisex Halloween Chuckie Good Guy Child Doll Horror Movie Cosplay Costume Shoes	1	AMZ-PG-APP-TOO-SMALL	Y	C-Returns	StandardRefund	 	 	36.71	1	 	 	 	 	 	36.71
111-2098854-9876261	07-Sep-2024	20-Sep-2024	Approved	DW16g4GtRRMA	 	AmazonPrePaidLabel	6.06	USD	UPS	1ZF2C2469062920012	Customer	N	N	B0CGB1K3Z3	220831-BlueDogCostume-5-6	Costume Agent Playful Colorful Dog Halloween Costume Cosplay Zip Up Suit with Hood for Boys and Girls	1	CR-FOUND_BETTER_PRICE	Y	C-Returns	StandardRefund	 	 	72.23	2	 	 	 	 	 	36.99
111-2098854-9876261	07-Sep-2024	20-Sep-2024	Approved	DW16g4GtRRMA	 	AmazonPrePaidLabel	6.06	USD	UPS	1ZF2C2469062920012	Customer	N	N	B0CGB23XWH	220832-OrangeDogCostume-2	Costume Agent Playful Colorful Dog Halloween Costume Cosplay Zip Up Suit with Hood for Girls and Boys	1	CR-FOUND_BETTER_PRICE	Y	C-Returns	StandardRefund	 	 	72.23	2	 	 	 	 	 	36.99
113-9744407-3869800	16-Sep-2024	20-Sep-2024	Approved	 	 	AmazonUnPaidLabel	0.00	 	 	 	Seller	N	N	B0046BEKLE	tmntmasks-Purple	Costume Agent 1980s Turtle Cartoon Characters Superhero Costume Felt Eye Masks Assorted Colors (Purple)	1	CR-SWITCHEROO	Y	C-Returns	ReturnlessRefund	 	 	4.83	1	 	 	 	 	 	4.83
111-0980087-4233814	13-Sep-2024	20-Sep-2024	Approved	DF1rgNGJRRMA	 	AmazonPrePaidLabel	6.09	USD	USPS	9302010949890088934093	Seller	N	N	B01JSFN70C	suicidesquad004-2X	DC Comics Suicide Squad Harley Quinn Shorts Panties Costume for Women Halloween Cosplay	1	AMZ-PG-APP-STYLE	Y	C-Returns	StandardRefund	 	 	52.55	2	 	 	 	 	 	26.95
111-0980087-4233814	13-Sep-2024	20-Sep-2024	Approved	DF1rgNGJRRMA	 	AmazonPrePaidLabel	6.09	USD	USPS	9302010949890088934093	Seller	N	N	B01JSFN1R6	suicidesquad004-XL	DC Comics Suicide Squad Harley Quinn Shorts Panties Costume for Women Halloween Cosplay	1	AMZ-PG-APP-STYLE	Y	C-Returns	StandardRefund	 	 	52.55	2	 	 	 	 	 	26.95
111-6336387-9411466	16-Sep-2024	20-Sep-2024	Approved	Dk1rgmGrRRMA	 	AmazonPrePaidLabel	3.96	USD	USPS	9302010949890088941824	Seller	N	N	B0CKJY5VXW	SSXX4U-ErnieShirtKids-3T	Mad Engine Bert and Ernie Sesame Street Kids Children Long Sleeve T-Shirt Halloween Costume Cosplay	1	CR-SWITCHEROO	Y	C-Returns	Replacement	 	 	24.95	1	 	 	 	 	 	 
114-7138924-2709053	11-Sep-2024	20-Sep-2024	Approved	Dq1mgSGsRRMA	 	AmazonPrePaidLabel	4.68	USD	USPS	9302010949890088921031	Seller	N	N	B07VMBDWGJ	204075-TonyBadGuyShirt-L/XL	Scarface Tony Montana Hawaiian Adult Costume Button Up Shirt Red	1	CR-MISSED_ESTIMATED_DELIVERY	Y	C-Returns	AutomatedRefund	 	 	32.31	1	 	 	 	 	 	32.31
111-8991681-7225836	13-Sep-2024	20-Sep-2024	Approved	Dx15gyG9RRMA	 	AmazonPrePaidLabel	5.07	USD	USPS	9302010949890088932006	Seller	N	N	B001K3C09U	napoleondynamite003	Rubies Napoleon Dynamite Costume Moon Boots One Size	1	DID_NOT_LIKE_FABRIC	Y	C-Returns	RefundAtFirstScan	 	 	21.15	1	ORDER_IN_RE_SELLABLE_CONDITION	93799-73138-9660413	NOGRANT	30-Sep-2024	 	21.15
111-7173096-6478658	04-Sep-2024	20-Sep-2024	Approved	DF1dg4GHRRMA	 	AmazonPrePaidLabel	10.30	USD	UPS	1ZF2C2469062906770	Seller	N	N	B01M0IXUKG	wrestlingboots-Mred	Costume Agent Pro Wrestling Boots Super Hero Wrestler Halloween Cosplay	1	AMZ-PG-APP-STYLE	Y	C-Returns	StandardRefund	 	 	542.44	8	 	 	 	 	 	65.96
111-7173096-6478658	04-Sep-2024	20-Sep-2024	Approved	DF1dg4GHRRMA	 	AmazonPrePaidLabel	10.30	USD	UPS	1ZF2C2469062906770	Seller	N	N	B0BCXMYWXH	103007-WrestlingBoots-L	Costume Agent Matte Black Wrestling Boots Halloween Cosplay	1	CR-UNWANTED_ITEM	Y	C-Returns	StandardRefund	 	 	542.44	8	 	 	 	 	 	52.76
111-7173096-6478658	04-Sep-2024	20-Sep-2024	Approved	DF1dg4GHRRMA	 	AmazonPrePaidLabel	10.30	USD	UPS	1ZF2C2469062906770	Seller	N	N	B0CJ4KDL5Y	MachoManBoots-L	Macho Wrestler Man Madness Yellow Boots with Stars Halloween Costume Accessory Cosplay	1	AMZ-PG-APP-STYLE	Y	C-Returns	StandardRefund	 	 	542.44	8	 	 	 	 	 	76.96
114-9778101-7013837	07-Sep-2024	20-Sep-2024	Approved	Dx7NgzGfRRMA	 	AmazonPrePaidLabel	4.38	USD	USPS	9302010949890088933881	Seller	N	N	B07HRYZWTF	CocaColaLeggings-CCXX1-L	Coca Cola Coke Red Women's Leggings (Juniors Large)	1	AMZ-PG-APP-TOO-LARGE	Y	C-Returns	RefundAtFirstScan	 	 	24.99	1	BUYER_USED_WRONG_RETURN_REASON_CODE	37247-95111-3377542	GRANT	25-Sep-2024	4.38	24.99
113-2385148-0921857	25-Aug-2024	20-Sep-2024	Approved	DH7sgkG5RRMA	 	AmazonPrePaidLabel	4.31	USD	USPS	9302010949890088929334	Seller	N	N	B07V6RFPRK	204071-UncleRicoShirt-XL	Adult Halloween Costume Kip's Uncle Rico Shirt Blue	1	AMZ-PG-APP-TOO-LARGE	Y	C-Returns	StandardRefund	 	 	31.97	1	 	 	 	 	 	31.97
113-7864562-6023434	12-Sep-2024	20-Sep-2024	Approved	Dh7BgRGCRRMA	 	AmazonPrePaidLabel	6.48	USD	UPS	1ZF2C2469062900945	Seller	N	N	B00FBPL81E	dodgeball003-XXL	Ripple Junction Stiller Dodgeball Movie Character Average Joes Yellow Jersey Set Halloween Costume Cosplay	1	AMZ-PG-APP-TOO-LARGE	Y	C-Returns	StandardRefund	 	 	92.99	2	 	 	 	 	 	47.62
113-2685597-4220211	30-Aug-2024	20-Sep-2024	Approved	 	 	AmazonUnPaidLabel	0.00	 	 	 	Seller	N	N	B00M8HTNC4	batman044-M	Junk Food Batman Logo Adult Heather Gray Tank (Adult Medium)	1	AMZ-PG-APP-TOO-SMALL	Y	C-Returns	ReturnlessRefund	 	 	14.95	1	 	 	 	 	 	14.95
112-0323426-8127409	13-Sep-2024	20-Sep-2024	Approved	DK7kgHGwRRMA	 	AmazonPrePaidLabel	5.93	USD	USPS	9302010949890088930989	Seller	N	N	B07L5WVZ4J	Thing1-6-Union Suit-KIDS-10/12	MJC Dr Seuss Thing 1 & 2 Interchangeable Patches, Adult or Kids Pajama Costume	1	CR-SWITCHEROO	Y	C-Returns	Replacement	 	 	42.49	1	 	 	 	 	 	 
111-2978765-8926669	26-Aug-2024	20-Sep-2024	Approved	Dp7HgmGkRRMA	 	AmazonPrePaidLabel	6.06	USD	UPS	1ZF2C2469062864351	Customer	N	N	B07Y41NXCR	WB1658-WB1659-WonderWomanCostumeSet1-M	Dc Comics Wonder Woman Warrior Corset and Skirt Costume Set (Women's Medium)	1	CR-ORDERED_WRONG_ITEM	Y	C-Returns	RefundAtFirstScan	 	 	75.83	1	 	 	 	 	 	69.77
114-5387792-1957835	14-Sep-2024	20-Sep-2024	Approved	DtDPgXGdRRMA	 	AmazonPrePaidLabel	5.32	USD	USPS	9302010949890088916747	Seller	N	N	B075KQ5GP4	GBStantzLSTee-M	Mad Engine Back Print Graphic Tees Ghostbusters Adult Long Sleeve Costume T-Shirt for Men & Women	1	CR-SWITCHEROO	Y	C-Returns	StandardRefund	 	 	30.40	1	 	 	 	 	 	 
114-1334403-8727424	14-Sep-2024	20-Sep-2024	Approved	D7D9gRGDRRMA	 	AmazonPrePaidLabel	6.06	USD	UPS	1ZF2C2469062850553	Seller	N	N	B0CD914WS8	220811-SkeletonPajamaGLOW-4XL	Skeleton Costume Jumpsuit Women's Halloween Costume Glow in the Dark Cosplay (Glow in the Dark, 4X-Large)	1	CR-DEFECTIVE	Y	C-Returns	RefundAtFirstScan	 	 	43.73	1	 	 	 	 	 	43.73
113-4115023-5760211	09-Sep-2024	20-Sep-2024	Approved	DY8lgpG5RRMA	 	AmazonPrePaidLabel	6.48	USD	UPS	1ZF2C2469062842964	Seller	N	N	B07NSDZZ6V	ILoveXmasUCS-L	Costume Agent I Love Xmas HOHOHO Light Up (LED) and Bells Ugly Christmas Sweater - White (Large)	1	AMZ-PG-APP-TOO-SMALL	Y	C-Returns	StandardRefund	 	 	89.85	2	 	 	 	 	 	67.95
114-8474283-9492209	17-Sep-2024	20-Sep-2024	Approved	Ds84gcGpRRMA	 	AmazonPrePaidLabel	5.07	USD	USPS	9302010949890088900890	Seller	N	N	B01JSFN2Y8	suicidesquad004-S	DC Comics Suicide Squad Harley Quinn Shorts Panties Costume for Women Halloween Cosplay Red/Blue	1	AMZ-PG-APP-TOO-SMALL	Y	C-Returns	StandardRefund	 	 	60.49	2	 	 	 	 	 	 
114-3129611-7627412	17-Sep-2024	20-Sep-2024	Approved	DT83gGG3RRMA	 	AmazonPrePaidLabel	5.45	USD	USPS	9302010949890088872777	Seller	N	N	B001D1H6UW	amywinehousewig	Character Wig, Rehab	1	CR-DEFECTIVE	Y	C-Returns	StandardRefund	 	 	23.96	1	 	 	 	 	 	23.96
114-6192856-3713836	15-Sep-2024	20-Sep-2024	Approved	D78vghGkRRMA	 	AmazonPrePaidLabel	5.80	USD	USPS	9302010949890088875631	Seller	N	N	B07YQBH76Y	220745-AhoySailorCostume-WOMENS-XXL	Costume Agent Adult Womens Robin Ahoy Sailor Halloween Costume Cosplay Set (XXL) Blue	1	AMZ-PG-APP-TOO-SMALL	Y	C-Returns	RefundAtFirstScan	 	 	28.48	1	ORDER_IN_RE_SELLABLE_CONDITION	26174-05866-9901224	NOGRANT	11-Oct-2024	 	28.48
111-9902897-9137043	03-Sep-2024	20-Sep-2024	Approved	D8gNgzG7RRMA	 	AmazonPrePaidLabel	6.48	USD	UPS	1ZF2C2469062800491	Seller	N	N	B018F4LPEC	flashpajama001-XL	DC Comics The Flash Hooded One Piece Pajama (Adult X-Large)	1	AMZ-PG-APP-TOO-SMALL	Y	C-Returns	StandardRefund	 	 	52.70	1	 	 	 	 	 	52.70
112-4804864-3141821	24-Aug-2024	20-Sep-2024	Approved	DfgKgQGsRRMA	 	AmazonPrePaidLabel	6.06	USD	UPS	1ZF2C2469062797531	Seller	N	N	B076HG5JMT	NL029-ChristmasVacationPajamaSet-L	Briefly Stated National Lampoon's Dinosaur Christmas Vacation Pajamas Set | Perfect for Ugly Sweater Parties, Matching Xmas Pajamas for Family	1	CR-SWITCHEROO	Y	C-Returns	RefundAtFirstScan	 	 	48.95	1	 	 	 	 	 	48.95
113-3312109-5829042	27-Aug-2024	20-Sep-2024	Approved	D8g0gcGBRRMA	 	AmazonPrePaidLabel	5.46	USD	UPS	1ZF2C2469062791135	Customer	N	N	B014GD5Z92	oktoberfestmaid001BLUE-4	Costume Agent Oktoberfest Drindl Bavarian German Beer Girl Maid Dress (4) Blue	1	CR-ORDERED_WRONG_ITEM	Y	C-Returns	RefundAtFirstScan	 	 	19.95	1	OTHER	85411-27324-7464754	GRANT	11-Nov-2024	3.99	14.49
112-7771829-3562667	17-Sep-2024	20-Sep-2024	Approved	DTgMgYGNRRMA	 	AmazonPrePaidLabel	6.48	USD	UPS	1ZF2C2469062777544	Customer	N	N	B0CFRC8TKB	221005-EggmanCostume-XL	Costume Agent Dr. Egg Robot Man Jacket Tailcoat Suit Glasses and Mustache Video Game Villain Complete Set Halloween Costume Cosplay, X-Large	1	CR-UNWANTED_ITEM	Y	C-Returns	RefundAtFirstScan	 	 	49.95	1	 	 	 	 	 	43.47
111-0072699-2555453	17-Sep-2024	20-Sep-2024	Approved	DKBzgPGWRRMA	 	AmazonPrePaidLabel	5.80	USD	USPS	9302010949890088877628	Seller	N	N	B09HCRV4NC	220823-PinkBunny-KIDS-3/4T	Kids/Youth/Toddler Christmas Pink Bunny Jumpsuit Halloween Christmas Costume	1	CR-SWITCHEROO	Y	C-Returns	Replacement	 	 	31.49	1	 	 	 	 	 	 
113-7228329-4419408	14-Sep-2024	20-Sep-2024	Approved	DBBMgtG2RRMA	 	AmazonPrePaidLabel	6.84	USD	UPS	1ZF2C2469062764281	Seller	N	N	B01LBRLEX2	100576BLACK-XL	Costume Agent Pirate Boots Adventure Footwear Halloween Costume Cosplay Accessory - Black - X-Large - Pirate Carribean Pirate Boot Men - Men's Tall Boots - Mens Cosplay Boots	1	AMZ-PG-APP-TOO-LARGE	Y	C-Returns	StandardRefund	 	 	152.05	2	 	 	 	 	 	75.95
114-6126988-3956240	09-Sep-2024	20-Sep-2024	Approved	D5BzgsGDRRMA	 	AmazonPrePaidLabel	7.43	USD	UPS	1ZF2C2469062751722	Seller	N	N	B00D5XYWXK	sriracha004-XXL	Sriracha Bottle Label Juniors Red T-Shirt (XX-Large)	1	DID_NOT_LIKE_FABRIC	Y	C-Returns	RefundAtFirstScan	 	 	19.95	1	ORDER_IN_RE_SELLABLE_CONDITION	53127-92314-2818326	NOGRANT	30-Sep-2024	 	19.95
114-1594553-5377029	09-Sep-2024	20-Sep-2024	Approved	D7BbgXGNRRMA	 	AmazonPrePaidLabel	5.46	USD	UPS	1ZF2C2469062747737	Seller	N	N	B0CJVLY44J	DSMN-MensMonstersJacket-S	Mad Engine Monsters University Varsity Jacket Blue and White MU Logo Halloween Costume Cosplay	1	CR-UNWANTED_ITEM	Y	C-Returns	StandardRefund	 	 	42.35	1	 	 	 	 	 	 
114-2977491-3659438	28-Aug-2024	19-Sep-2024	Approved	 	 	AmazonUnPaidLabel	0.00	 	 	 	Seller	N	N	B00O18C1DQ	superherocape002CHILDred-red	Costume Agent Child Reversible Superhero Cape Red and Red	1	AMZ-PG-APP-TOO-LARGE	Y	C-Returns	ReturnlessRefund	 	 	8.57	1	 	 	 	 	 	8.57
112-6262367-9764248	23-Aug-2024	19-Sep-2024	Approved	DpMjgjGLRRMA	 	AmazonPrePaidLabel	6.06	USD	UPS	1ZF2C2469062737480	Customer	N	N	B09J1KN5WT	dodgeball003-4XL	Costume Agent Dodgeball Average Joe's Adult Yellow Jersey Costume Set (4X-Large)	1	CR-ORDERED_WRONG_ITEM	Y	C-Returns	RefundAtFirstScan	 	 	48.43	1	 	 	 	 	 	42.37
113-1328658-7579430	14-Aug-2024	19-Sep-2024	Approved	DTMsgbG9RRMA	 	AmazonPrePaidLabel	5.62	USD	USPS	9302010949890088849571	Seller	N	N	B0024L8HXK	arrested004-XXL	Arrested Development Money Banana Stand White T-Shirt Tee (XXL)	1	CR-UNWANTED_ITEM	Y	C-Returns	StandardRefund	 	 	23.65	1	 	 	 	 	 	23.65
112-9646345-3011460	16-Sep-2024	19-Sep-2024	Approved	DH28gxGhRRMA	 	AmazonPrePaidLabel	6.09	USD	USPS	9302010949890088845894	Seller	N	N	B0CS8K416V	DRSE0D8M-Thing1-Shirt-S	Dr Seuss Thing 1 and Thing 2 Adult Short Sleeves Red T-Shirt Tee	1	CR-MISSED_ESTIMATED_DELIVERY	Y	C-Returns	StandardRefund	 	 	54.11	2	 	 	 	 	 	26.05
112-9646345-3011460	16-Sep-2024	19-Sep-2024	Approved	DH28gxGhRRMA	 	AmazonPrePaidLabel	6.09	USD	USPS	9302010949890088845894	Seller	N	N	B0CS8H6D5N	DRSE0D7M-Thing2-Shirt-L	Dr Seuss Thing 1 and Thing 2 Adult Short Sleeves Red T-Shirt Tee	1	CR-MISSED_ESTIMATED_DELIVERY	Y	C-Returns	StandardRefund	 	 	54.11	2	 	 	 	 	 	26.05
113-7483148-6453818	09-Sep-2024	19-Sep-2024	Approved	D82BgxGdRRMA	 	AmazonPrePaidLabel	5.62	USD	USPS	9302010949890088843401	Customer	N	N	B0CGB21GTG	220831-BlueDogCostume-7-8	Playful Colorful Dog Halloween Costume Cosplay Zip Up Suit with Hood for Boys and Girls	1	CR-UNWANTED_ITEM	Y	C-Returns	RefundAtFirstScan	 	 	38.17	1	 	 	 	 	 	32.55
112-4238310-1611437	13-Sep-2024	19-Sep-2024	Approved	Dr2Ng8G1RRMA	 	AmazonPrePaidLabel	5.46	USD	UPS	1ZF2C2469062709019	Seller	N	N	B0B7BVZR9Z	peanuts044N-2XL	Charlie B Halloween Costume Polo Shirt Yellow Zig Zag T-Shirt Cosplay	1	AMZ-PG-APP-TOO-SMALL	Y	C-Returns	StandardRefund	 	 	27.95	1	 	 	 	 	 	 
112-6164716-0681004	23-Aug-2024	19-Sep-2024	Approved	DK2Gg7GzRRMA	 	AmazonPrePaidLabel	5.00	USD	USPS	9302010949890088839237	Customer	N	N	B0BGVMPWHQ	220930-CaddyShackHat	Costume Agent CaddyShack Golfing Colorful Judge Smails Halloween Costume Fedora Hat	1	CR-UNWANTED_ITEM	Y	C-Returns	RefundAtFirstScan	 	 	31.75	1	 	 	 	 	 	26.75
111-2696289-6787466	15-Sep-2024	19-Sep-2024	Approved	Dh2KgmGbRRMA	 	AmazonPrePaidLabel	5.07	USD	USPS	9302010949890088827746	Seller	N	N	B0CS885ZW7	DRSE0D7M-Thing2-Shirt-2XL	Dr Seuss Thing 1 and Thing 2 Adult Short Sleeves Red T-Shirt Tee	1	AMZ-PG-APP-TOO-SMALL	Y	C-Returns	StandardRefund	 	 	51.26	2	 	 	 	 	 	26.23
112-8115205-3839403	12-Sep-2024	19-Sep-2024	Approved	Dp2vg8GNRRMA	 	AmazonPrePaidLabel	6.06	USD	UPS	1ZF2C2469062691181	Seller	N	N	B0C3WCX9CX	220745-AhoyCostume-WOMENS-3XL	Costume Agent Adult Women's Robin ST TV Show Ahoy Sailor Halloween Costume Cosplay Set (3X-Large)	1	AMZ-PG-BAD-DESC	Y	C-Returns	RefundAtFirstScan	 	 	30.05	1	ORDER_IN_RE_SELLABLE_CONDITION	73207-67090-7845969	NOGRANT	11-Nov-2024	 	30.05
112-8354395-6511441	14-Sep-2024	19-Sep-2024	Approved	 	 	AmazonUnPaidLabel	0.00	 	 	 	Seller	N	N	B0046BEKLE	tmntmasks-Purple	Costume Agent 1980s Turtle Cartoon Characters Superhero Costume Felt Eye Masks Assorted Colors (Purple)	3	DID_NOT_LIKE_COLOR	Y	C-Returns	ReturnlessRefund	 	 	14.11	3	 	 	 	 	 	14.34
111-7137688-6461850	13-Sep-2024	19-Sep-2024	Approved	D2V2gtGqRRMA	 	AmazonPrePaidLabel	5.32	USD	USPS	9302010949890088820631	Seller	N	N	B075KQ5GP4	GBStantzLSTee-M	Mad Engine Back Print Graphic Tees Ghostbusters Adult Long Sleeve Costume T-Shirt for Men & Women	1	CR-SWITCHEROO	Y	C-Returns	Replacement	 	 	30.40	1	 	 	 	 	 	 
112-5692151-4442631	09-Sep-2024	19-Sep-2024	Approved	D4VdgVG5RRMA	 	AmazonPrePaidLabel	6.84	USD	UPS	1ZF2C2469062685438	Seller	N	N	B01LBRLFSQ	100576BLACK-S	Caribbean Movies Pirate Boots Adventure Footwear Halloween Costume Cosplay Accessory Black	1	AMZ-PG-BAD-DESC	Y	C-Returns	StandardRefund	 	 	73.10	1	 	 	 	 	 	 
114-1780865-2226635	05-Sep-2024	19-Sep-2024	Approved	DhVggxG5RRMA	 	AmazonPrePaidLabel	5.15	USD	USPS	9302010949890088831316	Customer	N	N	B015WWTH2W	waynesworldcostumeset002-S	Wayne's World Costume Set - Waynes Hat and Aerosmith Aero Force T-Shirt 90s Retro for Halloween White	1	CR-UNWANTED_ITEM	Y	C-Returns	StandardRefund	 	 	36.24	1	 	 	 	 	 	36.24
114-9665325-5609820	29-Aug-2024	19-Sep-2024	Approved	DBVGgBGWRRMA	 	AmazonPrePaidLabel	6.06	USD	UPS	1ZF2C2469062692288	Seller	N	N	B07WV5QVY3	220078-SharkChubSuitYellow-Adult	Costume Agent Shark Chub Suit Inflatable Adult Halloween Costume (Adult, Yellow)	1	CR-DEFECTIVE	Y	C-Returns	RefundAtFirstScan	 	 	43.05	1	 	 	 	 	 	43.05
111-5783453-4833866	01-Sep-2024	19-Sep-2024	Approved	DpVJgSGmRRMA	 	AmazonPrePaidLabel	4.31	USD	USPS	9302010949890088811905	Seller	N	N	B07YBDVF2D	204088-HopperHawaiianShirt-L	Costume Agent Adult Halloween Tropical Hopper Costume Hawaiian Button Down Shirt (Large) Multicoloured	1	AMZ-PG-APP-TOO-LARGE	Y	C-Returns	StandardRefund	 	 	28.00	1	 	 	 	 	 	 
113-2319415-2793065	12-Sep-2024	19-Sep-2024	Approved	DkVPgmG0RRMA	 	AmazonPrePaidLabel	6.06	USD	UPS	1ZF2C2469062684662	Seller	N	N	B018F4LQ46	flashpajama001-L	DC Comics The Flash Hooded One Piece Pajama (Adult Large)	1	AMZ-PG-APP-TOO-LARGE	Y	C-Returns	RefundAtFirstScan	 	 	52.26	1	ORDER_IN_RE_SELLABLE_CONDITION	82759-17365-8064307	NOGRANT	30-Sep-2024	 	52.26
114-3286721-1485845	16-Sep-2024	19-Sep-2024	Approved	 	 	AmazonUnPaidLabel	0.00	 	 	 	Seller	N	N	B07JG92XS1	jokersocks-7-9	Costume Agent Adult Halloween Costume Accessory Joke Socks (Size 7/9)	1	CR-UNWANTED_ITEM	Y	C-Returns	ReturnlessRefund	 	 	26.65	2	 	 	 	 	 	13.63
113-3285077-6981834	16-Sep-2024	19-Sep-2024	Approved	DTVggVGzRRMA	 	AmazonPrePaidLabel	5.15	USD	USPS	9302010949890088812407	Seller	N	N	B0CDN4DN7Q	221030-CampWalden-Shirt-S	Camp Walden Summer Camp Parent Movie Unisex Adult Halloween Costume Cosplay White	2	AMZ-PG-APP-TOO-SMALL	Y	C-Returns	RefundAtFirstScan	 	 	54.47	2	INVALID_SELLER_REFUND_OR_DEBIT	88345-39426-3179612	GRANT	25-Sep-2024	17.1	55.47
111-2076614-9814665	13-Sep-2024	19-Sep-2024	Approved	DQt6gBGjRRMA	 	AmazonPrePaidLabel	4.47	USD	USPS	9302010949890088804594	Seller	N	N	B0887LFPN8	3001-White-ChampionShirt-M	Hollywood Champion T Shirt for Men, Officially Licensed Tee for Cliff Booth Fans - Medium - White	1	AMZ-PG-APP-TOO-SMALL	Y	C-Returns	RefundAtFirstScan	 	 	27.01	1	ORDER_IN_RE_SELLABLE_CONDITION	61883-74288-5512835	NOGRANT	30-Sep-2024	 	27.01
113-1581051-4861824	16-Sep-2024	19-Sep-2024	Approved	DjtMgPGpRRMA	 	AmazonPrePaidLabel	5.32	USD	USPS	9302010949890088808141	Seller	N	N	B0B1VXX3DX	apolloflagrobe1	Costume Agent Boxer Movie Boxing American Flag Halloween Robe Multicolor	1	CR-MISSED_ESTIMATED_DELIVERY	Y	C-Returns	StandardRefund	 	 	30.26	1	 	 	 	 	 	30.26
114-5780359-9681039	18-Sep-2024	19-Sep-2024	Approved	 	 	AmazonUnPaidLabel	0.00	 	 	 	Customer	N	N	B0054RW2D2	scottpilgrimwristband-GreenandWhite	Scott Pilgrim vs. The World Movie Wristband (Green & White)	1	CR-ORDERED_WRONG_ITEM	Y	C-Returns	ReturnlessRefund	 	 	12.30	2	 	 	 	 	 	6.30
114-4158682-2053846	13-Sep-2024	19-Sep-2024	Approved	DTtRgBGdRRMA	 	AmazonPrePaidLabel	6.06	USD	UPS	1ZF2C2469062656504	Seller	N	N	B005MYCCJQ	leagueoftheirowncostume-Small/Medium	Costume Agent Rockford Peaches AAGPBL Baseball Halloween Dress Costume Cosplay	1	AMZ-PG-APP-TOO-LARGE	Y	C-Returns	RefundAtFirstScan	 	 	48.43	1	ORDER_IN_RE_SELLABLE_CONDITION	68619-15897-8075923	NOGRANT	01-Oct-2024	 	48.43
113-5284660-2396224	10-Sep-2024	19-Sep-2024	Approved	 	 	AmazonUnPaidLabel	0.00	 	 	 	Seller	N	N	B0046BEKLE	tmntmasks-Purple	Costume Agent 1980s Turtle Cartoon Characters Superhero Costume Felt Eye Masks Assorted Colors (Purple)	1	AMZ-PG-BAD-DESC	Y	C-Returns	ReturnlessRefund	 	 	4.77	1	 	 	 	 	 	4.77
114-5998515-4516213	11-Sep-2024	19-Sep-2024	Approved	Drt3gpGQRRMA	 	AmazonPrePaidLabel	4.68	USD	USPS	9302010949890088809377	Seller	N	N	B07HBBMFYJ	LolaSleepSet-WB1787-69-M	Underboss Tune Squad Varsity Halloween Costume Pajamas Shorts and Tank Top - Bunny #10 - Medium - Halloween Basketball Costume for Women	1	AMZ-PG-APP-TOO-SMALL	Y	C-Returns	RefundAtFirstScan	 	 	43.09	1	INVALID_SELLER_REFUND_OR_DEBIT	36546-10696-9369858	GRANT	03-Oct-2024	4.68	44.04
112-6405899-2569010	15-Sep-2024	19-Sep-2024	Approved	D8tkgCGzRRMA	 	AmazonPrePaidLabel	6.06	USD	UPS	1ZF2C2469062645794	Customer	N	N	B0CHMZXRXC	GBXX1DY-GhostbustersDress-4XL	Mad Engine Ghostbusters Dress with 4 Interchangeable Name Patches Halloween Costume Cosplay	1	CR-ORDERED_WRONG_ITEM	Y	C-Returns	RefundAtFirstScan	 	 	44.95	1	 	 	 	 	 	38.89
114-9546459-0953061	11-Sep-2024	19-Sep-2024	Approved	DktpgvGFRRMA	 	AmazonPrePaidLabel	6.06	USD	UPS	1ZF2C2469062644580	Seller	N	N	B005MYCCJ6	leagueoftheirowncostume-L/XLdeluxe	Costume Agent Rockford Peaches AAGPBL Baseball Dress Halloween Costume Cosplay	1	AMZ-PG-APP-TOO-SMALL	Y	C-Returns	RefundAtFirstScan	 	 	48.10	1	ORDER_IN_RE_SELLABLE_CONDITION	66051-02395-2713424	NOGRANT	09-Oct-2024	 	48.10
111-1466119-5004204	15-Sep-2024	19-Sep-2024	Approved	DKtPg8GwRRMA	 	AmazonPrePaidLabel	5.07	USD	USPS	9302010949890088802385	Customer	N	N	B08HNJY2SF	220775-BigBoyOverall-RED-L/XL	Costume Agent Checkered Overalls Adult Game Day Halloween Costume Cosplay - Red (Large-X-Large)	1	CR-UNWANTED_ITEM	Y	C-Returns	RefundAtFirstScan	 	 	49.33	1	 	 	 	 	 	44.26
113-9726661-4756235	15-Sep-2024	19-Sep-2024	Approved	DqtlgBGNRRMA	 	AmazonPrePaidLabel	6.06	USD	UPS	1ZF2C2469062627661	Seller	N	N	B08FF2CMG9	FWMSC20-StantzShirt-XL	Mad Engine Ghostbusters Costume Adult T-Shirt - Short Sleeves	1	AMZ-PG-APP-TOO-LARGE	Y	C-Returns	StandardRefund	 	 	72.49	3	 	 	 	 	 	 
112-5223152-9330659	26-Aug-2024	19-Sep-2024	Approved	 	 	AmazonUnPaidLabel	0.00	 	 	 	Seller	N	N	B012EEENJS	germanhat001-grey	Costume Agent German Alpine Bavarian Oktoberfest Costume Hat with Feather - Grey - German Hat For Men & Women - Bavarian Hat for Lederhosen	1	AMZ-PG-APP-TOO-SMALL	Y	C-Returns	ReturnlessRefund	 	 	10.95	1	 	 	 	 	 	10.95
113-9726661-4756235	15-Sep-2024	19-Sep-2024	Approved	DjbmgZGhRRMA	 	AmazonPrePaidLabel	6.06	USD	UPS	1ZF2C2469062635401	Seller	N	N	B08FDZR5WJ	G0MSC20-VenkmanShirt-2XL	Mad Engine Ghostbusters Costume Adult T-Shirt - Short Sleeves	1	AMZ-PG-APP-TOO-LARGE	Y	C-Returns	StandardRefund	 	 	72.49	3	 	 	 	 	 	24.53
111-6112313-8316202	11-Sep-2024	19-Sep-2024	Approved	 	 	AmazonUnPaidLabel	0.00	 	 	 	Seller	N	N	B00O18BRUO	superherocape002CHILDblk-blk	Costume Agent Reversible Child Black and Black Superhero Costume Cape (Child)	1	AMZ-PG-APP-TOO-SMALL	Y	C-Returns	ReturnlessRefund	 	 	9.58	1	 	 	 	 	 	9.58
112-8181888-7145006	14-Sep-2024	19-Sep-2024	Approved	DQbCgBGjRRMA	 	AmazonPrePaidLabel	3.96	USD	USPS	9302010949890088799210	Seller	N	N	B07YNZVV7G	BretHitmanSunglasses	Costume Agent Adult Unisex Bret Hitman Hart Wrestler Replica Wrap Around Halloween Sunglasses	1	CR-DEFECTIVE	Y	C-Returns	RefundAtFirstScan	 	 	24.26	1	 	 	 	 	 	24.26
113-9726661-4756235	15-Sep-2024	19-Sep-2024	Approved	Dsb2gwGjRRMA	 	AmazonPrePaidLabel	6.06	USD	UPS	1ZF2C2469062634966	Seller	N	N	B08FDZR5WJ	G0MSC20-VenkmanShirt-2XL	Mad Engine Ghostbusters Costume Adult T-Shirt - Short Sleeves	1	AMZ-PG-APP-TOO-LARGE	Y	C-Returns	StandardRefund	 	 	72.49	3	 	 	 	 	 	 
112-7229000-5060229	14-Sep-2024	19-Sep-2024	Approved	DLbNgqGdRRMA	 	AmazonPrePaidLabel	5.07	USD	USPS	9302010949890088800817	Seller	N	N	B09H7NQKJX	220850-ChuckieCostume-2T	Chuckie Good Guy Doll Kids Costume Set Long Sleeve Shirt and Overalls Childrens Halloween Cosplay	1	AMZ-PG-BAD-DESC	Y	C-Returns	StandardRefund	 	 	65.27	1	 	 	 	 	 	 
112-9006394-6730658	15-Sep-2024	19-Sep-2024	Approved	 	 	AmazonUnPaidLabel	0.00	 	 	 	Seller	N	N	B0046BEKLE	tmntmasks-Purple	Costume Agent 1980s Turtle Cartoon Characters Superhero Costume Felt Eye Masks Assorted Colors (Purple)	1	AMZ-PG-BAD-DESC	Y	C-Returns	ReturnlessRefund	 	 	4.77	1	 	 	 	 	 	4.77
