114-9370824-9721833	23-Aug-2024	26-Sep-2024	Approved	 	 	AmazonUnPaidLabel	0.00	 	 	 	Seller	N	N	B012EEENJS	germanhat001-grey	Costume Agent German Alpine Bavarian Oktoberfest Costume Hat with Feather - Grey - German Hat For Men & Women - Bavarian Hat for Lederhosen	1	CR-UNWANTED_ITEM	Y	C-Returns	ReturnlessRefund	 	 	11.61	1	 	 	 	 	 	11.61
114-7965829-9061014	24-Sep-2024	26-Sep-2024	Approved	DQS7qmGyRRMA	 	AmazonPrePaidLabel	6.06	USD	UPS	1ZF2C2469066041330	Seller	N	N	B01JSFN0UE	suicidesquad003-M	DC Comics Suicide Squad Harley Quinn Daddy Little Monster Movie Costume for Women White Short Sleeve T-Shirt for Cosplay	1	CR-ORDERED_WRONG_ITEM	Y	C-Returns	StandardRefund	 	 	60.32	2	 	 	 	 	 	 
114-7965829-9061014	24-Sep-2024	26-Sep-2024	Approved	DQS7qmGyRRMA	 	AmazonPrePaidLabel	6.06	USD	UPS	1ZF2C2469066041330	Seller	N	N	B01JSFN8CY	suicidesquad004-L	DC Comics Suicide Squad Harley Quinn Shorts Panties Costume for Women Halloween Cosplay Red/Blue	1	CR-ORDERED_WRONG_ITEM	Y	C-Returns	StandardRefund	 	 	60.32	2	 	 	 	 	 	 
112-5821942-9131428	22-Sep-2024	26-Sep-2024	Approved	Df5mqgG0RRMA	 	AmazonPrePaidLabel	6.06	USD	UPS	1ZF2C2469066032288	Seller	N	N	B07L5X8JPC	Thing1-6-Union Suit-KIDS-7/8	Dr Seuss Thing 1 & 2 Interchangeable Patches Adult or Kids Pajama Costume	1	AMZ-PG-APP-TOO-SMALL	Y	C-Returns	StandardRefund	 	 	85.70	2	 	 	 	 	 	43.85
113-8550228-6298667	20-Sep-2024	26-Sep-2024	Approved	DK5Xq6G0RRMA	 	AmazonPrePaidLabel	5.52	USD	USPS	9302010949890090569450	Seller	N	N	B0CBQQRZQ7	220883-Robbercostume-4XL	Costume Agent Adult Unisex Criminal Robber Cat Burgler Halloween Costume Cosplay Deluxe Set (4X-Large)	1	CR-QUALITY_UNACCEPTABLE	Y	Amazon CS	StandardRefund	 	 	34.74	1	 	 	 	 	 	34.74
112-7271266-7515441	23-Sep-2024	26-Sep-2024	Approved	Df5XqMGcRRMA	 	AmazonPrePaidLabel	4.31	USD	USPS	9302010949890090579169	Seller	N	N	B0BPTPG1WV	220965-GhostSpiderOnesie-2T	Costume Agent Spider Purple Pink Superhero Ghost Pajama Zip Up Jumpsuit with Hood (2T)	1	AMZ-PG-APP-TOO-SMALL	Y	C-Returns	StandardRefund	 	 	29.91	1	 	 	 	 	 	 
112-2466964-5344216	15-Sep-2024	26-Sep-2024	Approved	Dx5ZqcG4RRMA	 	AmazonPrePaidLabel	5.32	USD	USPS	9302010949890090541968	Seller	N	N	B00DNICPKO	tmnt046jDon-L	Teenage Mutant Ninja Turtles TMNT Donatello Costume Green T-shirt with Purple Eye Mask (Juniors Large)	1	AMZ-PG-APP-TOO-LARGE	Y	C-Returns	StandardRefund	 	 	49.96	2	 	 	 	 	 	25.58
111-4874372-4457032	16-Sep-2024	26-Sep-2024	Approved	Dv5WqLG4RRMA	 	AmazonPrePaidLabel	5.80	USD	USPS	9302010949890090541937	Seller	N	N	B07VPR97D6	100950-CowboyChaps1	Costume Agent Jessie Cowboy Cowgirl Chaps Halloween & Cosplay Costume Accessory for Adults - White	1	CR-UNWANTED_ITEM	Y	C-Returns	RefundAtFirstScan	 	 	57.70	1	INVALID_SELLER_REFUND_OR_DEBIT	51909-71062-6094536	GRANT	02-Oct-2024	14.95	57.70
112-2466964-5344216	15-Sep-2024	26-Sep-2024	Approved	D55xq5GbRRMA	 	AmazonPrePaidLabel	5.32	USD	USPS	9302010949890090553824	Seller	N	N	B00DNICOBY	tmnt046jDon-M	Teenage Mutant Ninja Turtles TMNT Donatello Costume Juniors Green T-Shirt with Purple Eye Mask (Juniors Medium)	1	AMZ-PG-APP-TOO-SMALL	Y	C-Returns	StandardRefund	 	 	49.96	2	 	 	 	 	 	25.58
114-2502217-4886624	16-Sep-2024	26-Sep-2024	Approved	DBNKqYGhRRMA	 	AmazonPrePaidLabel	6.66	USD	USPS	9302010949890090537879	Seller	N	N	B0C9G96PN7	220892-MabelPinesSweater-XS	Rainbow Star Pink Pines Cartoon Cosplay Sweater, Full Knitted Halloween Costume	1	AMZ-PG-APP-TOO-SMALL	Y	C-Returns	StandardRefund	 	 	52.09	1	 	 	 	 	 	52.09
114-0748581-6504262	17-Sep-2024	26-Sep-2024	Approved	DkNyqhGCRRMA	 	AmazonPrePaidLabel	5.93	USD	USPS	9302010949890090562291	Seller	N	N	B09JCNVSR1	dodgeball003N-XL	Dodgeball Average Joe's Adult Yellow Jersey Costume Set (X-Large)	1	CR-UNWANTED_ITEM	Y	C-Returns	StandardRefund	 	 	89.57	1	 	 	 	 	 	 
113-2879866-3557829	13-Sep-2024	26-Sep-2024	Approved	DBNVqlGmRRMA	 	AmazonPrePaidLabel	5.45	USD	USPS	9302010949890090567739	Seller	N	N	B0BC2F5KX8	220936-LegLampSkirt-S-M	Costume Agent Xmas Movie Women's Christmas Leg Lamp Skirt Halloween Cosplay	1	DID_NOT_LIKE_FABRIC	Y	C-Returns	RefundAtFirstScan	 	 	43.39	1	ORDER_IN_RE_SELLABLE_CONDITION	76100-21771-8828622	NOGRANT	10-Nov-2024	 	43.39
113-6273558-8729041	22-Sep-2024	26-Sep-2024	Approved	DvN0qpGlRRMA	 	AmazonPrePaidLabel	6.06	USD	UPS	1ZF2C2469066006066	Seller	N	N	B0BG94Q4FQ	220916-FlintTropics33Set-L/XL	Costume Agent Jackie Moon Basketball Player Flint Tropics #33 Jersey and Shorts Halloween Costume Cosplay	1	CR-MISSED_ESTIMATED_DELIVERY	Y	C-Returns	StandardRefund	 	 	53.45	1	 	 	 	 	 	53.45
111-4168112-3727407	11-Sep-2024	26-Sep-2024	Approved	DrNqq4GtRRMA	 	AmazonPrePaidLabel	6.48	USD	UPS	1ZF2C2469066002640	Seller	N	N	B0B835NJK9	leagueoftheirowncostume-2X/3X	Costume Agent Rockford Peaches Movie AAGPBL Baseball Dress Halloween Cosplay	1	AMZ-PG-APP-TOO-SMALL	Y	C-Returns	StandardRefund	 	 	94.67	2	 	 	 	 	 	48.46
113-3529811-9843458	10-Sep-2024	26-Sep-2024	Approved	DhNvqsG4RRMA	 	AmazonPrePaidLabel	4.68	USD	USPS	9302010949890090551929	Seller	N	N	B01JSFN70C	suicidesquad004-2X	DC Comics Suicide Squad Harley Quinn Shorts Panties Costume for Women Halloween Cosplay	1	CR-DAMAGED_BY_CARRIER	Y	C-Returns	RefundAtFirstScan	 	 	29.31	1	 	 	 	 	 	29.31
113-4247827-6840237	19-Sep-2024	26-Sep-2024	Approved	DfNKq5GRRRMA	 	AmazonPrePaidLabel	4.38	USD	USPS	9302010949890090527269	Seller	N	N	B01JSFN1R6	suicidesquad004-XL	DC Comics Suicide Squad Harley Quinn Shorts Panties Costume for Women Halloween Cosplay	1	AMZ-PG-APP-STYLE	Y	C-Returns	StandardRefund	 	 	29.20	1	 	 	 	 	 	 
113-4794476-7815435	19-Sep-2024	26-Sep-2024	Approved	Df4hqxGgRRMA	 	AmazonPrePaidLabel	6.48	USD	UPS	1ZF2C2469065977886	Customer	N	N	B0BGQCPZC5	220939-BeerfestTracksuit-L	Costume Agent Beer Fest USA Blue and Red Tracksuit Jacket and Pants Halloween Costume Cosplay, Blue	1	CR-UNWANTED_ITEM	Y	C-Returns	RefundAtFirstScan	 	 	75.72	1	 	 	 	 	 	69.24
112-9775906-3613830	18-Sep-2024	26-Sep-2024	Approved	Df4YqCGGRRMA	 	AmazonPrePaidLabel	7.07	USD	UPS	1ZF2C2469065962427	Seller	N	N	B07ZL27R79	TSM20002TV-WoodyBelt-L	Toy Story Woody and Jessie Halloween Cosplay Costume Belt (Large - 38" - 42") Brown	1	AMZ-PG-APP-STYLE	Y	C-Returns	StandardRefund	 	 	83.09	2	 	 	 	 	 	18.71
114-6839114-9844215	20-Sep-2024	26-Sep-2024	Approved	D243qsGrRRMA	 	AmazonPrePaidLabel	4.68	USD	USPS	9302010949890090551639	Seller	N	N	B07BRZHY7J	hulk001N-S	Costume Agent Yellow Hulk Hogan T-Shirt for Men & Women	1	DID_NOT_LIKE_FABRIC	Y	C-Returns	RefundAtFirstScan	 	 	25.22	1	ORDER_IN_RE_SELLABLE_CONDITION	26012-30057-8553626	NOGRANT	18-Oct-2024	 	25.76
113-1966264-3222660	23-Sep-2024	26-Sep-2024	Approved	D74tqsGLRRMA	 	AmazonPrePaidLabel	5.52	USD	USPS	9302010949890090549087	Seller	N	N	B002VRLJSM	sanford068-5X	American Classics Sanford and Son 5 Across yo Lip T-Shirt Black (XXXXX-Large 5X)	1	AMZ-PG-APP-TOO-LARGE	Y	C-Returns	RefundAtFirstScan	 	 	23.27	1	 	 	 	 	 	23.27
113-8042276-2233868	16-Sep-2024	26-Sep-2024	Approved	DZ4BqWG2RRMA	 	AmazonPrePaidLabel	6.84	USD	UPS	1ZF2C2469065961017	Seller	N	N	B01LBRLA6S	100576BROWN-L	Costume Agent Pirate Boots Adventure Footwear Halloween Costume Cosplay Accessory - Brown - Large - Pirate Carribean Pirate Boot Men - Men's Tall Boots - Mens Cosplay Boots	1	AMZ-PG-APP-TOO-LARGE	Y	C-Returns	RefundAtFirstScan	 	 	74.15	1	ORDER_IN_RE_SELLABLE_CONDITION	58931-28006-9101931	NOGRANT	02-Oct-2024	 	74.15
113-6234375-9596227	18-Sep-2024	26-Sep-2024	Approved	DxyzqJG8RRMA	 	AmazonPrePaidLabel	6.06	USD	UPS	1ZF2C2469065935135	Seller	N	N	B0CDD6LXLY	221003-CheerleaderMens-M	Costume Agent Cheerleader Halloween Costume for Mens and Womens Adult Unisex Varsity High School Cosplay	1	AMZ-PG-APP-TOO-LARGE	Y	C-Returns	RefundAtFirstScan	 	 	49.95	1	 	 	 	 	 	49.95
114-5445317-7136225	19-Sep-2024	26-Sep-2024	Approved	Dry0q9GCRRMA	 	AmazonPrePaidLabel	4.38	USD	USPS	9302010949890090532409	Seller	N	N	B0CHN53HHR	SRST02-StarTrekLS-Blue-M	Mad Engine Adult Star Trek Long Sleeve Halloween Costume T-shirt,Spock Captain Kirk Engineering Cosplay	1	AMZ-PG-APP-TOO-SMALL	Y	C-Returns	RefundAtFirstScan	 	 	29.95	1	 	 	 	 	 	29.95
111-7759299-6334609	23-Sep-2024	26-Sep-2024	Approved	 	 	AmazonUnPaidLabel	0.00	 	 	 	Seller	N	N	B0046BEKLE	tmntmasks-Purple	Costume Agent 1980s Turtle Cartoon Characters Superhero Costume Felt Eye Masks Assorted Colors (Purple)	1	AMZ-PG-BAD-DESC	Y	C-Returns	ReturnlessRefund	 	 	4.87	1	 	 	 	 	 	4.87
112-6609009-3078655	23-Aug-2024	26-Sep-2024	Approved	DWF1q7GhRRMA	 	AmazonPrePaidLabel	6.48	USD	UPS	1ZF2C2469065917477	Seller	N	N	B08GQ9Q7LH	220767-QuintCostumeSet-XXXL	Costume Agent Jaws Shark Quint Adult Halloween Costume Complete Set - Multicoloured (3X-Large)	1	AMZ-PG-APP-TOO-LARGE	Y	C-Returns	RefundAtFirstScan	 	 	75.72	1	ORDER_IN_RE_SELLABLE_CONDITION	40799-43241-9461125	NOGRANT	09-Oct-2024	 	75.72
113-4658356-7857861	20-Sep-2024	26-Sep-2024	Approved	DTFQq5GZRRMA	 	AmazonPrePaidLabel	6.06	USD	UPS	1ZF2C2469065918109	Seller	N	N	B0D4WK72W9	leagueoftheirowncostume-S	Rockford Peaches Movie AAGPBL Baseball Dress Halloween Costume Cosplay	1	CR-DEFECTIVE	Y	C-Returns	StandardRefund	 	 	48.52	1	 	 	 	 	 	48.52
112-5739378-0669064	13-Sep-2024	26-Sep-2024	Approved	DqFfq3G3RRMA	 	AmazonPrePaidLabel	5.32	USD	USPS	9302010949890090490112	Seller	N	N	B075KRTVDN	GBSpenglerLSTee-M	Mad Engine Back Print Graphic Tees Ghostbusters Adult Long Sleeve Costume T-Shirt for Men & Women	1	CR-SWITCHEROO	Y	C-Returns	Replacement	 	 	30.40	1	 	 	 	 	 	 
114-6619362-6295447	21-Sep-2024	26-Sep-2024	Approved	DQFZqwG2RRMA	 	AmazonPrePaidLabel	5.62	USD	USPS	9302010949890090489741	Seller	N	N	B07YZS3FPN	MachoManCostumeSet-XL	Macho Man T-shirt Bandana and Sunglasses Complete Costume Set (Adult X-Large)	1	AMZ-PG-APP-STYLE	Y	C-Returns	RefundAtFirstScan	 	 	66.97	1	 	 	 	 	 	66.97
111-4138284-9872261	21-Sep-2024	26-Sep-2024	Approved	DpFHqYGBRRMA	 	AmazonPrePaidLabel	6.06	USD	UPS	1ZF2C2469065887938	Seller	N	N	B0B835NJK9	leagueoftheirowncostume-2X/3X	Costume Agent Rockford Peaches Movie AAGPBL Baseball Dress Halloween Cosplay	1	CR-UNWANTED_ITEM	Y	C-Returns	RefundAtFirstScan	 	 	49.45	1	INVALID_SELLER_REFUND_OR_DEBIT	63726-70689-0853438	GRANT	03-Oct-2024	6.06	49.45
112-0823395-3917058	18-Sep-2024	26-Sep-2024	Approved	DFFMqVGkRRMA	 	AmazonPrePaidLabel	4.47	USD	USPS	9302010949890090500057	Customer	N	N	B0DBRP7DGZ	WB1157-HQLilMonster-Shirt-S	COCO BRANDS Suicide Squad Harley Quinn Daddy Little Monster Halloween Costume Cosplay for Women White Raglan T-Shirt	1	CR-ORDERED_WRONG_ITEM	Y	C-Returns	StandardRefund	 	 	62.48	2	 	 	 	 	 	 
111-9107029-9953837	12-Sep-2024	26-Sep-2024	Approved	DYFKqTGNRRMA	 	AmazonPrePaidLabel	6.48	USD	UPS	1ZF2C2469065893681	Seller	N	N	B0BG3DLRN6	220944-BarfCostumeSet-2X-3X	Costume Agent Space Balls Barf Halloween Cosplay Costume Set - 2XL-3XL - Space Balls Costumes for Men & Women - Barf Spaceballs Costume - Halloween Costumes Men & Women	1	AMZ-PG-APP-TOO-LARGE	Y	C-Returns	StandardRefund	 	 	102.24	2	 	 	 	 	 	79.95
113-0942883-0841046	19-Sep-2024	26-Sep-2024	Approved	DL3zqSGgRRMA	 	AmazonPrePaidLabel	6.23	USD	USPS	9302010949890090507254	Seller	N	N	B09F4N3BVF	woodylongsleeveadultshirt-4XL	Mad Engine Toy Story I am Woody Adult Long Sleeve Costume T-Shirt (4X-Large) Yellow	1	CR-UNWANTED_ITEM	Y	C-Returns	RefundAtFirstScan	 	 	30.26	1	ORDER_IN_RE_SELLABLE_CONDITION	92469-69161-1339869	NOGRANT	02-Oct-2024	 	30.26
111-3484543-8969849	21-Sep-2024	26-Sep-2024	Approved	Dj3LqpG8RRMA	 	AmazonPrePaidLabel	5.07	USD	USPS	9302010949890090499450	Seller	N	N	B076634BPK	juno004-S	Costume Agent JUNO Orange and White Pregnant Impersonation T-Shirt (Adult Small)	1	CR-UNWANTED_ITEM	Y	C-Returns	RefundAtFirstScan	 	 	24.95	1	ORDER_IN_RE_SELLABLE_CONDITION	16201-98636-9945501	NOGRANT	09-Oct-2024	 	24.95
112-2187067-0404245	15-Sep-2024	26-Sep-2024	Approved	DK3rqTGyRRMA	 	AmazonPrePaidLabel	4.43	USD	USPS	9302010949890090492000	Customer	N	N	B01M0USEIQ	blowupguitar	Costume Agent Wayne's World Blow Up Guitar Music Costume Prop	1	AMZ-PG-APP-TOO-LARGE	Y	C-Returns	RefundAtFirstScan	 	 	18.22	1	 	 	 	 	 	13.79
111-4770249-3548244	22-Sep-2024	26-Sep-2024	Approved	Dx3fqCGHRRMA	 	AmazonPrePaidLabel	5.07	USD	USPS	9302010949890090467602	Seller	N	N	B014LRDGCG	incredhulk013-L	Marvel Incredible Hulk Sublimated Adult Long Sleeve Costume T-Shirt - Large Multi	1	AMZ-PG-APP-STYLE	Y	C-Returns	RefundAtFirstScan	 	 	29.63	1	ORDER_IN_RE_SELLABLE_CONDITION	78559-31860-5081920	NOGRANT	03-Oct-2024	 	29.63
112-9775906-3613830	18-Sep-2024	26-Sep-2024	Approved	Dx3jqBGNRRMA	 	AmazonPrePaidLabel	7.07	USD	UPS	1ZF2C2469065862160	Seller	N	N	B07WK9WS7N	100584-SheriffBoots-8/9	Costume Agent Adult Cowboy Sheriff Woody Deluxe Costume Boots - Brown (US 8/9)	1	AMZ-PG-APP-STYLE	Y	C-Returns	StandardRefund	 	 	83.09	2	 	 	 	 	 	49.26
112-9775906-3613830	18-Sep-2024	26-Sep-2024	Approved	D73sq3GRRRMA	 	AmazonPrePaidLabel	7.07	USD	UPS	1ZF2C2469065864999	Seller	N	N	B07ZL27R79	TSM20002TV-WoodyBelt-L	Toy Story Woody and Jessie Halloween Cosplay Costume Belt (Large - 38" - 42") Brown	1	AMZ-PG-APP-STYLE	Y	C-Returns	StandardRefund	 	 	83.09	2	 	 	 	 	 	 
112-6425730-5577801	20-Sep-2024	26-Sep-2024	Approved	Ds34q2GRRRMA	 	AmazonPrePaidLabel	4.38	USD	USPS	9302010949890090492673	Seller	N	N	B07DP47XKL	incredibles004-M	The Incredibles Basicon Red Long Sleeve T-Shirt and Mask Costume Set (Adult Medium)	1	CR-UNWANTED_ITEM	Y	C-Returns	StandardRefund	 	 	21.95	1	 	 	 	 	 	 
111-7508042-9919427	14-Sep-2024	26-Sep-2024	Approved	D2kRqLGZRRMA	 	AmazonPrePaidLabel	5.15	USD	USPS	9302010949890090483954	Seller	N	N	B07HBC5W3C	LolaSleepSet-WB1787-69-L	Underboss Tune Squad Varsity Halloween Costume Pajamas Shorts and Tank Top - Bunny #10 - Large - Halloween Basketball Costume for Women	1	AMZ-PG-APP-TOO-SMALL	Y	C-Returns	RefundAtFirstScan	 	 	42.80	1	ORDER_IN_RE_SELLABLE_CONDITION	80607-62603-3367253	NOGRANT	09-Oct-2024	 	43.75
111-8015120-8021005	12-Sep-2024	26-Sep-2024	Approved	DKkTq2GqRRMA	 	AmazonPrePaidLabel	4.38	USD	USPS	9302010949890090493144	Seller	N	N	B01JSFN0UE	suicidesquad003-M	DC Comics Suicide Squad Harley Quinn Daddy Little Monster Movie Costume for Women White Short Sleeve T-Shirt for Cosplay	1	AMZ-PG-APP-TOO-SMALL	Y	C-Returns	AutomatedRefund	 	 	31.75	1	INVALID_SELLER_REFUND_OR_DEBIT	88749-67989-6772026	GRANT	01-Nov-2024	4.38	31.75
112-6706519-3633822	10-Sep-2024	26-Sep-2024	Approved	DBksqHGWRRMA	 	AmazonPrePaidLabel	4.47	USD	USPS	9302010949890090467039	Seller	N	N	B00FH80Y2Y	powerrangers017red-S	Power Rangers The Red Tunic Tank Dress with Socks (Juniors Small)	1	AMZ-PG-APP-TOO-SMALL	Y	C-Returns	StandardRefund	 	 	19.43	1	 	 	 	 	 	 
112-4323114-1162638	16-Sep-2024	26-Sep-2024	Approved	DBkRqzGlRRMA	 	AmazonPrePaidLabel	4.38	USD	USPS	9302010949890090472378	Seller	N	N	B014LRDKU4	incredhulk013-M	Marvel Incredible Hulk Sublimated Adult Long Sleeve Costume T-Shirt - Medium Multi	1	DID_NOT_LIKE_FABRIC	Y	C-Returns	StandardRefund	 	 	29.24	1	 	 	 	 	 	 
112-6880759-2832218	16-Sep-2024	26-Sep-2024	Approved	D5k4qBGzRRMA	 	AmazonPrePaidLabel	4.38	USD	USPS	9302010949890090448762	Seller	N	N	B01JSFN1R6	suicidesquad004-XL	DC Comics Suicide Squad Harley Quinn Shorts Panties Costume for Women Halloween Cosplay	1	CR-UNWANTED_ITEM	Y	C-Returns	StandardRefund	 	 	57.41	2	 	 	 	 	 	 
112-9225466-9828253	22-Sep-2024	26-Sep-2024	Approved	DZk8qFGyRRMA	 	AmazonPrePaidLabel	3.96	USD	USPS	9302010949890090448588	Seller	N	N	B0019CEOY6	ApolloShorts-M	Balboa Apollo Movie Boxing American Flag Shorts for Men's & Women's	1	CR-QUALITY_UNACCEPTABLE	Y	C-Returns	StandardRefund	 	 	23.87	1	 	 	 	 	 	 
111-2613318-6133023	22-Sep-2024	26-Sep-2024	Approved	Dfk6qkGwRRMA	 	AmazonPrePaidLabel	4.38	USD	USPS	9302010949890090475737	Customer	N	N	B0DBRP7DGZ	WB1157-HQLilMonster-Shirt-S	COCO BRANDS Suicide Squad Harley Quinn Daddy Little Monster Halloween Costume Cosplay for Women White Raglan T-Shirt	1	CR-UNWANTED_ITEM	Y	C-Returns	StandardRefund	 	 	29.95	1	 	 	 	 	 	 
113-3826907-2369061	11-Sep-2024	25-Sep-2024	Approved	D2mWqFGMRRMA	 	AmazonPrePaidLabel	6.06	USD	UPS	1ZF2C2469065811830	Seller	N	N	B0CKGPG1D7	Ghost-LS-Shirt-Patches-4XL	Mad Engine Ghostbusters Costume T-Shirt with Four Interchangeable Name Patches Halloween Cosplay	1	AMZ-PG-APP-TOO-SMALL	Y	C-Returns	StandardRefund	 	 	49.96	2	 	 	 	 	 	25.58
114-0111577-2842643	18-Sep-2024	25-Sep-2024	Approved	DLm3qKGNRRMA	 	AmazonPrePaidLabel	5.62	USD	USPS	9302010949890090464847	Seller	N	N	B01JSFN2Y8	suicidesquad004-S	DC Comics Suicide Squad Harley Quinn Shorts Panties Costume for Women Halloween Cosplay Red/Blue	1	AMZ-PG-APP-STYLE	Y	C-Returns	RefundAtFirstScan	 	 	29.44	1	ORDER_IN_RE_SELLABLE_CONDITION	81606-95438-9753640	NOGRANT	03-Oct-2024	 	29.44
113-6701372-0085858	20-Sep-2024	25-Sep-2024	Approved	D4mDqWGNRRMA	 	AmazonPrePaidLabel	4.38	USD	USPS	9302010949890090461143	Seller	N	N	B07ZL27R79	TSM20002TV-WoodyBelt-L	Toy Story Woody and Jessie Halloween Cosplay Costume Belt (Large - 38" - 42") Brown	1	AMZ-PG-APP-TOO-SMALL	Y	C-Returns	RefundAtFirstScan	 	 	27.04	1	ORDER_IN_RE_SELLABLE_CONDITION	74973-66495-6110634	NOGRANT	03-Oct-2024	 	27.04
111-8443623-7396222	24-Sep-2024	25-Sep-2024	Approved	DqmDqLGNRRMA	 	AmazonPrePaidLabel	5.15	USD	USPS	9302010949890090464588	Seller	N	N	B002X5UZMS	JackDaniels001-MensShirt-XL	Jack Daniel's Whiskey Old No. 7 Tenessee Label Adult Black T-Shirt (X-Large)	1	CR-UNWANTED_ITEM	Y	C-Returns	StandardRefund	 	 	26.33	1	 	 	 	 	 	 
111-9597492-4469066	16-Sep-2024	25-Sep-2024	Approved	DYm2qTGNRRMA	 	AmazonPrePaidLabel	4.68	USD	USPS	9302010949890090446058	Seller	N	N	B00YQ4SCEW	aerosmith002-S	Impact Aerosmith Aero Force Men's White Short Sleeve Tee Small	1	AMZ-PG-APP-TOO-SMALL	Y	C-Returns	StandardRefund	 	 	27.51	1	 	 	 	 	 	 
112-9894604-8742612	20-Sep-2024	25-Sep-2024	Approved	DrjzqgG5RRMA	 	AmazonPrePaidLabel	5.00	USD	USPS	9302010949890090463642	Seller	N	N	B01JSFN2Y8	suicidesquad004-S	DC Comics Suicide Squad Harley Quinn Shorts Panties Costume for Women Halloween Cosplay Red/Blue	1	CR-ORDERED_WRONG_ITEM	Y	C-Returns	RefundAtFirstScan	 	 	29.71	1	ORDER_IN_RE_SELLABLE_CONDITION	28132-47848-0294402	NOGRANT	09-Oct-2024	 	29.71
112-6402183-6489002	03-Sep-2024	25-Sep-2024	Approved	Dkj2qzGXRRMA	 	AmazonPrePaidLabel	6.06	USD	UPS	1ZF2C2469065786172	Seller	N	N	B07HB545TM	ImperialOfficerCap-ECSW2060TV-Black	Star Wars Imperial Officer Metal Aplique Twil Cap (Charcoal)	2	CR-UNWANTED_ITEM	Y	C-Returns	StandardRefund	 	 	51.16	3	 	 	 	 	 	 
112-6402183-6489002	03-Sep-2024	25-Sep-2024	Approved	Dkj2qzGXRRMA	 	AmazonPrePaidLabel	6.06	USD	UPS	1ZF2C2469065786172	Seller	N	N	B07GBJQ76X	ImperialOfficerCap-ECSW2060TV-Olive	Star Wars Imperial Officer Metal Aplique Twil Cap (Olive)	1	CR-UNWANTED_ITEM	Y	C-Returns	StandardRefund	 	 	51.16	3	 	 	 	 	 	 
113-8718977-9826625	17-Sep-2024	25-Sep-2024	Approved	Dpj8qlGCRRMA	 	AmazonPrePaidLabel	6.40	USD	USPS	9302010949890090464496	Seller	N	N	B07DRR27SM	incredibles004-3XL	The Incredibles Basicon Red Long Sleeve T-Shirt and Mask Costume Set (Adult 3X-Large)	1	AMZ-PG-APP-TOO-LARGE	Y	C-Returns	StandardRefund	 	 	23.54	1	 	 	 	 	 	 
113-4794476-7815435	19-Sep-2024	25-Sep-2024	Approved	DLjrqZGpRRMA	 	AmazonPrePaidLabel	6.48	USD	UPS	1ZF2C2469065803572	Seller	N	N	B0BGQCPZC5	220939-BeerfestTracksuit-L	Costume Agent Beer Fest USA Blue and Red Tracksuit Jacket and Pants Halloween Costume Cosplay, Blue	1	CR-MISSED_ESTIMATED_DELIVERY	Y	C-Returns	StandardRefund	 	 	75.72	1	 	 	 	 	 	 
113-4957613-7446611	09-Sep-2024	25-Sep-2024	Approved	DLjmqTGpRRMA	 	AmazonPrePaidLabel	6.06	USD	UPS	1ZF2C2469065803563	Seller	N	N	B0CF2RS159	HRWD01UGJ-PurpleBlazerJacket-3XL	Mad Engine Wednesday Addams Purple Blazer Jacket School Crest Halloween Costume Cosplay	1	AMZ-PG-APP-TOO-SMALL	Y	C-Returns	RefundAtFirstScan	 	 	22.01	1	ORDER_IN_RE_SELLABLE_CONDITION	93481-29556-9424850	NOGRANT	09-Oct-2024	 	22.01
113-1245417-6864238	18-Sep-2024	25-Sep-2024	Approved	DfjyqxGPRRMA	 	AmazonPrePaidLabel	4.47	USD	USPS	9302010949890090455548	Seller	N	N	B0019CEOXC	ApolloShorts-L	Balboa Apollo Movie Boxing American Flag Shorts for Men's & Women's Multicolor	1	CR-ORDERED_WRONG_ITEM	Y	C-Returns	RefundAtFirstScan	 	 	21.35	1	ORDER_IN_RE_SELLABLE_CONDITION	10562-10193-7981049	NOGRANT	09-Oct-2024	 	21.35
111-0111099-4911407	18-Sep-2024	25-Sep-2024	Approved	DLj4qVGJRRMA	 	AmazonPrePaidLabel	6.06	USD	UPS	1ZF2C2469065792521	Seller	N	N	B0CS87WHHG	DRSE0D8M-Thing1-Shirt-L	Dr Seuss Thing 1 and Thing 2 Adult Short Sleeves Red T-Shirt Tee	1	CR-ORDERED_WRONG_ITEM	Y	C-Returns	StandardRefund	 	 	77.67	3	 	 	 	 	 	26.29
112-2269990-2109803	20-Sep-2024	25-Sep-2024	Approved	D8jbqPGJRRMA	 	AmazonPrePaidLabel	7.43	USD	UPS	1ZF2C2469065791246	Seller	N	N	B0CHN2T7M2	GBXX1DY-GhostbustersDress-2XL	Mad Engine Ghostbusters Dress with 4 Interchangeable Name Patches Halloween Costume Cosplay	1	AMZ-PG-APP-TOO-SMALL	Y	C-Returns	StandardRefund	 	 	49.22	1	 	 	 	 	 	 
113-5226540-8204229	01-Sep-2024	25-Sep-2024	Approved	DBjdqPGMRRMA	 	AmazonPrePaidLabel	4.36	USD	USPS	9302010949890090435182	Seller	N	N	B00U5JRR8E	bobsburgersbeanie001	Bob's Burgers Louise Beanie Pink	1	AMZ-PG-APP-TOO-SMALL	Y	C-Returns	StandardRefund	 	 	24.93	1	 	 	 	 	 	 
113-2629437-8183467	01-Sep-2024	25-Sep-2024	Approved	DvjRqdGLRRMA	 	AmazonPrePaidLabel	6.84	USD	UPS	1ZF2C2469065789848	Seller	N	N	B08KRXBPZH	220785-DumbDumber-ORNG-XL	Costume Agent Dumb and Dumber Tuxedo Halloween Costume Cosplay - Movie Costumes - 70s Tuxedo - Orange - X-Large - Dumb & Dumber Tuxedo - Women & Men’s Costume	1	AMZ-PG-APP-TOO-SMALL	Y	C-Returns	StandardRefund	 	 	151.36	1	 	 	 	 	 	151.36
113-3360628-5447417	30-Aug-2024	25-Sep-2024	Approved	DvjYqDGvRRMA	 	AmazonPrePaidLabel	4.19	USD	USPS	9302010949890090451328	Seller	N	N	B07HJDXYCZ	tmnt020-don-juniors-M	Teenage Mutant Ninja Turtles TMNT Costume Juniors T-Shirt	1	AMZ-PG-APP-TOO-SMALL	Y	C-Returns	RefundAtFirstScan	 	 	25.69	1	ORDER_IN_RE_SELLABLE_CONDITION	42946-76069-5948925	NOGRANT	18-Oct-2024	 	25.69
113-1897828-2253026	22-Sep-2024	25-Sep-2024	Approved	DpjRqmGvRRMA	 	AmazonPrePaidLabel	5.07	USD	USPS	9302010949890090455890	Seller	N	N	B07HGH7XY9	BelAirJersey-Smith-M	Bel Air Basketball Jersey Smith Gold/Yellow #14 (Adult Medium)	1	AMZ-PG-APP-STYLE	Y	C-Returns	RefundAtFirstScan	 	 	17.95	1	ORDER_IN_RE_SELLABLE_CONDITION	13983-59093-2394231	NOGRANT	02-Oct-2024	 	17.95
111-7286205-2921849	20-Sep-2024	25-Sep-2024	Approved	DLj9qFGFRRMA	 	AmazonPrePaidLabel	6.06	USD	UPS	1ZF2C2469065784325	Seller	N	N	B07D93CM7W	powerrangers015green-XXL	Power Rangers The Long Sleeve Ranger Costume Green T-shirt (Adult XX-Large)	1	AMZ-PG-BAD-DESC	Y	C-Returns	StandardRefund	 	 	56.45	2	 	 	 	 	 	28.95
112-4719960-2493040	22-Sep-2024	25-Sep-2024	Approved	DQjvq8GFRRMA	 	AmazonPrePaidLabel	5.62	USD	USPS	9302010949890090439586	Seller	N	N	B0CG9XB6C9	220832-OrangeDogCostume-5-6	Playful Colorful Dog Halloween Costume Cosplay Zip Up Suit with Hood for Boys and Girls	1	CR-DEFECTIVE	Y	C-Returns	RefundAtFirstScan	 	 	38.45	1	 	 	 	 	 	38.45
113-1366299-0704242	25-Aug-2024	25-Sep-2024	Approved	DFj5qYGFRRMA	 	AmazonPrePaidLabel	6.84	USD	UPS	1ZF2C2469065784496	Seller	N	N	B0CHBQPV7D	103034-DeirdreCostume-3XL	Costume Agent Everything All Once Deirdre Complete Halloween Costume Cosplay	1	CR-DAMAGED_BY_FC	Y	C-Returns	StandardRefund	 	 	72.04	2	 	 	 	 	 	28.72
113-1366299-0704242	25-Aug-2024	25-Sep-2024	Approved	DFj5qYGFRRMA	 	AmazonPrePaidLabel	6.84	USD	UPS	1ZF2C2469065784496	Seller	N	N	B0CGVZWPZ3	103035-EvelynCostume-XL	Costume Agent Everything All Once Evelyn Shirt and Vest Set Halloween Costume Cosplay	1	AMZ-PG-APP-TOO-SMALL	Y	C-Returns	StandardRefund	 	 	72.04	2	 	 	 	 	 	28.72
111-7286205-2921849	20-Sep-2024	25-Sep-2024	Approved	Dfj5qCGYRRMA	 	AmazonPrePaidLabel	6.06	USD	UPS	1ZF2C2469065784432	Seller	N	N	B00CTSCHOS	powerrangers015pink-XXL	Power Rangers The Long Sleeve Ranger Costume Pink T-Shirt (Adult XX-Large)	1	AMZ-PG-APP-TOO-SMALL	Y	C-Returns	StandardRefund	 	 	56.45	2	 	 	 	 	 	28.95
112-8002495-4721828	24-Aug-2024	25-Sep-2024	Approved	DZ18qZGZRRMA	 	AmazonPrePaidLabel	4.68	USD	USPS	9302010949890090426463	Seller	N	N	B014LRDJQE	incredhulk013-S	Marvel Incredible Hulk Sublimated Long Sleeve Costume T-Shirt (Adult Small) Multi	1	AMZ-PG-APP-TOO-LARGE	Y	C-Returns	StandardRefund	 	 	29.98	1	 	 	 	 	 	 
113-7673679-3667445	18-Sep-2024	25-Sep-2024	Approved	Ds1qqMGqRRMA	 	AmazonPrePaidLabel	6.66	USD	USPS	9302010949890090434659	Seller	N	N	B07YQBQWKC	220745-AhoySailorCostume-WOMENS-S/M	Costume Agent Adult Womens Robin Ahoy Sailor Halloween Costume Cosplay Set (Small/Medium)	1	AMZ-PG-APP-TOO-SMALL	Y	C-Returns	RefundAtFirstScan	 	 	27.96	1	INVALID_SELLER_REFUND_OR_DEBIT	17811-29973-9142547	GRANT	15-Oct-2024	6.66	27.96
111-1333247-5397825	20-Sep-2024	25-Sep-2024	Approved	DY1Dq1G5RRMA	 	AmazonPrePaidLabel	4.38	USD	USPS	9302010949890090449745	Seller	N	N	B07XMFLZPB	IndianChiefBeltBuckle	Costume Agent Native American Indian Chief Head Metal Belt Buckle Replica Multicoloured	1	CR-SWITCHEROO	Y	C-Returns	Replacement	 	 	20.09	1	 	 	 	 	 	 
114-8427137-7787402	16-Sep-2024	25-Sep-2024	Approved	Dx1BqgG8RRMA	 	AmazonPrePaidLabel	4.68	USD	USPS	9302010949890090450130	Seller	N	N	B09JLB2BXK	QF009BBSTV-BlueyPajamas-4	American Marketing Ent Bluey Ready for Adventure Boys Halloween Costume Pajamas Cosplay (4) Blue	1	CR-MISSED_ESTIMATED_DELIVERY	Y	C-Returns	StandardRefund	 	 	30.61	1	 	 	 	 	 	30.61
114-5614359-5441045	24-Sep-2024	25-Sep-2024	Approved	Dv1GqbGTRRMA	 	AmazonPrePaidLabel	4.02	USD	USPS	9302010949890090419557	Seller	N	N	B00FZ3LRSG	powerrangers018black-12/18	Power Rangers Black Baby Ranger Costume Romper Onesie (12-18 Months)	1	AMZ-PG-APP-STYLE	Y	C-Returns	RefundAtFirstScan	 	 	21.95	1	ORDER_IN_RE_SELLABLE_CONDITION	69777-91281-1109155	NOGRANT	02-Oct-2024	 	21.95
114-0559218-2289855	17-Sep-2024	25-Sep-2024	Approved	D51cqyGJRRMA	 	AmazonPrePaidLabel	5.62	USD	USPS	9302010949890090442531	Customer	N	N	B0CL5F44Y7	100950-CowboyChaps-4-6	Jessie Cowboy Cowgirl Chaps Halloween & Cosplay Costume Accessory for Kids Children - White (4/6)	1	CR-ORDERED_WRONG_ITEM	Y	C-Returns	RefundAtFirstScan	 	 	21.44	1	 	 	 	 	 	16.19
