Order ID,Return request date,ASIN,Merchant SKU,Item Name,Return quantity,Return Reason
113-3417753-1903422,01/09/25,B0BC2C8BWK,220936-LegLampSkirt-L-XL,Costume Agent Xmas Movie Women's Christmas Leg Lamp Skirt Halloween Cosplay,1,CR-UNWANTED_ITEM
111-4410748-3125850,01/09/25,B0778WC7JV,MooseMug001-1Pack,Costume Agent Christmas Vacation Glass Moose Mug (1-Pack),1,CR-DAMAGED_BY_FC
112-2024727-0835404,01/09/25,B0DJ18ZW74,MF24US207-SantaGrinchSuit-XS,Grinch with Santa Hat Face All Over Pajamas Jumpsuit - Christmas Union Suit with Hood and Pockets for Men and Women (X-Small) Multicolor,1,AMZ-PG-APP-TOO-LARGE
113-6881222-0802636,01/09/25,B07HB545TM,ImperialOfficerCap-ECSW2060TV-Black,Star Wars Imperial Officer Metal Aplique Twil Cap (Charcoal),1,AMZ-PG-APP-STYLE
112-9417397-3256267,01/09/25,B07JVNH4WD,CY034-ChristmasStoryUnionSuit-3XL,Briefly Stated A Christmas Story Bunny Union Suit Pajama Costume (Adult 3X-Large),1,CR-UNWANTED_ITEM
114-3202454-5881863,01/09/25,B09HCRQ578,220823-PinkBunny-KIDS-12-18m,Kids/Youth/Toddler Christmas Pink Bunny Jumpsuit Halloween Christmas Costume,1,CR-MISSED_ESTIMATED_DELIVERY
114-3202454-5881863,01/09/25,B09HCSF7LB,220823-PinkBunny-KIDS-2T,Kids/Youth/Toddler Christmas Pink Bunny Jumpsuit Halloween Christmas Costume,1,CR-MISSED_ESTIMATED_DELIVERY
114-4276747-6585016,01/09/25,B0BKR3QNXD,PABR028MNP-PBRBeerPants-M,Mad Engine-Pabst Blue Ribbon Beer Distressed Logo Lounge Pants,1,CR-UNWANTED_ITEM
111-4615760-0735448,01/09/25,B0D9QTRQ7B,VSPS1-RTSNOW-PantSKIN-M,"Insulated Jacket & Pants Skin Set Water and Wind Resistant, with Interchangeable Skins, for Skiing and Hunting",1,DID_NOT_LIKE_FABRIC
111-0364706-4019415,01/09/25,B07L1DBY3T,GrinchUnionSuit-Adult-XL,MJC Grinch Family Faces Christmas Green and White Pajama Union Suit,1,CR-MISSED_ESTIMATED_DELIVERY
114-0937305-1989030,01/09/25,B00CP8M5CQ,mm001Nyel-S,M&M's Candy Silly Character Face T-Shirt Yellow,1,AMZ-PG-APP-TOO-SMALL
113-9869851-3265055,01/09/25,B00U0HWUGA,GDSM2659TV-GratefullDeadBear-M,Grateful Dead Bears with Steal Your Face Ornaments Christmas Sweater (Adult Medium),1,DID_NOT_LIKE_FABRIC
111-0264261-1482647,01/09/25,B0BHMCM95Z,PABR029-PabstSweater-M,Mad Engine Pabst Fair Isle Beer Adult Unisex Holiday Ugly Christmas Sweater Multicolored,1,AMZ-PG-APP-TOO-SMALL
112-5894951-9873852,01/09/25,B0CLHFVWBG,DRS0011-GrinchSantaHatSwtr-L,Junk Food Grinch Head Santa Hat Wreath Snowflakes Ugly Christmas Sweater Green,1,CR-QUALITY_UNACCEPTABLE
113-5153683-5164221,01/08/25,B0DMGSGWHV,DSLX05Y5MN-StitchLoungePants-XL,Mad Engine Stitch and Flowers Adult Unisex Christmas Lounge Pants Officially Licensed Sleepwear,1,DID_NOT_LIKE_COLOR
111-3253790-2779413,01/08/25,B0CBVXD44Y,uglysweater60N-XL,"Ripple Junction Seinfeld Festivus for The Rest of Us Pole Cream Ugly Christmas Sweater (as1, Alpha, x_l, Regular, Regular)",1,AMZ-PG-APP-TOO-SMALL
112-2528800-5126647,01/08/25,B076HFQHF7,CY034-ChristmasStoryUnionSuit-XL,Briefly Stated A Christmas Story Bunny Union Suit Pajama Costume (Adult X-Large),1,CR-UNWANTED_ITEM
112-2528800-5126647,01/08/25,B076HBCW5P,CY034-ChristmasStoryUnionSuit-S,Briefly Stated A Christmas Story Bunny Union Suit Pajama Costume (Adult Small),1,AMZ-PG-APP-STYLE
114-0142613-5036266,01/08/25,B0CKBZWC65,CCX21-CokeHeartSweater-L,Mad Engine- Coca Cola Heart Polar Bear Drinking Women's Ugly Christmas Sweater Multicolor,1,AMZ-PG-APP-TOO-LARGE
113-9811959-5385049,01/08/25,B00FI3OOF6,bigl032-XL,Costume Agent Lebowski Jeffrey The Dude Zip Up Costume Cardigan Sweater Halloween Cosplay Tan,1,CR-DEFECTIVE
114-4760751-2617066,01/08/25,B076HFSX43,CY034-ChristmasStoryUnionSuit-L,Briefly Stated A Christmas Story Bunny Union Suit Pajama Costume (Adult Large),1,CR-MISSED_ESTIMATED_DELIVERY
112-1584045-2009025,01/08/25,B07NSDBN21,ILoveXmasUCS-XL,Costume Agent I Love Xmas HOHOHO Light Up (LED) and Bells Ugly Christmas Sweater - White (X-Large),1,CR-MISSED_ESTIMATED_DELIVERY
112-1584045-2009025,01/08/25,B07KQLP8YY,ILoveXmasUCS-XS,Costume Agent I Love Xmas HOHOHO Light Up (LED) and Bells Ugly Christmas Sweater - White (X-Small),1,CR-MISSED_ESTIMATED_DELIVERY
111-9648356-3598647,01/08/25,B0CBVVZVXQ,uglysweater60N-M,"Ripple Junction Seinfeld Festivus for The Rest of Us Pole Cream Ugly Christmas Sweater (as1, Alpha, m, Regular, Regular)",1,CR-MISSED_ESTIMATED_DELIVERY
113-2870463-0105061,01/08/25,B01N9CHRRS,uglywutang-2X,"Costume Agent Wu-Tang Clan Logo Ugly Christmas Sweater - XX-Large, Black - Ugly Christmas Sweater Unisex - Funny Ugly Christmas Sweater",1,CR-UNWANTED_ITEM
112-8240279-6733812,01/08/25,B0BK1XJDG4,267345-GrinchPJPants-3XL,MJC Grinch All Over Santa Hat Christmas Pajamas Lounge Pants,1,CR-UNWANTED_ITEM
113-9821235-1552262,01/08/25,B0DJRSXZ7F,103090-BlueDetectiveNotebook,Dog Detective and Blue Handy Notebook Halloween Costume Cosplay Accessory with Dog Paws Stickers and Black Crayon,1,CR-DEFECTIVE
112-0800843-7481006,01/08/25,B015JT8NQY,uglysweater44-XL,"National Lampoon Shitter's Full Ugly Christmas Sweater Red, White - X-Large - Sweater Apparel - Funny Christmas Sweater",1,CR-MISSED_ESTIMATED_DELIVERY
111-6632270-3194628,01/08/25,B004TNCJVM,hangover014-XXXL,Hangover The Alan Baby Bjorn with Graphic Human Tree Dark Khaki Adult Costume T-Shirt Tee (XXX-Large),1,DID_NOT_LIKE_FABRIC
112-4272528-5106603,01/08/25,B0B8K2JV5T,220898-EllenGirswold-M,Costume Agent Adult Vacation Movie Ellen Griswold Character Top Skirt Halloween,1,CR-UNWANTED_ITEM
112-2574785-8777003,01/08/25,B076HG5JMT,NL029-ChristmasVacationPajamaSet-L,"Briefly Stated National Lampoon's Dinosaur Christmas Vacation Pajamas Set | Perfect for Ugly Sweater Parties, Matching Xmas Pajamas for Family",1,AMZ-PG-APP-TOO-SMALL
112-3967831-9821019,01/08/25,B00U0HHBI2,CVSM2258-MooseHead-M,"Ripple Junction National Lampoon's Christmas Vacation Fun Old Fashioned Xmas Knitted Ugly Christmas Sweater Black, Red",1,DID_NOT_LIKE_FABRIC
111-6153568-7260252,01/08/25,B0DHYKS7HX,UF24US249-GrinchSherpaSuit-3XL,The Grinch Sherpa Union Suit with Head Zipper Adult Halloween Costume Cosplay for Men and Women (3X-Large),1,AMZ-PG-APP-TOO-SMALL
111-5226602-5352264,01/08/25,B00CFBWJEW,sbb015-XL,Saved By The Bell Kelly Kapowski Bayside Off The Shoulder Gray Juniors/Ladies Sweatshirt,1,CR-UNWANTED_ITEM
111-5226602-5352264,01/08/25,B003CTJERQ,sbb016-M,Saved By The Bell Bayside Tigers Logo Heather Gray Men's Tank Top,1,CR-UNWANTED_ITEM
111-5226602-5352264,01/08/25,B002STMH70,acwig,Saved by the Bell AC Slater Costume Wig,1,CR-UNWANTED_ITEM
111-5226602-5352264,01/08/25,B00CF8PFRI,sbb015-L,Saved By The Bell Kelly Kapowski Bayside Off The Shoulder Gray Juniors/Ladies Sweatshirt,1,CR-UNWANTED_ITEM
114-5966915-9648261,01/08/25,B00CP8M6A2,mm001Nyel-XXL,M&M M&M's Candy Yellow Silly Character Face Adult T-Shirt (Adult XX-Large),1,AMZ-PG-APP-TOO-LARGE
111-9657070-6957004,01/08/25,B0D9R68PR9,NDSS0HCMLOF-NickTeamUpHoodie-S,Mad Engine Spongebob Squarepants Patrick Mr. Krabs Pool Tie Dye Mens Hoodie Multicolor,1,AMZ-PG-APP-TOO-LARGE
111-4397537-8975454,01/08/25,B0DHYMFF8F,UF24US249-GrinchSherpaSuit-M,The Grinch Sherpa Union Suit with Head Zipper Adult Halloween Costume Cosplay for Men and Women (Medium),1,AMZ-PG-APP-TOO-LARGE
111-4397537-8975454,01/08/25,B0DHYMS7RT,UF24US249-GrinchSherpaSuit-2XL,The Grinch Sherpa Union Suit with Head Zipper Adult Halloween Costume Cosplay for Men and Women (XX-Large),1,AMZ-PG-APP-TOO-LARGE
111-5564240-5133811,01/08/25,B09H9QSFLV,220821-ShitterFullOnesie-L,Costume Agent Christmas Moose Mug Griswold Car Shitters Full Pajama Jumpsuit,1,AMZ-PG-APP-TOO-SMALL
111-3324114-6892252,01/08/25,B0CKTS68PZ,103068-GreenMonsterCrown-OS,Costume Agent Green Monster Christmas Crown with Ornaments Halloween Costume Cosplay,1,CR-ORDERED_WRONG_ITEM
111-3324114-6892252,01/08/25,B07NSDZZ6V,ILoveXmasUCS-L,Costume Agent I Love Xmas HOHOHO Light Up (LED) and Bells Ugly Christmas Sweater - White (Large),1,CR-DEFECTIVE
114-3207262-7757803,01/08/25,B07HKSCRQJ,CVGriswoldLoungePants-WR0319-52-M,National Lampoon's Griswold Family Christmas Vacation Fair isle Lounge Pants (Adult Medium),1,CR-MISSED_ESTIMATED_DELIVERY
111-5528034-4680240,01/08/25,B08L85YL9V,GrinchUnionSuit-Children-14/16,MJC Grinch Family Faces Christmas Green and White Kids Pajama Union Suit (14/16),1,CR-DEFECTIVE
114-3207262-7757803,01/08/25,B07JQJRJTS,FilthyAnimalLoungePants-XF003-M,Briefly Stated Merry Christmas Ya Filthy Animal Christmas Pajama Pants For Men and Women,1,CR-MISSED_ESTIMATED_DELIVERY
113-2827266-9942665,01/08/25,B09CV7JLH9,204292-DeerRingSweater-XL,Costume Agent Reindeer Ring Toss 3D Ugly Christmas Sweater Multicolored,1,CR-MISSED_ESTIMATED_DELIVERY
111-5450297-3749009,01/08/25,B0DJ1B32FH,MF24US207-SantaGrinchSuit-M,Grinch with Santa Hat Face All Over Pajamas Jumpsuit - Christmas Union Suit with Hood and Pockets for Men and Women (Medium) Multicolor,1,AMZ-PG-APP-TOO-LARGE
114-5777048-4685036,01/08/25,B0DJ19P2BF,MF24US207-SantaGrinchSuit-S,Grinch with Santa Hat Face All Over Pajamas Jumpsuit - Christmas Union Suit with Hood and Pockets for Men and Women (Small) Multicolor,1,CR-FOUND_BETTER_PRICE
114-5777048-4685036,01/08/25,B0DJ18B6YZ,MF24US207-SantaGrinchSuit-XL,Grinch with Santa Hat Face All Over Pajamas Jumpsuit - Christmas Union Suit with Hood and Pockets for Men and Women (X-Large) Multicolor,1,CR-FOUND_BETTER_PRICE
111-1177829-1064252,01/08/25,B09H9S9KDC,220821-ShitterFullOnesie-2XL,Costume Agent Christmas Moose Mug Griswold Car Shitters Full Pajama Jumpsuit,1,AMZ-PG-APP-TOO-SMALL
113-5587755-0045023,01/08/25,B0BGVMPWHQ,220930-CaddyShackHat,Costume Agent CaddyShack Golfing Colorful Judge Smails Halloween Costume Fedora Hat,1,CR-SWITCHEROO
112-6393290-1584227,01/08/25,B01LBRL97I,100576BROWN-S,Costume Agent Pirate Boots Adventure Footwear Halloween Costume Cosplay Accessory - Brown - Small - Pirate Carribean Pirate Boot Men - Men's Tall Boots - Mens Cosplay Boots,1,AMZ-PG-APP-TOO-SMALL
114-9724481-2145049,01/08/25,B09HLCWZDX,100581-CousinEddieShoe-10,Costume Agent Cousin Eddie Christmas White Shoes Halloween Footwear (Numeric_10),1,AMZ-PG-APP-TOO-SMALL
111-3509890-3109859,01/08/25,B002SBIA6A,roddypiper001-XL,"Rowdy Roddy Piper Hot Rod Wrestling White Adult T-shirt Tee, XL",2,CR-UNWANTED_ITEM
111-1765768-9993831,01/08/25,B0778V3FCR,MooseMug001-2Pack,Costume Agent Christmas Vacation Glass Moose Mug (2 Pack),1,CR-ORDERED_WRONG_ITEM
114-4366356-3001860,01/08/25,B0BLZPKB79,KrampusLawnInflatable,Costume Agent Inflatable Indoor/Outdoor Xmas Decoration Krampus Santa Clause Lawn,1,CR-DEFECTIVE
112-8559195-3866643,01/08/25,B0BK1T18VY,267345-GrinchPJPants-S,MJC Adult Unisex Grinch Smiling All Over Santa Hat Ugly Christmas Pajama Lounge Pants,1,AMZ-PG-APP-TOO-LARGE
112-2052236-3210641,01/08/25,B0BGMHZZBM,103012-MooseMug-4pack,Costume Agent Vacation Movie Moose Mug Acrylic Christmas Clear Eggnog (4 Pack),3,AMZ-PG-BAD-DESC
113-7674096-0584263,01/08/25,B0BHM7R45Y,PABR029-PabstSweater-L,Mad Engine Pabst Fair Isle Beer Adult Unisex Holiday Ugly Christmas Sweater Multicolored,1,AMZ-PG-APP-TOO-SMALL
114-6920068-3384229,01/08/25,B087JKXTK9,SVMC0023-BabyYodaNeckGaiter,"Concept One Star Wars The Mandalorian The Child Baby Yoda Polyester Neck Gaiter, Black, One Size",1,DID_NOT_LIKE_FABRIC
113-1367823-7780260,01/08/25,B07L1C4237,GrinchUnionSuit-Adult-S,MJC Grinch Family Faces Christmas Green and White Pajama Union Suit,1,AMZ-PG-APP-TOO-LARGE
114-2292247-6155451,01/08/25,B0BGMJGPXX,103012-MooseMug-1pack,Costume Agent Vacation Movie Moose Mug Acrylic Christmas Clear Eggnog Mug (1 Pack),1,CR-UNWANTED_ITEM
111-5540578-3630642,01/08/25,B00D4BDEIC,gijoe006-S,G.I. Joe Yo Joe! Logo Adult Navy T-Shirt (Adult Small),1,AMZ-PG-APP-TOO-SMALL
114-3685052-7599423,01/08/25,B09LRK71JK,GDSA2851TV-GratDeadPants-S,Ripple Junction Grateful Dead Steal Your Face Adult Sleep Lounge Pants,1,CR-UNWANTED_ITEM
113-1999428-5050611,01/08/25,B0BC2F5KX8,220936-LegLampSkirt-S-M,Costume Agent Xmas Movie Women's Christmas Leg Lamp Skirt Halloween Cosplay,1,DID_NOT_LIKE_FABRIC
114-7396389-6833003,01/08/25,B0DJ1B32FH,MF24US207-SantaGrinchSuit-M,Grinch with Santa Hat Face All Over Pajamas Jumpsuit - Christmas Union Suit with Hood and Pockets for Men and Women (Medium) Multicolor,1,CR-UNWANTED_ITEM
111-2785717-5507441,01/08/25,B076HG5JMT,NL029-ChristmasVacationPajamaSet-L,"Briefly Stated National Lampoon's Dinosaur Christmas Vacation Pajamas Set | Perfect for Ugly Sweater Parties, Matching Xmas Pajamas for Family",1,CR-UNWANTED_ITEM
112-8028698-9059447,01/08/25,B001K3C09U,napoleondynamite003,Rubies Napoleon Dynamite Costume Moon Boots One Size,1,AMZ-PG-APP-STYLE
114-9184569-2351411,01/08/25,B0CLHFVWBG,DRS0011-GrinchSantaHatSwtr-L,Junk Food Grinch Head Santa Hat Wreath Snowflakes Ugly Christmas Sweater Green,1,DID_NOT_LIKE_FABRIC
113-0205224-4433005,01/08/25,B0DJ3MJNDG,leagueoftheirowncostume-XL/2XL,Rockford Peaches Movie AAGPBL Baseball Dress Halloween Costume Cosplay,1,CR-UNWANTED_ITEM
113-0205224-4433005,01/08/25,B005MYCCJ6,leagueoftheirowncostume-L,Rockford Peaches Movie AAGPBL Baseball Dress Halloween Costume Cosplay,1,AMZ-PG-APP-STYLE
111-2855499-1521045,01/08/25,B0BBXW2ZCT,220929-LucyDressAdult-L,Costume Agent Lucy Comic Strip Good Grief Adult Halloween Costume Cosplay Blue Dress,1,CR-FOUND_BETTER_PRICE
112-0831347-3244217,01/08/25,B06XXMP1H9,YellowHulkGlasses,Hulk Hogan Retro Costume Sunglasses-Yellow,1,CR-UNWANTED_ITEM
111-9055035-7712203,01/08/25,B0CJYZS6TF,221015-ChaseAttic-OS,Costume Agent Vacation Christmas Movie Clark Attic Complete Outfit Set Halloween Costume Cosplay,1,CR-UNWANTED_ITEM
112-5406267-4537856,01/08/25,B0DJ1BX8CR,MF24US207-SantaGrinchSuit-L,Grinch with Santa Hat Face All Over Pajamas Jumpsuit - Christmas Union Suit with Hood and Pockets for Men and Women (Large) Multicolor,1,AMZ-PG-APP-TOO-SMALL
112-4913848-9280241,01/08/25,B07JVNH4WD,CY034-ChristmasStoryUnionSuit-3XL,Briefly Stated A Christmas Story Bunny Union Suit Pajama Costume (Adult 3X-Large),1,CR-MISSED_ESTIMATED_DELIVERY
111-7065545-6844258,01/08/25,B0CLSD18PB,17NL066-XmasVacationPants-L,"National Lampoon's Christmas Vacation Plaid Sleep Pants, Red, Large (36-38)",1,CR-UNWANTED_ITEM
111-0426352-0825802,01/08/25,B07D5G3R42,snlbearsVESTsweater-M,SNL Da Bears Chicago Adult Vest Sweater Navy,1,CR-UNWANTED_ITEM
113-6239921-6633033,01/08/25,B0CGRVRGMS,220985-RicFlairRobe-Red-OS,Costume Agent Nature Boy Flair Wrestler Deluxe Robe Halloween Costume Cosplay,1,CR-SWITCHEROO
112-9615769-9492251,01/08/25,B00U0HYE5K,XmasStoryRalphieUCS-CSSM2356-XXL,Ripple Junction A Christmas Story Ohhhh Fuuudge! Ralphie Ugly Christmas Sweater - XX-Large - Funny Holiday Sweater,1,AMZ-PG-APP-TOO-LARGE
112-7693584-1534659,01/08/25,B01LBRLDX8,100576BROWN-XL,Costume Agent Pirate Boots Adventure Footwear Halloween Costume Cosplay Accessory - Brown - X-Large - Pirate Carribean Pirate Boot Men - Men's Tall Boots - Mens Cosplay Boots,1,AMZ-PG-APP-TOO-LARGE
113-4775600-0013053,01/08/25,B0BHMBDBWZ,StickyBanditsSweater-L,Merry Christmas Filthy Animal Kevin Festive Holiday Ugly Chritmas Sweater Multicolored,1,CR-UNWANTED_ITEM
112-0788979-6911459,01/08/25,B0CKBZ6JHS,CCX21-CokeHeartSweater-XL,Mad Engine Coca Cola Heart Polar Bear Drinking Womens Ugly Christmas Sweater Multicolor,1,CR-MISSED_ESTIMATED_DELIVERY
112-0835519-5321819,01/08/25,B0BGMJGPXX,103012-MooseMug-1pack,Costume Agent Vacation Movie Moose Mug Acrylic Christmas Clear Eggnog Mug (1 Pack),1,CR-MISSED_ESTIMATED_DELIVERY
113-1139215-3733802,01/07/25,B0B8FX7WMK,ChesterCheetosSuit-XL,"Cheetos Men's Chester Cheetah Fleece Costume Union Suit, Sun Orange/White, X-Large",1,CR-UNWANTED_ITEM
111-1153398-9589845,01/07/25,B0B69XFWP9,102027-InfOrnament-15-White,"Inflatable Oversized Ornaments Jumbo Christmas Balls 15"" 18"" 25"" or 30"" inches Holiday Decorations Indoor Outdoor",1,AMZ-PG-BAD-DESC
112-1852513-4125042,01/07/25,B0CDDG4D94,221003-CheerleaderMens-L,Cheerleader Halloween Costume for Mens and Womens Adult Unisex Varsity High School Cosplay,1,AMZ-PG-BAD-DESC
112-3551987-9593846,01/07/25,B0CDDNN483,221004-CheerleaderWomens-M,"Costume Agent Cheerleader Halloween Costume for Mens and Womens Adult Unisex Varsity High School Cosplay, Medium",1,AMZ-PG-BAD-DESC
111-3160254-5655442,01/07/25,B0CBVXD44Y,uglysweater60N-XL,"Ripple Junction Seinfeld Festivus for The Rest of Us Pole Cream Ugly Christmas Sweater (as1, Alpha, x_l, Regular, Regular)",1,CR-DEFECTIVE
111-8784462-8809839,01/07/25,B0778V3FCR,MooseMug001-2Pack,Costume Agent Christmas Vacation Glass Moose Mug (2 Pack),1,CR-UNWANTED_ITEM
114-3734618-3548224,01/07/25,B0DJ19CRLX,MF24US207-SantaGrinchSuit-3XL,Grinch with Santa Hat Face All Over Pajamas Jumpsuit - Christmas Union Suit with Hood and Pockets for Men and Women (3X-Large) Multicolor,1,CR-UNWANTED_ITEM
113-5814363-0803432,01/07/25,B07FXWHFQQ,DSTS26LGS-BuzzLightyearJuniotsTshirt-S,Disney Pixar Buzz Lightyear Costume Juniors T-Shirt (Small) White,1,AMZ-PG-APP-TOO-SMALL
114-8729126-6258601,01/07/25,B07FXMX1NW,DSTS26NGS-JessieJuniorsTshirt-S,Disney I am Jessie Toy Story Costume T-Shirt (Small),1,CR-MISSED_ESTIMATED_DELIVERY
113-1254406-2677825,01/07/25,B07HKPFVLD,CVGriswoldLoungePants-WR0319-52-XL,National Lampoon's Griswold Family Christmas Vacation Fair isle Lounge Pants (Adult X-Large),1,AMZ-PG-APP-TOO-LARGE
112-6850831-0058603,01/07/25,B018F4LQ46,flashpajama001-L,DC Comics The Flash Hooded One Piece Pajama (Adult Large),1,AMZ-PG-APP-TOO-LARGE
113-1702770-8977840,01/07/25,B07L454CKW,3DTRexUCS-L,Costume Agent 3D T-Rex Red and Green Adult Ugly Christmas Sweater (Large),1,AMZ-PG-APP-TOO-SMALL
114-6532838-5128202,01/07/25,B0BHMGT4YP,StickyBanditsSweater-M,Merry Christmas Filthy Animal Kevin Festive Holiday Ugly Chritmas Sweater Multicolored,1,AMZ-PG-APP-TOO-SMALL
113-3401671-7113814,01/07/25,B00U0HYONC,ElfSantaUCS-ELSM2301-M,Ripple Junction Elf Buddy Santa I Know Him Pattern Ugly Christmas Sweater - Medium - Ugly Christmas Sweater,1,AMZ-PG-APP-TOO-LARGE
113-3600186-7540220,01/07/25,B0DJ1BX8CR,MF24US207-SantaGrinchSuit-L,Grinch with Santa Hat Face All Over Pajamas Jumpsuit - Christmas Union Suit with Hood and Pockets for Men and Women (Large) Multicolor,1,CR-UNWANTED_ITEM
114-7800262-3659431,01/07/25,B01LBRLB2G,100576BLACK-L,Costume Agent Pirate Boots Adventure Footwear Halloween Costume Cosplay Accessory - Black - Large - Pirate Carribean Pirate Boot Men - Men's Tall Boots - Mens Cosplay Boots,1,AMZ-PG-APP-TOO-SMALL
111-4463565-8981819,01/07/25,B0DHYMS7RT,UF24US249-GrinchSherpaSuit-2XL,The Grinch Sherpa Union Suit with Head Zipper Adult Halloween Costume Cosplay for Men and Women (XX-Large),1,AMZ-PG-APP-TOO-LARGE
111-4592953-5973056,01/07/25,B0B9CC7R59,220888-ToddMargoShinySuit-L-XL,Costume Agent Todd & Margo Shiny Silver Workout Top and Pants Deluxe Sweatsuit Set for Halloween & Cosplay,1,AMZ-PG-APP-TOO-SMALL
112-9946167-0521052,01/07/25,B0CN9NYB8V,103031-KrampusSocks-OS,Costume Agent Krampus Holiday Cheer Festive Patterns Novelty Ugly Christmas Socks,1,CR-MISSED_ESTIMATED_DELIVERY
112-2579903-8513017,01/07/25,B07FDL126R,RetroWigHeadband-1191,Costume Agent Retro 80s Aerobics Instructor Deluxe Wig and Headband Costume Set,1,CR-UNWANTED_ITEM
114-6379153-0206669,01/07/25,B00Q7HHKIK,christmaslights001,Costume Agent Light-Up LED Ugly Christmas Sweater Ornaments Multi Color,1,DID_NOT_LIKE_COLOR
113-0635442-5379458,01/07/25,B076HG5JMT,NL029-ChristmasVacationPajamaSet-L,"Briefly Stated National Lampoon's Dinosaur Christmas Vacation Pajamas Set | Perfect for Ugly Sweater Parties, Matching Xmas Pajamas for Family",1,CR-UNWANTED_ITEM
113-1743543-4412228,01/07/25,B0CMDJPXPR,MZMC0T1-MinecraftPants-S,"Minecraft Video Game Pants Logo Block Big Letters Boys Navy Sweatpants (US, Alpha, Small, Regular, Navy)",1,AMZ-PG-APP-TOO-SMALL
113-4426913-0913860,01/07/25,B017OEGA26,uglysweater55-XL,Costume Agent Let's Get Baked Happy Gingerbread Adult Green Ugly Christmas Sweater,1,CR-UNWANTED_ITEM
114-4975295-0312268,01/07/25,B016J36XRU,DS197-UglySweater-M,Dr. Seuss Grinch As Santa Next to Tree Long Sleeve Off-White Ugly Christmas Sweater (Adult Medium),1,CR-SWITCHEROO
111-2610116-7105064,01/07/25,B076HFSX43,CY034-ChristmasStoryUnionSuit-L,Briefly Stated A Christmas Story Bunny Union Suit Pajama Costume (Adult Large),1,CR-UNWANTED_ITEM
114-3899675-3826625,01/07/25,B00QKQNJH4,uglyjacketgbreadman-L-XL,Costume Agent Sequin Gingerbread Man Ugly Christmas Suit Jacket (Large/X-Large) Multi,1,AMZ-PG-APP-TOO-SMALL
114-2029280-2645814,01/07/25,B0C5YSD1HM,DH394MAU-DeadpoolSweater-L,"Deadpool Holiday Snowflakes Stripes Long Sleeve Ugly Christmas Sweater (as1, Alpha, l, Regular, Regular) Multicolor",1,AMZ-PG-APP-TOO-SMALL
112-8604232-9270605,01/07/25,B0DLCJ53V1,103091-MooseShotGlass-4PACK,UglyChristmasSweater Christmas Moose Mug Shot Clear Acrylic Cup - Funny Gift Box Set - Pack of 2 or 4-0.9 oz Shot Glasses (4 Pack),1,CR-ORDERED_WRONG_ITEM
111-5927926-3294660,01/07/25,B07JD2L3M6,CY034-ChristmasStoryUnionSuit-XXL,Briefly Stated A Christmas Story Bunny Union Suit Pajama Costume (Adult XX-Large),1,CR-UNWANTED_ITEM
112-9700287-1209825,01/07/25,B01LZJT12S,wrestlingboots-XLB,Pro Wrestling Costume Boots Super Hero Wrestler Halloween Cosplay Black,1,CR-UNWANTED_ITEM
112-7429233-3610632,01/07/25,B0DLXVVD5D,210547-FilthyAnimal-Navy-5XL,"Ya Filthy Animal Merry Christmas Snowflakes Pattern Adult Ugly Christmas Sweater Festive & Fun Holiday Sweater (US, Alpha, 5X-Large, Regular, Regular, Navy)",1,AMZ-PG-APP-TOO-LARGE
113-3770777-5835463,01/07/25,B0DJ1B32FH,MF24US207-SantaGrinchSuit-M,Grinch with Santa Hat Face All Over Pajamas Jumpsuit - Christmas Union Suit with Hood and Pockets for Men and Women (Medium) Multicolor,1,CR-UNWANTED_ITEM
113-3770777-5835463,01/07/25,B0DJ1BX8CR,MF24US207-SantaGrinchSuit-L,Grinch with Santa Hat Face All Over Pajamas Jumpsuit - Christmas Union Suit with Hood and Pockets for Men and Women (Large) Multicolor,1,CR-UNWANTED_ITEM
112-7138980-0260217,01/07/25,B07L17YKBZ,ILoveXmasUCS-M,Costume Agent I Love Xmas HOHOHO Light Up (LED) and Bells Ugly Christmas Sweater - White (Medium),1,AMZ-PG-APP-TOO-SMALL
112-9007797-4105847,01/07/25,B07NSDBN21,ILoveXmasUCS-XL,Costume Agent I Love Xmas HOHOHO Light Up (LED) and Bells Ugly Christmas Sweater - White (X-Large),1,AMZ-PG-APP-TOO-LARGE
113-0126790-8067450,01/07/25,B00HNYCYPA,arrestedbobblehead001,Arrested Development Bluth Stair Car with Michael Bobblehead,1,CR-DAMAGED_BY_FC
111-4311767-5861854,01/07/25,B0DHYMFF8F,UF24US249-GrinchSherpaSuit-M,The Grinch Sherpa Union Suit with Head Zipper Adult Halloween Costume Cosplay for Men and Women (Medium),1,CR-UNWANTED_ITEM
112-0834725-3321831,01/07/25,B015JT8MU6,uglysweater44-XXXL,"National Lampoon Shitter's Full Ugly Christmas Sweater Red, White - 3X-Large - Sweater Apparel - Funny Christmas Sweater",1,AMZ-PG-APP-TOO-LARGE
111-9840014-2928243,01/07/25,B09LRFWN21,NSSA3485TV-NarutoPants-2XL,Ripple Junction Naruto Shippuden Akatsuki Cloud Adult Sleep Lounge Pants,1,AMZ-PG-APP-TOO-SMALL
111-7238132-1524255,01/07/25,B09JGTKRFQ,100704-GriswoldInflatableCar,Costume Agent Inflatable Indoor and Outdoor Christmas Decoration - Car with Tree - 6 feet - Christmas Inflatables - Vacation Inflatable,1,CR-DEFECTIVE
112-6022442-8910607,01/07/25,B0DHYKDGF1,UF24PO206-GrinchPoncho-OS,Grinch Costume Big Face Green Oversized Giant Blanket Hoodie Christmas Sleep Poncho with Hood Halloween Cosplay Extra Comfy for Lounging - One Size,1,CR-MISSED_ESTIMATED_DELIVERY
112-5085586-4038642,01/07/25,B0BK1XJDG4,267345-GrinchPJPants-3XL,MJC Grinch All Over Santa Hat Christmas Pajamas Lounge Pants,1,AMZ-PG-APP-TOO-LARGE
113-9267058-5729059,01/07/25,B09VYH412H,UkraineBlanket_2-50x60silktouch,"Costume Agent Ukraine Flag Blanket Ukrainian National Flag Throw Fleece or Silktouch Blankets (50x60 Silktouch, Style 2)",1,CR-UNWANTED_ITEM
114-9723932-1810618,01/07/25,B0BHGFGV5M,220909-UglyAssSweater3D-XXL,Ugly Ass Adult Unisex Funny Holiday Ugly Christmas Sweater Multicolored,1,AMZ-PG-APP-TOO-LARGE
112-7667862-3173065,01/07/25,B016J36XRU,DS197-UglySweater-M,Dr. Seuss Grinch As Santa Next to Tree Long Sleeve Off-White Ugly Christmas Sweater (Adult Medium),1,CR-UNWANTED_ITEM
112-4478837-7844215,01/07/25,B01LY6QVK9,starwars168-M,Disney Star Wars Reindeer-Ugly Christmas Sweater,1,AMZ-PG-APP-TOO-SMALL
112-5535614-1193039,01/07/25,B0788Z83TV,MGB068MARA-GhostbusterCardigan-M,Mighty Fine Ghostbusters Logo Ugly Christmas Cardigan Sweater (Adult Medium) Gray,1,DID_NOT_LIKE_FABRIC
112-5535614-1193039,01/07/25,B0788XFVLG,MGB068MARA-GhostbusterCardigan-L,Mighty Fine Ghostbusters Logo Ugly Christmas Cardigan Sweater (Adult Large) Gray,1,DID_NOT_LIKE_FABRIC
113-5719872-3881012,01/07/25,B0DDVWZ7B7,SJTS0ECMNK-SimpsonsCharPants-2XL,The Simpsons Characters All Together Now Lounge Pants,1,AMZ-PG-APP-TOO-LARGE
113-7307429-7565030,01/07/25,B0DHYKDGF1,UF24PO206-GrinchPoncho-OS,Grinch Costume Big Face Green Oversized Giant Blanket Hoodie Christmas Sleep Poncho with Hood Halloween Cosplay Extra Comfy for Lounging - One Size,1,CR-DEFECTIVE
114-2410276-1257069,01/07/25,B08295ZWMG,CarpetWetTodd-RedBlack-S,"Costume Agent Ugly Christmas Sweater Why is The Carpet All Wet, Todd? (Adult, Small, Red and Black)",1,CR-UNWANTED_ITEM
114-2410276-1257069,01/07/25,B082959Y9Q,DontKnowMargoUCS-GreenRed-L,"Costume Agent Ugly Christmas Sweater I Don't Know Margo (Adult, Large, Green and Red)",1,CR-UNWANTED_ITEM
114-5341206-5913032,01/07/25,B00B1W6H6M,duckdynasty006silver-M,Duck Dynasty Phil Robertson Hap-Pay Hap-Pay Hap-Pay Rifles and Duck Adult T-Shirt (Adult Medium) Silver,1,CR-UNWANTED_ITEM
113-4093148-3698636,01/07/25,B0BB87RGJC,BLSM2596TV-BigLMarmotSweater-L,"Ripple Junction The Big Lebowski Dude Abide Marmot Bowling Ugly Christmas Sweater (US, Alpha, Large, Regular) Multicolored",1,CR-DEFECTIVE
111-8029901-2113800,01/07/25,B0DHYMYCJY,UF24US249-GrinchSherpaSuit-L,The Grinch Sherpa Union Suit with Head Zipper Adult Halloween Costume Cosplay for Men and Women (Large),1,CR-DAMAGED_BY_CARRIER
111-6261426-1317860,01/07/25,B07HKSCRQJ,CVGriswoldLoungePants-WR0319-52-M,National Lampoon's Griswold Family Christmas Vacation Fair isle Lounge Pants (Adult Medium),1,AMZ-PG-APP-STYLE
