Order ID,Return request date,ASIN,Merchant SKU,Item Name,Return quantity,Return Reason
114-4665239-3346631,03/26/25,B09H8WSSTZ,220844-BoxingRobeKids-Blk,"Costume Agent Boxing Robe and Shorts Halloween Costume Cosplay for Kids Satin Boxer Cloak (Black, Blank (Not Printed))",1,AMZ-PG-BAD-DESC
113-3309400-9153054,03/26/25,B08KWKFJGB,220082-VioletChubSuit-ADULT,Violet Chub Suit Inflatable Halloween Costume (Adult),1,CR-UNWANTED_ITEM
113-8131183-6437801,03/26/25,B0CFB7X3BZ,220969-JunoShirtStripes-L,"Costume Agent Dancing Elk Condors Halloween Costume T-Shirt Tee with Striped Sleeves Cosplay for Mens and Womens Multicolor, Large",1,CR-UNWANTED_ITEM
113-8131183-6437801,03/26/25,B0CJJZRGHX,Juno001N-L,Costume Agent Dancing Elks Condors High School T-Shirt Tee Halloween Costume Cosplay Red,1,CR-UNWANTED_ITEM
111-6390591-9138648,03/26/25,B08KWKFJGB,220082-VioletChubSuit-ADULT,Violet Chub Suit Inflatable Halloween Costume (Adult),1,CR-UNWANTED_ITEM
114-6023182-7513043,03/26/25,B07XVRY4FK,QueenofMusic-Armband,Costume Agent Adult Unisex Queen of Music Studded Armband Halloween Cosplay Costume Accessory,2,AMZ-PG-WJ-TOO-LARGE
114-3854366-7621812,03/26/25,B004TNCJM6,hangover014-XL,Hangover The Alan Baby Bjorn with Graphic Human Tree Dark Khaki Adult Costume T-Shirt Tee (X-Large),1,CR-ORDERED_WRONG_ITEM
113-7769833-0895466,03/26/25,B009Q73R1M,caddyshackhat002,Caddyshack Bushwood Country Club Golf White Baseball Hat,1,CR-UNWANTED_ITEM
112-5023742-1713040,03/26/25,B0D367G93M,220994-SheriffKidsShirt-12-18m,Sheriff Woody Cowboy Shirt Kids Children Halloween Costume Cosplay Yellow,1,AMZ-PG-APP-STYLE
112-8152971-3913040,03/26/25,B08HP5F5GM,220775-BigBoyOverall-RED-S/M,Costume Agent Checkered Overalls Adult Game Day Halloween Costume Cosplay - Red (Small-Medium),2,CR-MISSED_ESTIMATED_DELIVERY
112-8704718-8778604,03/25/25,B07WP6BJHW,220080-SharkChubSuitPink-Teen,"Costume Agent Shark Chub Suit Inflatable Adult Halloween Costume (Teen, Pink)",1,AMZ-PG-APP-STYLE
112-8704718-8778604,03/25/25,B09HJJNTGL,220079-SharkChubSuitBlue-YOUTH,"Costume Agent Shark Chub Suit Inflatable Adult Halloween (Youth, Blue)",1,DID_NOT_LIKE_COLOR
114-7276713-7142631,03/25/25,B07W81WF8C,204087-ChotchkiesCostumeSet-M,Costume Agent Chotchkies Women's Halloween Cosplay Costume Set (Medium) Multicolored,1,CR-UNWANTED_ITEM
113-7035590-5365012,03/25/25,B0CJYJYQ6D,4U9ML-ERNIE-CostumeShirt-4XL,"Mad Engine Halloween and Cosplay Costume - Bert and Ernie Sesame Street Long Sleeve (US, Alpha, 4X-Large, Regular, Ernie)",1,CR-UNWANTED_ITEM
113-7035590-5365012,03/25/25,B08GTZ2H2K,4U8ML-BERT-CostumeShirt-2XL,"Mad Engine Halloween and Cosplay Costume - Bert and Ernie Sesame Street Long Sleeve (US, Alpha, XX-Large, Regular, BERT)",1,CR-UNWANTED_ITEM
114-3169431-2754636,03/25/25,B01JSFN2Y8,suicidesquad004-S,DC Comics Suicide Squad Harley Quinn Shorts Panties Costume for Women Halloween Cosplay Red/Blue,1,AMZ-PG-APP-TOO-SMALL
113-8450334-6629839,03/25/25,B0DJ9MN3RG,103071-BarrelMonkeyTie-OS,1980s Video Game Monkey Throwing Barrels Halloween Costume Accessory Tie,1,CR-DAMAGED_BY_FC
112-9617841-6741013,03/25/25,B0147ARIWQ,sharkcostume-teen,Costume Agent Half Time Show Left Shark Dancing Mascot Blue Zip Jumpsuit Halloween Costume Cosplay,1,AMZ-PG-APP-STYLE
114-2345190-7705051,03/25/25,B01LBRL97I,100576BROWN-S,Costume Agent Pirate Boots Adventure Footwear Halloween Costume Cosplay Accessory - Brown - Small - Pirate Carribean Pirate Boot Men - Men's Tall Boots - Mens Cosplay Boots,1,CR-SWITCHEROO
112-3473581-8986614,03/25/25,B0CDN6CH1T,221021-LebowskiGreenRobe-S/M,Costume Agent The Dude Maude Robe Cosplay Halloween Costume Robe - Women's Bathrobe Full-Length Cosplay,1,AMZ-PG-APP-TOO-LARGE
113-3703607-0139455,03/25/25,B0CGRPY9BS,220986-RicFlairRobe-Pink-OS,Costume Agent Nature Boy Flair Wrestler Deluxe Robe Halloween Costume Cosplay,1,AMZ-PG-APP-TOO-SMALL
114-4181029-9029831,03/25/25,B00CP8M0VW,mm001Nred-XL,M&M M&M's Candy Red Silly Character Face Adult T-Shirt (Adult X-Large),1,CR-UNWANTED_ITEM
114-4181029-9029831,03/25/25,B01J6J5P4Q,mm003JRSorange-XL,"M&M's Chocolate Lover Candy T-Shirt for Women | Perfect for Christmas, Cosplay Events, Halloween & Themed Based Parties",1,CR-UNWANTED_ITEM
114-9612648-1834604,03/25/25,B07ZL1KPR1,TSM20002TV-WoodyBelt-XL,"Toy Story Woody and Jessie Halloween Cosplay Costume Belt (X-Large - 42'' - 46"") Brown",1,AMZ-PG-APP-TOO-SMALL
111-4006637-7096252,03/25/25,B0B8L37PYB,103003-CBSlippers-12-13,Charlie B Comics Dog Friend Halloween Costume Slippers Shoes Brown,1,CR-SWITCHEROO
111-4006637-7096252,03/25/25,B0B7BVZR9Z,peanuts044N-2XL,Charlie B Halloween Costume Polo Shirt Yellow Zig Zag T-Shirt Cosplay,1,AMZ-PG-APP-TOO-SMALL
114-0229232-5629845,03/25/25,B081ZFJW2P,HS0216-MrPotatoHeadPants-L,Mr Potato Head Pink Hot Potato Plush Lounge Pants (Adult Large),1,AMZ-PG-APP-TOO-LARGE
114-4231170-5106630,03/25/25,B09LRGMKBJ,GDSA2851TV-GratDeadPants-XL,Ripple Junction Grateful Dead Steal Your Face Adult Sleep Lounge Pants,1,AMZ-PG-APP-TOO-SMALL
112-2124003-3313023,03/25/25,B07FWF7W8Z,BoxingRobe-Red,Costume Agent Halloween Costume Boxing Robe with Hood Cosplay Red,2,DID_NOT_LIKE_COLOR
114-4317375-6585855,03/25/25,B08LMM1R8W,220793-MasterRoshiShirt-L,Costume Agent Adult Unisex Master Roshi Character Halloween Cosplay Button Down Shirt (Orange),1,AMZ-PG-APP-TOO-LARGE
113-5879275-5805813,03/25/25,B00OPISW62,ricflare001-black,Costume Agent Ric Flair Nature Boy Costume Robe and Wig,1,CR-UNWANTED_ITEM
112-6113016-1649061,03/25/25,B0D367G93M,220994-SheriffKidsShirt-12-18m,Sheriff Woody Cowboy Shirt Kids Children Halloween Costume Cosplay Yellow,1,CR-ORDERED_WRONG_ITEM
111-3888952-6737007,03/25/25,B00GABP1SO,powerrangers018yellow-0/6,"Power Rangers Baby Ranger Costume Romper Onesie (0-6 Months, Yellow)",1,CR-UNWANTED_ITEM
112-8697434-6533809,03/25/25,B08GYCG2S7,220757-AverageJoesWomensSet-M,Costume Agent Dodgeball Average Joe's Halloween Costume For Women,1,AMZ-PG-APP-TOO-SMALL
114-6881259-4692251,03/25/25,B07V3NVQ4Q,204074-QuaggyGiggityShirt-S,Adult Halloween Costume Quaggy Giggity Button Down Shirt Red,1,CR-QUALITY_UNACCEPTABLE
113-3792757-8591449,03/25/25,B08FRQQ213,220762-RoddyPiperKiltBelt-S/M,Costume Agent Rowdy Roddy Piper Hot Rod Kilt Skirt and Belt Halloween Costume Set - S/M,1,AMZ-PG-BAD-DESC
112-7836952-0530652,03/25/25,B09H8WSSTZ,220844-BoxingRobeKids-Blk,"Costume Agent Boxing Robe and Shorts Halloween Costume Cosplay for Kids Satin Boxer Cloak (Black, Blank (Not Printed))",1,CR-UNWANTED_ITEM
113-0357911-7441825,03/25/25,B004Z21KMG,eastbound017-XL,Eastbound & Down Powers 55 Green & White Raglan Baseball Adult T-Shirt Tee (Adult X-Large),1,AMZ-PG-APP-TOO-LARGE
111-0646647-2993831,03/25/25,B009HU9I2U,incredibles001-M,Disney The Incredibles Basicon Adult Red T-Shirt (Adult Medium),1,DID_NOT_LIKE_FABRIC
112-1981473-6242627,03/25/25,B09FYK1PY7,220851-CruJones-M,Costume Agent Crue Jones RAD Replica Long Sleeve Red Sublimation Jersey Halloween Cosplay,1,AMZ-PG-APP-TOO-SMALL
113-1971855-3951425,03/25/25,B00275IHS8,flinttropicscostume,Flint Tropics Semi Pro Jackie Moon Basketball Uniform Costume,1,AMZ-PG-BAD-DESC
114-9409428-9356264,03/25/25,B004Z1I74Q,batman059-24M,Batman Uniform Costume Charcoal Gray Snapsuit Infant Onesie Baby Romper (24 Months),1,CR-UNWANTED_ITEM
112-7706004-1521009,03/25/25,B09H8X1FZG,220846-BoxingRobeKids-Flag,"Boxing Robe and Shorts Halloween Costume Cosplay for Kids Satin Boxer Cloak (American Flag, Blank (Not Printed))",1,AMZ-PG-APP-TOO-LARGE
112-9355588-0244219,03/25/25,B07FXP5M1N,DSTS26NGS-JessieJuniorsTshirt-M,Disney I am Jessie Toy Story Juniors' Costume T-Shirt (Medium),1,AMZ-PG-APP-TOO-SMALL
112-1108908-9927425,03/25/25,B075FWWL9R,1147-BeastWigandBeard,Costume Agent Adult Beast Wig and Beard,1,AMZ-PG-APP-STYLE
113-1471363-5017033,03/24/25,B0C3MQ7XPL,204070-DetectiveGREENShirt-4X,Costume Agent Blue & Detective Striped Long Sleeve T-Shirt Halloween Cosplay,1,AMZ-PG-APP-TOO-LARGE
114-4525223-8881842,03/24/25,B07L5X8JPC,Thing1-6-Union Suit-KIDS-7/8,MJC Dr Seuss Thing 1 & 2 Interchangeable Patches Kids Pajama Costume,1,CR-MISSED_ESTIMATED_DELIVERY
114-9139929-1358650,03/24/25,B07L5WVZ4J,Thing1-6-Union Suit-KIDS-10/12,MJC Dr Seuss Thing 1 & 2 Interchangeable Patches Kids Pajama Costume,1,CR-MISSED_ESTIMATED_DELIVERY
114-1976558-2217002,03/24/25,B0BBXR8MZX,220937-TedLassoWarmUps-L,Costume Agent Football Soccer Coach Jacket and Pants Warm-Ups Halloween Costume - Large - RIchmond Soccer Halloween Costume,1,AMZ-PG-APP-TOO-LARGE
112-3444648-4435430,03/24/25,B07HZWZ6PR,NasaBoots-PLZZ7270TV-8-9,Ground Up International NASA Astronaut Halloween Costume Accessory Boots White,1,AMZ-PG-APP-TOO-LARGE
114-6005792-3776233,03/24/25,B07V3NVQHX,204072-OfficeBossComboSet-M,Costume Agent Adult Halloween Costume Lumbergh Mmmk Office Boss Shirt Combo Set - Blue (Medium),1,CR-UNWANTED_ITEM
113-5220482-8463433,03/24/25,B00XIFZ9JG,tmntonesieORANGE-24M,Teenage Mutant Ninja Turtles Green Michelangelo Costume Infant Baby Onesie Romper (Orange Belt) (24 Months),1,AMZ-PG-APP-TOO-LARGE
112-0431747-3229832,03/24/25,B01J6J5HMG,mm003JRSred-S,"M&M's Chocolate Lover Candy T-Shirt for Women | Perfect for Christmas, Cosplay Events, Halloween & Themed Based Parties",1,AMZ-PG-APP-TOO-SMALL
111-9855267-6993049,03/24/25,B014Q6VNV8,caddyshackhat003,Ripple Junction Caddyshack Movie Carl Spackler Character Camo Golf Bucket Hat,1,CR-UNWANTED_ITEM
112-0431747-3229832,03/24/25,B00CP8M0VW,mm001Nred-XL,M&M M&M's Candy Red Silly Character Face Adult T-Shirt (Adult X-Large),1,AMZ-PG-APP-TOO-SMALL
112-1404590-7133840,03/24/25,B00FI3OTNS,ferris010-XL,Costume Agent 80's Day Off Movie Button Up Costume Sweater Vest Halloween Costume Black and Gold Vest for Men & Women,1,AMZ-PG-APP-TOO-SMALL
113-1115483-7306635,03/24/25,B07HBC5W3C,LolaSleepSet-WB1787-69-L,Underboss Tune Squad Varsity Halloween Costume Pajamas Shorts and Tank Top - Bunny #10 - Large - Halloween Basketball Costume for Women,1,CR-UNWANTED_ITEM
111-6912550-5435437,03/24/25,B0099R6VKI,wwe054WAISTwhite-M,TV Store World Heavyweight Champion Belt on Waist White T-Shirt (Adult Medium),1,CR-SWITCHEROO
111-2903585-8108255,03/24/25,B0039VUMJG,btlc004-M,Costume Agent Big Trouble Little China Fu Manchu White Men's Tank Top - Halloween Costume Cosplay - Medium - Big Trouble Little China Tank Top,1,AMZ-PG-APP-TOO-LARGE
113-0296792-2939450,03/24/25,B0B3JVM3BM,sbb015n-M,"Costume Agent Bayside High Womens Kelly Kapowski Off The Shoulder Wide Cut Neck Top Tigers Sweatshirt (as1, Alpha, m, Regular, Regular, Medium)",1,CR-UNWANTED_ITEM
111-9428840-6470616,03/24/25,B001K3C09U,napoleondynamite003,Rubies Napoleon Dynamite Costume Moon Boots One Size,1,CR-UNWANTED_ITEM
112-5912384-2034616,03/24/25,B008HRXNNO,wilfreddeluxe001,Costume Agent Wilfred Adult Deluxe Dog Costume - One Size - Halloween Costumes Adult - Human Dog Costume For Men and Women,1,CR-SWITCHEROO
113-8659049-5057013,03/24/25,B00FH80GT0,chubsuitcostume002-green,Costume Agent Adult Tuxedo Inflatable Chub Suit ® Costume (Green),1,CR-DEFECTIVE
111-9906923-3953852,03/24/25,B0CS842QWT,DRSE0DEM-TipHat-Shirt-XL,Dr Seuss The Cat in The Hat Be Original Tip Hat Adult Short Sleeves Black T-Shirt Tee,1,AMZ-PG-APP-TOO-SMALL
111-9906923-3953852,03/24/25,B0CS8GKKFG,DRSE0DEM-TipHat-Shirt-XS,Dr Seuss The Cat in The Hat Be Original Tip Hat Adult Short Sleeves Black T-Shirt Tee,2,AMZ-PG-APP-TOO-SMALL
111-0008822-2367464,03/24/25,B00CF8PFRI,sbb015-L,Saved By The Bell Kelly Kapowski Bayside Off The Shoulder Gray Juniors/Ladies Sweatshirt,1,CR-UNWANTED_ITEM
111-5808489-7375454,03/24/25,B002XGGE6S,sbb015-M,Saved By The Bell Kelly Kapowski Bayside Off The Shoulder Gray Juniors/Ladies Sweatshirt,1,CR-UNWANTED_ITEM
111-4220599-7251459,03/24/25,B003TORF84,doubledare001red-XXL,Double Dare Logo Costume Red Adult T-Shirt (Adult XX-Large),1,AMZ-PG-APP-TOO-SMALL
111-7408544-1318640,03/24/25,B003TORF66,doubledare001red-L,Double Dare Logo Costume Red Adult T-Shirt (Adult Large),1,AMZ-PG-APP-TOO-LARGE
112-6207346-1630621,03/24/25,B0DDDKXFKG,221087-BillySweaterVest-XL,Billy Hotel Madison Heir Ripped Sweater Halloween Costume Cosplay White,1,CR-MISSED_ESTIMATED_DELIVERY
112-6207346-1630621,03/24/25,B0DDDKXFKG,221087-BillySweaterVest-XL,Billy Hotel Madison Heir Ripped Sweater Halloween Costume Cosplay White,1,CR-MISSED_ESTIMATED_DELIVERY
112-3037025-3929014,03/24/25,B005N02EKQ,hulkhogancostumesetREDsunYELban-XL,Hogan Wrestler Deluxe Complete Set Halloween Costume Cosplay,1,CR-UNWANTED_ITEM
112-3037025-3929014,03/24/25,B00BMVIOUY,hulkpants001-L,Hulkamania Red and Yellow Tie-Dye Wrestling Legging Tights Pants (Adult Large),1,CR-UNWANTED_ITEM
113-0324768-6947409,03/24/25,B08GY1PQH5,AMZ-MM-3930R-Yellow-XL,M Team Halloween Costume Adult T-Shirt Yellow,1,CR-UNWANTED_ITEM
113-0324768-6947409,03/24/25,B08GYK3JLN,AMZ-MM-3930R-Yellow-L,M Team Halloween Costume Adult T-Shirt Yellow,1,CR-UNWANTED_ITEM
114-2551568-0096257,03/24/25,B01L2EGHFY,rockyshorts-L,Rocky Balboa- Black Italian Stallion Boxer Shorts,1,DID_NOT_LIKE_FABRIC
111-9798863-5695466,03/24/25,B01M0IXUKG,wrestlingboots-Mred,Costume Agent Pro Wrestling Boots Super Hero Wrestler Halloween Cosplay,1,AMZ-PG-APP-TOO-SMALL
111-6876661-6509023,03/24/25,B012H89Z5I,spacedogwig001,Costume Agent Space Balls Barf Half Man Half Dog Mawg Wig,1,AMZ-PG-BAD-DESC
114-9056010-9693036,03/24/25,B09JCN1J6P,dodgeball003N-M,Dodgeball Average Joe's Adult Yellow Jersey Costume Set (Medium),1,AMZ-PG-APP-TOO-LARGE
114-2344904-1008252,03/24/25,B09JCPKPDV,dodgeball003N-S,Costume Agent Dodgeball Average Joe's Adult Yellow Jersey Set (Small),1,CR-UNWANTED_ITEM
114-2344904-1008252,03/24/25,B09JCNZB6H,dodgeball003N-L,Dodgeball Average Joe's Adult Yellow Jersey Costume Set (Large),1,CR-UNWANTED_ITEM
114-2344904-1008252,03/24/25,B09JCN1J6P,dodgeball003N-M,Dodgeball Average Joe's Adult Yellow Jersey Costume Set (Medium),1,CR-UNWANTED_ITEM
112-6190773-8297828,03/24/25,B0045VDVEM,hoosiers003-XXL,Hoosiers Hickory High School 15 Basketball Costume Burgundy Jersey Tank Top (XX-Large),1,CR-UNWANTED_ITEM
111-6401325-7990631,03/24/25,B07FN78QWR,SpaceJamHeadWristBand-ECLT7021TV,Space Jam Headband & Wristband Terry Knit Set,6,CR-UNWANTED_ITEM
114-1412545-6535437,03/24/25,B01LBRLC0W,100576BROWN-M,Costume Agent Pirate Boots Adventure Footwear Halloween Costume Cosplay Accessory - Brown - Medium - Pirate Carribean Pirate Boot Men - Men's Tall Boots - Mens Cosplay Boots,1,AMZ-PG-APP-TOO-SMALL
111-9891971-6982631,03/24/25,B014Q6VNV8,caddyshackhat003,Ripple Junction Caddyshack Movie Carl Spackler Character Camo Golf Bucket Hat,1,CR-UNWANTED_ITEM
113-2345866-3592266,03/24/25,B015G9UX9C,tmnteyemaskset,Teenage Mutant Ninja Turtles Halloween Costume Cosplay 4 Felt Eye Masks,1,CR-UNWANTED_ITEM
111-6393089-1290642,03/24/25,B014LRDIGU,incredhulk013-XXXL,Marvel Incredible Hulk Sublimated Adult Long Sleeve Costume T-Shirt - 3X-Large Multi,1,AMZ-PG-APP-TOO-SMALL
114-0569907-9540224,03/24/25,B001PKZMSE,napoleonaccesssory-L,Napoleon Dynamite Adult Vote for Pedro T-Shirt and Accessory Kit (Large) White,1,CR-ORDERED_WRONG_ITEM
112-1287810-7689811,03/24/25,B07FTQR2N2,CowgirlShirt-204051-XS,Costume Agent - Jessie Cowgirl Halloween Costume Long Sleeve Shirt Cosplay White.,1,AMZ-PG-APP-TOO-SMALL
111-1313084-8949065,03/24/25,B09DXKBY91,PRangersShirtYouth-Yellow-M,"Power Rangers Mighty Morphin Yellow Boys Youth Armor Costume T-Shirt (MD, Yellow)",1,AMZ-PG-APP-TOO-SMALL
112-1272073-7809831,03/24/25,B000HQAXEA,hulk003-S,"Hulk Hogan ""hulkamania"" Sleeveless T-shirt Gold [Apparel] Size: Small",1,CR-UNWANTED_ITEM
112-6374743-3032203,03/24/25,B08KWKFJGB,220082-VioletChubSuit-ADULT,Violet Chub Suit Inflatable Halloween Costume (Adult),1,CR-QUALITY_UNACCEPTABLE
113-0088847-2337838,03/24/25,B0BHZV94L5,103008-ElfShoes-8-9,Buddy The Elf Christmas Costume Shoes Holiday Festive Footwear Accessory for Halloween & Cosplay,1,AMZ-PG-BAD-DESC
111-6616893-2513065,03/23/25,B07D3CLVL1,incredibles004-L,The Incredibles Basicon Red Long Sleeve T-Shirt and Mask Costume Set (Adult Large),1,AMZ-PG-APP-TOO-LARGE
113-3008992-3554643,03/23/25,B07FWG71LK,BoxingRobe-Blue,Costume Agent Halloween Costume Boxing Robe with Hood Cosplay Blue,1,CR-MISSED_ESTIMATED_DELIVERY
114-3395394-0585801,03/23/25,B016X4YE6W,fightclubglasses001,Costume Agent Fight Soap Salesman Red Sunglasses,1,AMZ-PG-APP-STYLE
113-5036761-1841026,03/23/25,B09H8RPM19,220846-BoxingRobeKids-Red,"Costume Agent Boxing Robe and Shorts Halloween Costume Cosplay for Kids Satin Boxer Cloak (Red, Blank (Not Printed))",1,CR-SWITCHEROO
111-4114978-9039469,03/23/25,B00CFBWJEW,sbb015-XL,Saved By The Bell Kelly Kapowski Bayside Off The Shoulder Gray Juniors/Ladies Sweatshirt,1,CR-QUALITY_UNACCEPTABLE
113-5976786-3898605,03/23/25,B0756JW1H6,5782-BatmanGlitteryArmTattoo,GBG Beauty Glittery Logo Peel and Stick Temporary Arm Tattoo,1,AMZ-PG-BAD-DESC
114-8914094-7934657,03/23/25,B08HNJY2SF,220775-BigBoyOverall-RED-L/XL,Costume Agent Checkered Overalls Adult Game Day Halloween Costume Cosplay - Red (Large-X-Large),2,AMZ-PG-APP-TOO-SMALL
111-9680001-4525823,03/23/25,B08GYCG2S7,220757-AverageJoesWomensSet-M,Costume Agent Dodgeball Average Joe's Halloween Costume For Women,1,AMZ-PG-APP-TOO-SMALL
112-4435266-9625053,03/23/25,B0085NX5QA,suitpajamas001purple-XXL,TV Store Adult Unisex Barney Legendary Pajama Suit Silk Pajamas Halloween Cosplay Costume,1,AMZ-PG-APP-TOO-SMALL
113-7244584-1020236,03/23/25,B003G44Y7C,alsunny001black-XL,It's Always Sunny In Philidelphia Paddy's Irish Pub Adult Tee Shirt XL,1,AMZ-PG-APP-TOO-LARGE
111-4607588-0433846,03/23/25,B00FH80GT0,chubsuitcostume002-green,Costume Agent Adult Tuxedo Inflatable Chub Suit ® Costume (Green),1,CR-DEFECTIVE
113-6889248-9086630,03/23/25,B075MHX6PM,220696-WOMENS-MimeCostumeSet-XS,Costume Agent Women's Mime Halloween Cosplay Set Multicoloured,1,CR-MISSED_ESTIMATED_DELIVERY
113-6889248-9086630,03/23/25,B075MJJQ66,220697-MENS-MimeCostumeSet-XL,Men's Mime Costume Set with Makeup Kit (Adult X-Large),1,DID_NOT_LIKE_FABRIC
113-6889248-9086630,03/23/25,B075MJ4WDG,220696-WOMENS-MimeCostumeSet-S,Costume Agent Women's Mime Halloween Cosplay Set Multicoloured,1,DID_NOT_LIKE_COLOR
113-6889248-9086630,03/23/25,B075MH61JD,220697-MENS-MimeCostumeSet-L,Costume Agent Men's Mime Costume Set with Makeup Kit - Large - Mime Costume Adult Male - Mime Halloween Costumes for Adults Man - Mens Mime Halloween Costume,1,DID_NOT_LIKE_COLOR
111-4129511-5861815,03/23/25,B0BGMZRRYL,103015-BabyCarlosDollGlasses,Costume Agent Hangover Baby Carlos Doll Carrier and Glasses Halloween Costume Cosplay Accessory Multicolor,1,CR-UNWANTED_ITEM
111-4129511-5861815,03/23/25,B003Y3SKKM,junkfood187-XL,The Hangover Alan Human Tree Dark Khaki Adult Costume T-Shirt Tee X-Large,1,CR-UNWANTED_ITEM
112-1891771-8165859,03/23/25,B0B8FX7WMK,ChesterCheetosSuit-XL,"Cheetos Men's Chester Cheetah Fleece Costume Union Suit, Sun Orange/White, X-Large",1,AMZ-PG-APP-TOO-SMALL
111-9984891-1967405,03/23/25,B09G3JMCKB,220759-BLUE-DetBLUEShirt-3XL,Costume Agent Blue & Detective Striped Long Sleeve T-Shirt Halloween Cosplay,1,AMZ-PG-APP-TOO-SMALL
114-8129738-2091416,03/23/25,B01LBRLA6S,100576BROWN-L,Costume Agent Pirate Boots Adventure Footwear Halloween Costume Cosplay Accessory - Brown - Large - Pirate Carribean Pirate Boot Men - Men's Tall Boots - Mens Cosplay Boots,1,AMZ-PG-APP-TOO-LARGE
113-2353172-5939466,03/23/25,B00NPB30BC,powerrangerssweatshirtBlue-XXXL,Power Rangers Blue Hooded Costume Sweatshirt (Adult XXX-Large),1,AMZ-PG-APP-TOO-LARGE
113-7676979-8641804,03/23/25,B07L5XQ8QN,Thing1-6-Union Suit-KIDS-5/6,MJC Dr Seuss Thing 1 & 2 Interchangeable Patches Kids Pajama Costume,1,CR-MISSED_ESTIMATED_DELIVERY
111-0382751-8236256,03/23/25,B09LRHCZ1X,GDSA2851TV-GratDeadPants-L,Ripple Junction Grateful Dead Steal Your Face Adult Sleep Lounge Pants,1,AMZ-PG-APP-TOO-LARGE
113-6268146-0582659,03/23/25,B0145Q38M6,waldocostumeDELUXE-L,"Where's Waldo Longe Sleeve Shirt, Glasses, and Hat Deluxe Cosplay Halloween Costume Set",1,CR-SWITCHEROO
114-0021662-7730658,03/23/25,B0DDW86NHX,DSTB0JAMN-NightMareChristmas-2XL,Mad Engine The Nightmare Before Christmas Blue Lounge Pants,1,AMZ-PG-APP-STYLE
114-9768735-6901857,03/23/25,B015HNJVX6,dresshat001HAT3-Red,Costume Agent Dress Up Party Costume FEDORA Hat (Red),1,AMZ-PG-APP-STYLE
112-4435266-9625053,03/23/25,B0085NX5QA,suitpajamas001purple-XXL,TV Store Adult Unisex Barney Legendary Pajama Suit Silk Pajamas Halloween Cosplay Costume,1,AMZ-PG-APP-TOO-SMALL
112-7510118-2998643,03/22/25,B009HU9I2K,incredibles001-XL,TV Store Disney The Incredibles Basicon Red T-Shirt (Adult X-Large),1,AMZ-PG-APP-TOO-LARGE
114-5597825-8578659,03/22/25,B08NTNNTXQ,XO011MBSTV-TopGunPajamaSuit-3XL,Briefly Stated Top Gun Flight Suit Costume Pajama Union Suit - 3XL,2,AMZ-PG-APP-TOO-LARGE
114-5597825-8578659,03/22/25,B08NTNKT33,XO011MBSTV-TopGunPajamaSuit-XL,Briefly Stated Top Gun Flight Suit Costume Pajama Union Suit - XL,2,DID_NOT_LIKE_FABRIC
112-6535357-0449015,03/22/25,B0DJMZ575L,103075-CowgirlToyHat-ADULT,Sheriff Cowgirl Hat Adult Halloween Costume Cosplay Accessories - One Size (Cowgirl),1,CR-UNWANTED_ITEM
112-1551555-8101021,03/22/25,B0CS8FB222,DRSE0D8M-Thing1-Shirt-M,Dr Seuss Thing 1 and Thing 2 Adult Short Sleeves Red T-Shirt Tee,1,AMZ-PG-APP-TOO-SMALL
112-1551555-8101021,03/22/25,B0CS7XJ5F8,DRSE0D7M-Thing2-Shirt-S,Dr Seuss Thing 1 and Thing 2 Adult Short Sleeves Red T-Shirt Tee,1,AMZ-PG-APP-TOO-SMALL
111-1530532-2833834,03/22/25,B09HW2NKWV,220874-SloaneJacket-L,Costume Agent Day Off Sloane Halloween Costume White Jacket Western Outfit Ferris Cosplay,1,DID_NOT_LIKE_FABRIC
111-1530532-2833834,03/22/25,B09HW2NKWV,220874-SloaneJacket-L,Costume Agent Day Off Sloane Halloween Costume White Jacket Western Outfit Ferris Cosplay,1,DID_NOT_LIKE_FABRIC
113-3707759-6361052,03/22/25,B00H3IFZ70,incredhulk006-XL,"Marvel Incredible Hulk Men's Verde Rock T-Shirt, White Sublimated, X-Large",1,AMZ-PG-APP-TOO-LARGE
111-7887935-4813000,03/22/25,B0CGKBFGBZ,220988-SallyCostume-S,Sally Comic Strip Halloween Costume Cosplay Pink Polka Dot Mini Dress with Puff Sleeves,1,CR-SWITCHEROO
114-2029859-2561848,03/22/25,B0B9YKF4MF,220907-CandyWorker-S,Candy Chocolate Factory Worker Halloween Cosplay Costume Set with Shirt Socks Shoe Wig Gloves for Men and Women,3,AMZ-PG-APP-TOO-SMALL
111-2832944-6279463,03/22/25,B0CJVLP6N8,DSMN-MensMonstersJacket-M,Mad Engine Monsters University Varsity Jacket Blue and White MU Logo Halloween Costume Cosplay,1,AMZ-PG-APP-TOO-SMALL
112-0292080-7272202,03/22/25,B0CJ3P3H53,103036-PlugThrophy-OS,Costume Agent Auditor of The Month Plug Throphy Custom Add Your Name Engraved Text Funny Halloween Costume Prop (Not Personalized),1,AMZ-PG-BAD-DESC
111-5666042-1173044,03/22/25,B0085CBWWA,parksandrec003-L,Parks & Recreation Treat Yo Self Indigo Blue Mens T-Shirt (Adult Large),1,CR-SWITCHEROO
112-7222840-5673809,03/22/25,B0BH6RWXN9,220920-BigNateShirt-7/8,Costume Agent Big Nate Blue & Yellow Shirt Kids Halloween Costume Cosplay,1,CR-MISSED_ESTIMATED_DELIVERY
113-9306602-7966601,03/22/25,B001C40Y1I,Office008-L,"The Office Michael Scott's Fun Run Race Blue T-Shirt Tee, Large",1,CR-UNWANTED_ITEM
111-5539324-3049064,03/22/25,B08JQMJHCF,PKPR045-PowerRangersSocks-Yellow,Mad Engine Power Rangers Logo Halloween Costume Crew Socks (Yellow),1,AMZ-PG-APP-TOO-SMALL
112-2219579-0087434,03/22/25,B00PSLZ9I4,chubsuitcostume001Teen-Nude,Inflatable Teen Chub Suit ® Costume (Nude),1,AMZ-PG-APP-TOO-SMALL
112-9961989-2653066,03/22/25,B00PSLZ9I4,chubsuitcostume001Teen-Nude,Inflatable Teen Chub Suit ® Costume (Nude),1,AMZ-PG-APP-TOO-SMALL
112-9908656-9205818,03/22/25,B00OPISW62,ricflare001-black,Costume Agent Ric Flair Nature Boy Costume Robe and Wig,1,CR-DEFECTIVE
112-3660693-1470656,03/22/25,B0CLMCTM4R,221036-RetroJacketDesign2-XL,Retro Windbreaker Jacket Lightweight 80s & 90s Colorful Designs,1,AMZ-PG-APP-TOO-LARGE
114-0436482-4461058,03/22/25,B0BGQDWSNK,220939-BeerfestTracksuit-M,"Costume Agent Beer Fest USA Blue and Red Tracksuit Jacket and Pants Halloween Costume Cosplay, Medium",1,CR-DEFECTIVE
112-5865205-4624268,03/22/25,B015WWTP8S,waynesworldcostumeset002-L,Wayne's World Costume Set - Waynes Hat and Aerosmith Aero Force T-shirt 90s Retro for Halloween,1,CR-MISSED_ESTIMATED_DELIVERY
111-1896329-2295418,03/22/25,B0085NX5GU,suitpajamas001black-M,TV Store Adult Unisex Barney Legendary Pajama Suit Silk Pajamas Halloween Cosplay Costume,1,AMZ-PG-APP-TOO-SMALL
111-4152555-8142626,03/22/25,B07L5XCCF7,Thing1-6-Union Suit-KIDS-3/4,MJC Dr Seuss Thing 1 & 2 Interchangeable Patches Kids Pajama Costume,1,CR-MISSED_ESTIMATED_DELIVERY
112-7662543-2417056,03/22/25,B09FYHH1Y8,220851-CruJones-XL,Costume Agent Crue Jones RAD Replica Long Sleeve Red Sublimation Jersey Halloween Cosplay,1,CR-UNWANTED_ITEM
111-3812412-6262658,03/22/25,B07L5WVZ4J,Thing1-6-Union Suit-KIDS-10/12,MJC Dr Seuss Thing 1 & 2 Interchangeable Patches Kids Pajama Costume,1,CR-UNWANTED_ITEM
111-0222505-6445077,03/22/25,B07L5X8JPC,Thing1-6-Union Suit-KIDS-7/8,MJC Dr Seuss Thing 1 & 2 Interchangeable Patches Kids Pajama Costume,1,AMZ-PG-APP-TOO-SMALL
111-0718649-2195449,03/22/25,B07WC4T7GY,220079-SharkChubSuitBlue-Adult,"Costume Agent Shark Chub Suit Inflatable Adult Halloween Costume (Adult, Blue)",1,AMZ-PG-APP-STYLE
114-9976002-8190665,03/22/25,B07YBCP75D,220743-FlintTropicsSHORTS-L/XL,Costume Agent Flint Tropics White Basketball Shorts Adult Halloween Costume - White (Large-X-Large),1,AMZ-PG-APP-TOO-LARGE
113-3817100-3114634,03/21/25,B00PSLZ9I4,chubsuitcostume001Teen-Nude,Inflatable Teen Chub Suit ® Costume (Nude),1,CR-UNWANTED_ITEM
111-0713289-3417065,03/21/25,B00BJQKC16,stepbros010-L,Step Brothers Pablo Cruise Adult Gray and Maroon Raglan T-Shirt (Adult Large),1,AMZ-PG-APP-TOO-SMALL
111-0199922-5997814,03/21/25,B07JCDHMCP,UncleDrew-1235,Costume Agent Uncle Drew Adult Hallloween Costume Accessory Wig Beard and Glasses Set Gray,1,AMZ-PG-APP-TOO-LARGE
114-2134566-0681852,03/21/25,B0CL61432D,Juno002N-2XL,Dancing Elk Condors Halloween Costume Cosplay Sweatshirt Hoodie | XX-Large Red,1,CR-MISSED_ESTIMATED_DELIVERY
