Order ID,Return request date,ASIN,Merchant SKU,Item Name,Return quantity,Return Reason
112-4835304-5548244,01/30/25,B0B7BVZR9Z,peanuts044N-2XL,Charlie B Halloween Costume Polo Shirt Yellow Zig Zag T-Shirt Cosplay,1,AMZ-PG-APP-STYLE
112-6938066-8697043,01/30/25,B08FRQCXDY,220762-RoddyPiperKiltBelt-L/XL,Rowdy Roddy Piper Hot Rod Kilt Skirt and Belt Halloween Costume Set - L/XL Red,1,DID_NOT_LIKE_FABRIC
112-9138698-9469001,01/30/25,B07JQXPQDB,FilthyAnimalLoungePants-XF003-L,Briefly Stated Merry Christmas Pajama Pants For Men and Women,2,CR-DEFECTIVE
114-0606002-3025833,01/29/25,B07FXMX1NW,DSTS26NGS-JessieJuniorsTshirt-S,Disney I am Jessie Toy Story Costume T-Shirt (Small),1,CR-MISSED_ESTIMATED_DELIVERY
112-8668411-6363428,01/29/25,B00U0HNPPK,OESM2387TV-DwightBeetsSweater-M,Ripple Junction The Office Dwight Schrute Farms Beets Ugly Christmas Sweater - Medium - Ugly Sweater - Funny Christmas Sweaters for Men & Women Green,1,CR-UNWANTED_ITEM
113-8541375-9625020,01/29/25,B0B8K2JV5T,220898-EllenGirswold-M,Costume Agent Adult Vacation Movie Ellen Griswold Character Top Skirt Halloween,1,AMZ-PG-APP-TOO-LARGE
113-6173975-6447462,01/29/25,B0CKC2CJ3D,CCX21-CokeHeartSweater-S,Mad Engine-Coca Cola Heart Polar Bear Drinking Women's Ugly Christmas Sweater Multicolor,1,CR-DEFECTIVE
111-0164844-3350662,01/29/25,B07L454CKW,3DTRexUCS-L,Costume Agent 3D T-Rex Red and Green Adult Ugly Christmas Sweater (Large),1,AMZ-PG-APP-STYLE
112-0167455-2865844,01/29/25,B076HFQHF7,CY034-ChristmasStoryUnionSuit-XL,Briefly Stated A Christmas Story Bunny Union Suit Pajama Costume (Adult X-Large),2,CR-MISSED_ESTIMATED_DELIVERY
111-8069855-4140248,01/29/25,B0CHN4KRCS,SRST02-StarTrekLS-Red-3XL,Mad Engine - Star Trek - Long Sleeve Halloween Costume T-shirt - Spock Captain Kirk Engineering Cosplay,1,CR-UNWANTED_ITEM
113-1529234-4133044,01/29/25,B0B8K2H9XD,220898-EllenGirswold-L,Costume Agent Adult Vacation Movie Ellen Griswold Character Top Skirt Halloween,1,AMZ-PG-BAD-DESC
113-0715042-9343407,01/29/25,B0BL1LFFC5,DSSCDRK-ClassicMickeySweater-2XL,Mickey Mouse Classic Christmas Snowflake Patterns Ugly Chritsmas Sweatshirt Green,1,CR-UNWANTED_ITEM
114-6826750-6985824,01/29/25,B002STMH70,acwig,Saved by the Bell AC Slater Costume Wig,1,CR-UNWANTED_ITEM
114-6048839-5463401,01/29/25,B07BMD7NCZ,SecretStuffWaterBottle,Costume Agent Michael's Secret Stuff Office TV Show Halloween Cosplay Costume Prop Accessory,1,CR-DAMAGED_BY_FC
113-0049872-9780259,01/29/25,B0CBVWG7TC,uglysweater60N-L,"Ripple Junction Seinfeld Festivus for The Rest of Us Pole Cream Ugly Christmas Sweater (as1, Alpha, l, Regular, Regular)",1,AMZ-PG-APP-TOO-SMALL
113-8383712-0098627,01/29/25,B0CBVWG7TC,uglysweater60N-L,"Ripple Junction Seinfeld Festivus for The Rest of Us Pole Cream Ugly Christmas Sweater (as1, Alpha, l, Regular, Regular)",1,AMZ-PG-APP-TOO-LARGE
113-0122447-9157801,01/29/25,B00CF7KTIE,sbb015-S,Saved By The Bell Kelly Kapowski Bayside Off The Shoulder Gray Juniors/Ladies Sweatshirt,1,CR-UNWANTED_ITEM
114-5838590-8126614,01/29/25,B08JH7DQ6M,62RBL-MerryKrampusUCS-XL,Mad Engine Merry Krampus Head All Over Festive Pattern Ugly Christmas Sweater Red,1,AMZ-PG-APP-TOO-SMALL
113-0049872-9780259,01/29/25,B0CBVWG7TC,uglysweater60N-L,"Ripple Junction Seinfeld Festivus for The Rest of Us Pole Cream Ugly Christmas Sweater (as1, Alpha, l, Regular, Regular)",1,CR-UNWANTED_ITEM
114-8996519-2563422,01/29/25,B01JGPD2X6,bb8kigurumi-L,STAR WARS One Piece Zip Up Pajama Jumpsuit Kigurumi (Adult Large) White,1,AMZ-PG-APP-TOO-SMALL
113-3671092-8867407,01/29/25,B09LJVMCG6,102025-InfOrnament-18-Gold,"Inflatable Oversized Ornaments Jumbo Christmas Balls 15"" 18"" 25"" or 30"" inches Holiday Decorations Indoor Outdoor",2,CR-DAMAGED_BY_CARRIER
111-8449050-3643416,01/29/25,B01LX7MHKZ,starwars168-4X,Disney Star Wars Reindeer Ugly Christmas Sweater,1,AMZ-PG-APP-TOO-SMALL
111-3730166-9918610,01/29/25,B07XYDVKMS,100600-BlueVikingHelmet,Costume Agent Viking Furry Blue Hat Helmet Adult Halloween Costume Accessory,1,AMZ-PG-APP-TOO-SMALL
112-9905381-6917813,01/29/25,B076HFQHF7,CY034-ChristmasStoryUnionSuit-XL,Briefly Stated A Christmas Story Bunny Union Suit Pajama Costume (Adult X-Large),1,CR-MISSED_ESTIMATED_DELIVERY
112-7364971-1825809,01/29/25,B09MSRKHFY,YTAS2063TV-PizzaPlanetShirt-2XL,"Toy Story Pizza Planet Shirt and Delivery Box Costume Set - Mens Toy Story T-Shirt, Red - XX-Large",1,CR-UNWANTED_ITEM
112-5031022-3144258,01/29/25,B005EHIUP6,Futurama003-M,Ripple Junction Futurama Faded Planet Express Black T-Shirt (M),1,DID_NOT_LIKE_COLOR
114-9811435-6177033,01/29/25,B0CKJ653ZZ,220994-SheriffKidsShirt-2T,Costume Agent Sheriff Woody Cowboy Shirt Kids Children Halloween Costume Cosplay Yellow,1,AMZ-PG-BAD-DESC
112-9880336-8681038,01/29/25,B0BPVLCWN9,WuTangLogoSnowflakesUCS-XL,Costume Agent Wu Tang Clan Logo Snowflakes Yellow Black White Ugly Christmas Sweater,1,AMZ-PG-APP-TOO-SMALL
114-7325284-3805819,01/29/25,B005Y4I6VW,fearloathingglasses,Costume Agent Fear and Loathing in Las Vegas Hunter S. Thompson Costume Sunglasses - Classic Large Metal Frame Sun Glasses for Adult,1,AMZ-PG-APP-TOO-SMALL
111-8244958-2627466,01/29/25,B093CDL55J,ChristmasOrnaments-CousinEddie,Costume Agent Assorted Funny Christmas Tree Ornaments Decoration (Cousin Eddie),1,CR-SWITCHEROO
113-1188363-9953806,01/29/25,B0019CEOXM,ApolloShorts-XL,Balboa Apollo Movie Boxing American Flag Shorts for Men's & Women's,1,AMZ-PG-APP-TOO-LARGE
111-9295661-3909839,01/29/25,B0D9QS943L,VSPS1-RTSNOW-PantSKIN-S,VERSAskins Jacket or Pants Skin Set Water and Wind Resistant with Interchangeable Skins for Skiing,1,AMZ-PG-BAD-DESC
111-9295661-3909839,01/29/25,B0D6Z6PF1Y,VSJS1-RTSNOW-JacketSKIN-S,VERSAskins Jacket or Pants Skin Set Water and Wind Resistant with Interchangeable Skins for Skiing,1,AMZ-PG-APP-STYLE
113-8352072-8930623,01/29/25,B0BL1K1TBN,DSSCDRA-MickeyHeadsHoliday-XL,Mickey Mouse Santa Hat Cardigan Ugly Christmas Sweater Multicolor,1,AMZ-PG-APP-TOO-LARGE
114-8882667-6722627,01/29/25,B0BM54DWDB,NDSS0K5M-PineappleHousePants-L,Mad Engine Spongebob Squarepants Pineapple House Lounge Pants - Large - Cartoon Pajama Pants - Christmas Pajama Pants - Funny PJ Pants,1,AMZ-PG-APP-TOO-LARGE
111-5740254-0382634,01/29/25,B003WRI40Q,stepbros001-XL,Step Brothers Shoe Sneakers Hanging Black Adult T-Shirt Tee (X-Large),1,CR-UNWANTED_ITEM
112-9306442-3319430,01/29/25,B01M4KYMVQ,YellowBandanaRedGlasses,TNA Hulk Hogan Hulkamania Bandana Sunglasses Costume - Yellow-Red,1,AMZ-PG-APP-STYLE
111-5176570-6977048,01/29/25,B0CJVMYQDD,DSMN-BoysMonstersJacket-XS,Monsters University Varsity Jacket Blue and White MU Logo Halloween Costume Cosplay,1,AMZ-PG-APP-TOO-LARGE
112-9958150-0339431,01/29/25,B07FDL126R,RetroWigHeadband-1191,Costume Agent Retro 80s Aerobics Instructor Deluxe Wig and Headband Costume Set,1,CR-DEFECTIVE
113-1965324-2488228,01/29/25,B09HCSJ7NR,220823-PinkBunny-KIDS-5/6,Costume Agent Kids/Youth/Toddler Christmas Pink Bunny Jumpsuit Halloween Christmas,1,CR-UNWANTED_ITEM
112-1621345-6903436,01/29/25,B0887LFPN8,3001-White-ChampionShirt-M,"Hollywood Champion T Shirt for Men, Officially Licensed Tee for Cliff Booth Fans - Medium - White",1,AMZ-PG-APP-TOO-SMALL
111-7805428-6183401,01/29/25,B07FDNBHMB,LukeWig-1200,Luke Sky Deluxe Costume Accessory White Wig and Beard Set,1,CR-UNWANTED_ITEM
112-9871457-2011434,01/29/25,B015HNJVX6,dresshat001HAT3-Red,Costume Agent Dress Up Party Costume FEDORA Hat (Red),1,AMZ-PG-APP-TOO-LARGE
113-4178447-1831460,01/29/25,B0BGYLCCQW,UP-SashPinsFlag-Hat-KIDS,Costume Agent UP Animated Movie Cartoon Deluxe Kids Halloween Russell Cosplay Costume Set,1,CR-UNWANTED_ITEM
111-9715737-4469859,01/29/25,B09CV7BSGK,204292-DeerRingSweater-L,Costume Agent Reindeer Ring Toss 3D Adult Ugly Christmas Sweater Multicolored,1,AMZ-PG-APP-TOO-LARGE
111-8911125-9768224,01/29/25,B0DJ19H2NK,MF24US207-SantaGrinchSuit-2XL,Grinch with Santa Hat Face All Over Pajamas Jumpsuit - Christmas Union Suit with Hood and Pockets for Men and Women (XX-Large) Multicolor,1,AMZ-PG-APP-TOO-SMALL
114-4771144-1154629,01/29/25,B01LBRLDX8,100576BROWN-XL,Costume Agent Pirate Boots Adventure Footwear Halloween Costume Cosplay Accessory - Brown - X-Large - Pirate Carribean Pirate Boot Men - Men's Tall Boots - Mens Cosplay Boots,1,AMZ-PG-APP-TOO-LARGE
112-3881170-4245807,01/28/25,B0BHMCWYLD,PABR029-PabstSweater-XL,Mad Engine Pabst Fair Isle Beer Adult Unisex Holiday Ugly Christmas Sweater Multicolored,1,CR-UNWANTED_ITEM
111-7217770-3217033,01/28/25,B0DHYNB34T,UF24US249-GrinchSherpaSuit-S,The Grinch Sherpa Union Suit with Head Zipper Adult Halloween Costume Cosplay for Men and Women (Small),1,DID_NOT_LIKE_FABRIC
113-8920292-1310652,01/28/25,B0CJYKWD1V,221027-ElfCostume-3XL,Christmas Elf Deluxe Complete Costume Set Halloween Costume Cosplay,1,CR-DAMAGED_BY_FC
113-1854706-1465031,01/28/25,B07KPNLKVD,ChestSweaterUCS1-XXL,"Costume Agent Chest Nuts Snowflakes Christmas Tree Adult Ugly Christmas Sweater (Chest Sweater, XX-Large)",1,CR-SWITCHEROO
113-7277517-2680200,01/28/25,B07H43S8R5,ElvisGlasses001-Gold,Costume Agent Adult Halloween Elvis Costume Cosplay Accessory Glasses (Gold),1,CR-UNWANTED_ITEM
112-3103687-2645856,01/28/25,B0DJDHVFMS,NB313MPTTV-NightmareXmasPants-L,The Nightmare Before Christmas Jack Skellington Snowflakes All Over Mens Holiday Lounge Pants - Officially Licensed (Large),1,AMZ-PG-APP-TOO-LARGE
112-6455626-7143432,01/28/25,B0CD8711NG,NDGR003-PinkLadiesJacket-M,Mad Engine Grease Pink Ladies Costume Jacket 50s Outfit Halloween Cosplay for Womens,1,AMZ-PG-APP-TOO-SMALL
111-7916525-8406667,01/28/25,B0DFK823KW,210554-SantaSleigherUCS-XXL,UglyChristmasSweater Rock and Roll Santa Claus Guitar Sleigher Knitted Multicolor,1,AMZ-PG-APP-TOO-SMALL
114-6147860-5770660,01/28/25,B09V8XV21N,nwo002N-L,Costume Agent New World Wrestling Adult Black T-Shirt Halloween Costume Cosplay,1,AMZ-PG-APP-TOO-LARGE
114-5623045-0029834,01/28/25,B0CD8711NG,NDGR003-PinkLadiesJacket-M,Mad Engine Grease Pink Ladies Costume Jacket 50s Outfit Halloween Cosplay for Womens,1,CR-MISSED_ESTIMATED_DELIVERY
114-5623045-0029834,01/28/25,B0CD8711NG,NDGR003-PinkLadiesJacket-M,Mad Engine Grease Pink Ladies Costume Jacket 50s Outfit Halloween Cosplay for Womens,1,CR-MISSED_ESTIMATED_DELIVERY
111-0662530-1321844,01/28/25,B00OG9ED90,usa002-L,USA American Flag Lounge Pants Pajamas (Large),1,DID_NOT_LIKE_FABRIC
112-2718359-3180262,01/28/25,B0DJ1B32FH,MF24US207-SantaGrinchSuit-M,Grinch with Santa Hat Face All Over Pajamas Jumpsuit - Christmas Union Suit with Hood and Pockets for Men and Women (Medium) Multicolor,1,AMZ-PG-APP-TOO-LARGE
113-4823893-8486631,01/28/25,B0DHYMYCJY,UF24US249-GrinchSherpaSuit-L,The Grinch Sherpa Union Suit with Head Zipper Adult Halloween Costume Cosplay for Men and Women (Large),1,DID_NOT_LIKE_COLOR
111-6357514-5105869,01/28/25,B01JGYNNYU,biglpants001-L,Costume Agent The Dude Lebowski Movie Character Pajama Pants Halloween Costume Cosplay Multicolor,1,CR-UNWANTED_ITEM
113-6916573-0810626,01/28/25,B07NSG385L,ILoveXmasUCS-XXL,Costume Agent I Love Xmas HOHOHO Light Up (LED) and Bells Ugly Christmas Sweater - White (XX-Large),1,CR-DEFECTIVE
111-8602260-1833833,01/28/25,B09HJJNTGL,220079-SharkChubSuitBlue-YOUTH,"Costume Agent Shark Chub Suit Inflatable Adult Halloween (Youth, Blue)",1,CR-DEFECTIVE
112-9015559-2757836,01/28/25,B07L1DLGK5,GrinchUnionSuit-Children-10/12,MJC Grinch Family Faces Christmas Green and White Kids Pajama Union Suit - 10/12,1,CR-DEFECTIVE
112-9015559-2757836,01/28/25,B07L1C4237,GrinchUnionSuit-Adult-S,MJC Grinch Family Faces Christmas Green and White Pajama Union Suit,2,CR-QUALITY_UNACCEPTABLE
114-4069238-8334620,01/28/25,B0BM556HXB,NDSS0K5M-PineappleHousePants-XL,Mad Engine Spongebob Squarepants Pineapple House Lounge Pants - X-Large - Cartoon Pajama Pants - Christmas Pajama Pants - Funny PJ Pants,1,AMZ-PG-BAD-DESC
114-6754782-6965066,01/28/25,B0CKXZFZZF,103057-BernieDoll-OS,Costume Agent Weekend at Uncle Bernie's Inflatable Doll with Air Pump Halloween Costume Cosplay Accessory,1,CR-MISSED_ESTIMATED_DELIVERY
114-0923938-3066666,01/28/25,B0DDDFFWYD,GDSA2851TV-GratDeadPants-3XL,Ripple Junction Grateful Dead Steal Your Face Adult Sleep Lounge Pants,1,AMZ-PG-APP-TOO-SMALL
112-7500542-5554652,01/28/25,B01JGYNF7K,biglpants001-S,Costume Agent The Dude Lebowski Movie Character Pajama Pants Halloween Cosplay Multicolor,1,AMZ-PG-APP-TOO-SMALL
112-0185868-1891447,01/28/25,B01JGYNWVO,biglpants001-M,Costume Agent The Dude Lebowski Movie Character Pajama Pants Halloween Costumes Cosplay Multicolor,1,AMZ-PG-APP-TOO-LARGE
112-0100782-2217839,01/28/25,B0034JN4UC,frankie002-S,Frankie Says Relax Adult White Distressed T-Shirt Tee,1,AMZ-PG-APP-TOO-SMALL
114-2202842-6541068,01/28/25,B0BK21WJFH,267345-GrinchPJPants-L,MJC Adult Unisex Smiling Grinch All Over Santa Hat Christmas Pajama Lounge Pants,1,AMZ-PG-APP-TOO-LARGE
114-2202842-6541068,01/28/25,B0DHYKDGF1,UF24PO206-GrinchPoncho-OS,Grinch Costume Big Face Green Oversized Giant Blanket Hoodie Christmas Sleep Poncho with Hood Halloween Cosplay Extra Comfy for Lounging - One Size,1,CR-MISSED_ESTIMATED_DELIVERY
114-5066279-4970613,01/28/25,B09K4QGXZ2,SquidGameSuit-GREEN-240-M,Green Game Suit with Number Patch Track Jacket and Pants Adult Halloween Costume Cosplay,1,AMZ-PG-APP-TOO-SMALL
113-5993063-2485806,01/28/25,B0CJYZS6TF,221015-ChaseAttic-OS,Costume Agent Vacation Christmas Movie Clark Attic Complete Outfit Set Halloween Costume Cosplay,1,AMZ-PG-APP-TOO-LARGE
113-5993063-2485806,01/28/25,B0CJYZS6TF,221015-ChaseAttic-OS,Costume Agent Vacation Christmas Movie Clark Attic Complete Outfit Set Halloween Costume Cosplay,1,AMZ-PG-APP-STYLE
112-5264001-2051423,01/28/25,B0026PJK2Q,bigl012-M,The Big Lebowski Kaoru Betto Baseball Raglan T-Shirt (Adult Medium) Brown,1,AMZ-PG-APP-TOO-SMALL
112-6974065-3511432,01/28/25,B0026POOT0,bigl012-XL,The Big Lebowski Kaoru Betto Baseball Raglan T-Shirt (Adult X-Large) White,1,AMZ-PG-APP-TOO-LARGE
114-4864225-1406647,01/28/25,B004FSCI1W,pineappleex001-M,TV Store Pineapple Express Saul Silver Shark Eating Kitten Gray Adult T-shirt Tee (Medium),1,DID_NOT_LIKE_COLOR
111-1708226-0403445,01/28/25,B07FWF7W8Z,BoxingRobe-Red,Costume Agent Halloween Costume Boxing Robe with Hood Cosplay Red,1,AMZ-PG-APP-TOO-LARGE
111-7742516-6420220,01/28/25,B076HCF761,RacineBellsCostumeDressWomens-S/M,Costume Agent Women's Racine Belles AAGPBL Baseball Dress (Yellow),1,CR-UNWANTED_ITEM
111-1874301-3140236,01/28/25,B0CK4CDW85,RWTM0I2-YodaSweatshirtSet-5T,Mad Engine Star Wars Yoda Grogu The Cuteness is Strong in This One Green Sweatshirt and Pants Set (5T),1,CR-UNWANTED_ITEM
114-1614086-1801816,01/28/25,B0DHYMYCJY,UF24US249-GrinchSherpaSuit-L,The Grinch Sherpa Union Suit with Head Zipper Adult Halloween Costume Cosplay for Men and Women (Large),1,AMZ-PG-APP-TOO-LARGE
113-0157421-7242627,01/28/25,B09KDM4G2S,220801-NasaSkiSuit-S,Costume Agent NASA Ski Suit One Piece Waterproof Windproof Insulated Snowboard Men's Women's Jumpsuit,1,CR-UNWANTED_ITEM
114-1639195-2196264,01/28/25,B001OLZIV0,ledzeppelin002-XXL,Led Zeppelin 1977 American Tour Black Mens T-Shirt Tee,1,AMZ-PG-APP-TOO-SMALL
112-3542780-5838607,01/28/25,B0DHYMYCJY,UF24US249-GrinchSherpaSuit-L,The Grinch Sherpa Union Suit with Head Zipper Adult Halloween Costume Cosplay for Men and Women (Large),1,CR-MISSED_ESTIMATED_DELIVERY
113-7357346-7286602,01/28/25,B00FI3ONI4,bigl032-L,Costume Agent Lebowski Jeffrey The Dude Zip Up Costume Cardigan Sweater Halloween Cosplay Tan,1,AMZ-PG-APP-TOO-LARGE
113-6048628-1556223,01/28/25,B0CHK2KN72,MachoManGlasses-ZigZagWhite,Costume Agent Macho Wrestler Man Madness Glasses Halloween Costume Accessory Cosplay Sunglasses (Zig Zag White),1,CR-UNWANTED_ITEM
113-1270959-2505843,01/28/25,B0044M7KWQ,hangoverglasses,"Costume Agent Alan from Hangover Glasses, Hangover Costumes for Halloween and Cosplay - Brown",1,CR-DEFECTIVE
113-2240027-8138638,01/28/25,B09HWB69D5,220805-WandavisionVision-XL,Wanda & Vision Hoodie Witch Halloween Costume Jacket Superhero Cosplay,1,CR-DEFECTIVE
113-2118550-7057806,01/28/25,B00F59HBVC,super010-2T,DC Comics Superman Logo Boys Blue Zip Up Costume Hoodie Sweatshirt (Toddler 2T),1,CR-UNWANTED_ITEM
112-9367704-7403411,01/28/25,B0CKKNTWHD,OESM33-SnowyDunderSweater-2XL,Ripple Junction The Office Dunder Mifflin Paper Company Merry Snow Ugly Chritsmas Sweater,1,CR-MISSED_ESTIMATED_DELIVERY
113-1486342-0914624,01/28/25,B07XYDVKMS,100600-BlueVikingHelmet,Costume Agent Viking Furry Blue Hat Helmet Adult Halloween Costume Accessory,1,DID_NOT_LIKE_FABRIC
113-0560594-1195459,01/28/25,B0CLHGRSBZ,DRS0011-GrinchSantaHatSwtr-M,Junk Food Grinch Head Santa Hat Wreath Snowflakes Ugly Christmas Sweater Green,1,CR-UNWANTED_ITEM
111-3527707-2939461,01/28/25,B0BKR4JGLP,NDLA0FGMBJ-AvatarPanelPants-S,Mad Engine Adult Unisex Avatar The Last Airbender Animated TV Series Jogger Lounge Pants,1,AMZ-PG-APP-TOO-LARGE
111-4937300-1793055,01/27/25,B0DGM1RZYQ,WB2541-HQLittleMonsterPJSET-XL,COCO BRANDS Suicide Squad Harley Quinn Daddys Little Monster Shirt and Shorts Pajama Set Halloween Costume Cosplay Officially Licensed (X-Large) Multicolor,1,AMZ-PG-APP-TOO-SMALL
111-9694282-3866604,01/27/25,B0B7BRGMXT,peanuts044N-M,Costume Agent Charlie B Halloween Polo Shirt Yellow Zig Zag T-Shirt Cosplay,1,CR-UNWANTED_ITEM
114-6855302-8672248,01/27/25,B01LBRL97I,100576BROWN-S,Costume Agent Pirate Boots Adventure Footwear Halloween Costume Cosplay Accessory - Brown - Small - Pirate Carribean Pirate Boot Men - Men's Tall Boots - Mens Cosplay Boots,1,AMZ-PG-APP-TOO-LARGE
113-3851193-0877041,01/27/25,B076HFKLDY,NL029-ChristmasVacationPajamaSet-XL,"Briefly Stated National Lampoon's Dinosaur Christmas Vacation Pajamas Set | Perfect for Ugly Sweater Parties, Matching Xmas Pajamas for Family",1,AMZ-PG-APP-TOO-SMALL
113-9270402-9674668,01/27/25,B0CD8711NG,NDGR003-PinkLadiesJacket-M,Mad Engine Grease Pink Ladies Costume Jacket 50s Outfit Halloween Cosplay for Womens,1,AMZ-PG-APP-TOO-LARGE
111-2079270-4739430,01/27/25,B0CD8711NG,NDGR003-PinkLadiesJacket-M,Mad Engine Grease Pink Ladies Costume Jacket 50s Outfit Halloween Cosplay for Womens,1,CR-UNWANTED_ITEM
111-0720201-6825819,01/27/25,B0CG7FGQX4,CY034-ChristmasStoryUnionSuit-5X,Briefly Stated Adult Unisex A Christmas Story Bunny Union Suit Pajama Costume (5X-Large),1,CR-DAMAGED_BY_FC
111-0720201-6825819,01/27/25,B0CG7FV5DX,CY034-ChristmasStoryUnionSuit-4X,Briefly Stated Adult Unisex A Christmas Story Bunny Union Suit Pajama Costume (4X-Large),1,CR-DEFECTIVE
113-8002298-2550617,01/27/25,B0B4F8PR2W,CousinEdRobe-Hat-SET,"Costume Agent Cousin Eddie Christmas Vacation White Robe, & HAT Halloween Cosplay",1,CR-UNWANTED_ITEM
112-1690929-2448244,01/27/25,B08KWKFJGB,220082-VioletChubSuit-ADULT,Violet Chub Suit Inflatable Halloween Costume (Adult),1,AMZ-PG-APP-TOO-LARGE
114-5744598-1558664,01/27/25,B0DJ19H2NK,MF24US207-SantaGrinchSuit-2XL,Grinch with Santa Hat Face All Over Pajamas Jumpsuit - Christmas Union Suit with Hood and Pockets for Men and Women (XX-Large) Multicolor,1,AMZ-PG-APP-TOO-SMALL
113-7026088-9242632,01/27/25,B09DXLTMF3,PRangersShirtYouth-Black-L,"Power Rangers Mighty Morphin Black Boys Youth Armor Costume T-Shirt (LG, Black)",1,AMZ-PG-APP-TOO-SMALL
113-8827961-6798630,01/27/25,B0058UZNEA,stepbros004-XXL,Step Brothers Sailing Bahamas Turquoise Blue Adult T-Shirt Tee (Adult XX-Large),1,AMZ-PG-APP-TOO-SMALL
113-9950069-5601005,01/27/25,B01JSI170Q,beaviscostume-M,Costume Agent Adult Beavis Set (Medium) Multicoloured,1,CR-UNWANTED_ITEM
113-9950069-5601005,01/27/25,B01JSI0XQU,buttheadcostume-L,Costume Agent Adult Butthead Set (Large) Multicoloured,1,CR-UNWANTED_ITEM
114-0891232-9578645,01/27/25,B01LYKP3ZX,wrestlingboots-SB,Pro Wrestling Costume Boots Super Hero Wrestler Halloween Cosplay Black,1,AMZ-PG-BAD-DESC
111-4102644-5668267,01/27/25,B07XYDVKMS,100600-BlueVikingHelmet,Costume Agent Viking Furry Blue Hat Helmet Adult Halloween Costume Accessory,1,AMZ-PG-APP-STYLE
111-2732242-3433835,01/27/25,B0B9CC7R59,220888-ToddMargoShinySuit-L-XL,Costume Agent Todd & Margo Shiny Silver Workout Top and Pants Deluxe Sweatsuit Set for Halloween & Cosplay,2,CR-UNWANTED_ITEM
112-2084954-5507446,01/27/25,B076HFSX43,CY034-ChristmasStoryUnionSuit-L,Briefly Stated A Christmas Story Bunny Union Suit Pajama Costume (Adult Large),1,CR-ORDERED_WRONG_ITEM
112-9323832-6571437,01/27/25,B09HJJNTGL,220079-SharkChubSuitBlue-YOUTH,"Costume Agent Shark Chub Suit Inflatable Adult Halloween (Youth, Blue)",1,AMZ-PG-BAD-DESC
111-0640284-6689835,01/27/25,B00E5MZZ3G,sbb015-2XL,Saved By The Bell Kelly Kapowski Bayside Off The Shoulder Gray Juniors/Ladies Sweatshirt,1,AMZ-PG-APP-TOO-SMALL
114-7366767-9544200,01/27/25,B07HHHWTBS,CousinEddieWhiteRobe-220703,Vacation Christmas Movie Cousin Eddie White Robe with Belt Halloween Costume Cosplay (Includes Robe and belt Only),1,AMZ-PG-APP-STYLE
112-0993040-0958635,01/27/25,B09L5C79M3,DJSA2637TV-DeathrowPants-2XL,Ripple Junction Deathrow Records Logo Toss Adult Sleep Lounge Pants,1,AMZ-PG-APP-TOO-SMALL
114-7249875-7196257,01/27/25,B01LBRLGPS,100576BLACK-M,Caribbean Movies Pirate Boots Adventure Footwear Halloween Costume Cosplay Accessory Black,1,CR-DEFECTIVE
112-4428518-2339406,01/27/25,B0BHZS7V1W,103008-ElfShoes-10-11,Costume Agent Buddy The Elf Christmas Costume Shoes - Size 10-11 - Women & Mens Jester Shoes - Elf Boots - Buddy the Elf Christmas Decorations - Buddy Shoes for Men & Women,1,CR-DEFECTIVE
114-8774125-7022620,01/27/25,B004498FD2,toystory005-XXXL,Toy Story Woody Cowboy Costume Banana Multicolor Adult T-shirt Tee 3X,1,AMZ-PG-APP-TOO-LARGE
114-9998209-6711411,01/27/25,B01LXLIG0A,wrestlingboots-XLY,Pro Wrestling Costume Boots Super Hero Wrestler Halloween Cosplay,1,CR-MISSED_ESTIMATED_DELIVERY
113-7533229-4987429,01/27/25,B000WAWH68,boratthong,Smiffys Officially Licensed Borat Mankini,1,CR-UNWANTED_ITEM
111-1754560-4924201,01/27/25,B002PINI86,kennywig,Kenny Powers Eastbound & Down Costume Wig Black,1,CR-UNWANTED_ITEM
111-5373019-4788217,01/27/25,B09V964G5D,nwo002N-XL,Costume Agent New World Wrestling Adult T-shirt - X-Large - NWO Shirts for Men & Women - NWO Tee Shirt for Men - WWE Shirts for Men - Wrestling Shirts - WWE T Shirts,1,CR-MISSED_ESTIMATED_DELIVERY
113-4156133-6337044,01/27/25,B0BB8496WY,CVSM2384TV-ThresholdSweater-XL,Christmas Vacation The Griswolds Threshold of Hell Clark Santa Hat Ugly Christmas Sweater Multicolored,1,CR-UNWANTED_ITEM
114-2345181-5647407,01/27/25,B0DHYMFF8F,UF24US249-GrinchSherpaSuit-M,The Grinch Sherpa Union Suit with Head Zipper Adult Halloween Costume Cosplay for Men and Women (Medium),1,AMZ-PG-APP-TOO-LARGE
113-1698971-0974657,01/27/25,B002M3WNWG,junk187-XXL,Junk Food The Hangover Human Tree Men's T-Shirt Multicolored - XX-Large - Alan Human Tree Shirt - Funny Las Vegas Shirts,1,AMZ-PG-APP-TOO-SMALL
111-7140600-0607434,01/27/25,B08GYCG2S7,220757-AverageJoesWomensSet-M,Costume Agent Dodgeball Average Joe's Halloween Costume For Women,1,CR-UNWANTED_ITEM
113-4162151-3122635,01/27/25,B005Y4I6VW,fearloathingglasses,Costume Agent Fear and Loathing in Las Vegas Hunter S. Thompson Costume Sunglasses - Classic Large Metal Frame Sun Glasses for Adult,1,CR-DEFECTIVE
112-2968884-8357846,01/27/25,B000ANPOT4,hulk001r-M,"Hulk Hogan ""hulkamania"" T-shirt Red, Medium",1,CR-UNWANTED_ITEM
111-0261206-4698629,01/27/25,B08G5D2BHV,220780-TigerKingJacket-XL,Costume Agent Cowboy Traditional Leather Western Jacket with Fringe Halloween Costume Brown,1,AMZ-PG-APP-TOO-LARGE
114-4040495-6566604,01/27/25,B0D153L1N4,220884-GoodBurgerCostume-XS,Adult Unisex Funny Good Burger Movie Deluxe Halloween Cosplay Costume Set (X-Small),1,CR-UNWANTED_ITEM
112-7356332-4178663,01/27/25,B0DJ18B6YZ,MF24US207-SantaGrinchSuit-XL,Grinch with Santa Hat Face All Over Pajamas Jumpsuit - Christmas Union Suit with Hood and Pockets for Men and Women (X-Large) Multicolor,1,CR-UNWANTED_ITEM
112-1821202-1035410,01/27/25,B00U0HOOFK,OESM2439TV-DunderMifflinSweater-M,Ripple Junction The Office Dunder Mifflin Blue Ugly Christmas Sweater (Medium),1,AMZ-PG-APP-TOO-LARGE
112-1817415-3742605,01/27/25,B07D5H96YC,snlbearsVESTsweater-XXL,SNL Da Bears Chicago Adult Vest Sweater Navy,1,AMZ-PG-APP-TOO-LARGE
111-8783184-3305051,01/27/25,B0BK1T18VY,267345-GrinchPJPants-S,MJC Adult Unisex Grinch Smiling All Over Santa Hat Ugly Christmas Pajama Lounge Pants,1,AMZ-PG-APP-TOO-LARGE
112-6548035-3022611,01/26/25,B001GJQQY8,ApolloShorts-S,Rocky Balboa Apollo Movie Boxing American Flag Shorts (Small),1,CR-QUALITY_UNACCEPTABLE
111-4181442-8998657,01/26/25,B07HKSCRQJ,CVGriswoldLoungePants-WR0319-52-M,National Lampoon's Griswold Family Christmas Vacation Fair isle Lounge Pants (Adult Medium),1,AMZ-PG-APP-TOO-LARGE
114-3809838-8837868,01/26/25,B00E5MZZ3G,sbb015-2XL,Saved By The Bell Kelly Kapowski Bayside Off The Shoulder Gray Juniors/Ladies Sweatshirt,1,AMZ-PG-APP-STYLE
113-9932002-7138669,01/26/25,B0CG2H2WTQ,103059-TurkeyHatGlasses,Costume Agent Turkey Head Mask and Glasses Set from Sitcom Thanksgiving Funny Bird Animal Halloween Costume Accessory Cosplay,1,AMZ-PG-APP-TOO-SMALL
111-6576018-2129029,01/26/25,B0CJVLPKZH,DSMN-MensMonstersJacket-3XL,Mad Engine Monsters University Varsity Jacket Blue and White MU Logo Halloween Costume Cosplay,1,AMZ-PG-APP-TOO-SMALL
113-4964032-3132254,01/26/25,B09QLBXYNY,220751-SethSuperbad-3XL,"Costume Agent Superbad Seth Halloween Costume Cosplay Shirt Pants Complete Set (Navy, 220751-SethSuperbad-3XL)",1,CR-UNWANTED_ITEM
111-7152486-5359436,01/26/25,B07FDNBHMB,LukeWig-1200,Luke Sky Deluxe Costume Accessory White Wig and Beard Set,1,AMZ-PG-APP-TOO-SMALL
112-9033110-7036250,01/26/25,B0B94VX8ZB,DazedConfusedTedNugent-Shirt-S,Costume Agent Dazed Confused David Halloween T-Shirt White,1,CR-UNWANTED_ITEM
112-9502420-2750611,01/26/25,B0BC2C8BWK,220936-LegLampSkirt-L-XL,Costume Agent Xmas Movie Women's Christmas Leg Lamp Skirt Halloween Cosplay,1,AMZ-PG-APP-STYLE
111-1512936-2127425,01/26/25,B014Q6VNV8,caddyshackhat003,Ripple Junction Caddyshack Movie Carl Spackler Character Camo Golf Bucket Hat,1,AMZ-PG-APP-TOO-LARGE
